"Date","Title","Content","qwen_lora2_情绪提取"
"2019-01-25 21:28:39","南航与英航将扩大代码共享 与寰宇一家成员互动频繁","南方航空(600029)官微1月25日消息，南方航空与英国航空1月23日在伦敦宣布达成合作意向，正式签署合作谅解备忘录。双方计划在年内扩大代码共享合作及实施互惠常旅客合作项目，提升旅客获益。未来双方将在南航及英航执飞的中英主干线开展代码共享合作，并拓展国内代码共享合作范围。此外，双方还计划开展常旅客合作，使双方的会员获得里程累积及兑换的机会。南方航空于去年年底宣布将推出天合联盟后，与寰宇一家航空公司互动频频。2018年11月28日，南方航空与寰宇一家创始成员之一的美国航空签署合作协议，通过扩大代码共享以及常旅客合作等领域的商务和战略合作，为中美旅客提供更便捷的出行体验；2018年12月19日，南方航空发布消息称，与芬兰航空在广州签署了战略合作谅解备忘录，并将在获得监管部门批准后展开代码共享合作。1月2日，南方航空又发布公告显示，公司收到股东卡塔尔航空的《简式权益变动报告书》，卡塔尔航空通过沪港通在上交所的集中交易系统购买南方航空A股股票，并通过香港联合交易所有限公司集中交易系统购买南方航空H股股票，从而将持有南方航空的比例升至5%，构成举牌。自宣布退出天合联盟的消息后，业内猜测南方航空加入寰宇一家的可能性加大。长城证券表示，如果南方航空加入寰宇一家，可部分承接过去国泰航空的寰宇一家盟内业务，对自身业务发展有利，也利于三大航在国内业务与联盟业务上的分工更加明确，形成三大航分属于三个联盟的格局，对各家深耕自身基地，承接各自盟内国际中转联程业务有促进作用，业务重叠与竟争降低，利于行业长期发展。但也有业内人士分析指出，航司去联盟化的趋势之下，南方航空今后的双边甚至多边合作将更加自由。","该文本情感是积极的。"
"2019-01-25 15:08:11","南航再与寰宇一家成员英航扩大代码共享合作","1月25日，中国南方航空(简称“南航”)官方微博发布消息称，南航与英国航空(简称英航)在伦敦宣布达成合作意向，正式签署合作谅解备忘录。双方计划在年内扩大代码共享合作及实施互惠常旅客合作项目，提升旅客获益。受此利好消息影响，南航A股盘内微涨1.01%。南航称，未来双方将在南航及英航执飞的中英主干线开展代码共享合作，并拓展国内代码共享合作范围。此外，双方还计划开展常旅客合作，使双方的会员获得里程累积及兑换的机会。据悉，此前在2017年12月，南航已与英航正式建立代码共享合作伙伴关系。截至目前为止，双方代码合作航线共10条，包括南航承运的浦东-沈阳、浦东-哈尔滨、浦东-长春、北京-大连、北京-长春以及英航承运的伦敦-爱丁堡、伦敦-格拉斯哥、伦敦-曼彻斯特、伦敦-纽卡斯尔以及伦敦-贝尔法斯特。2018年7月，据彭博社报道，南航与英航曾商谈在中英之间航班上进行联营合作。继与寰宇一家成员美国航空、芬兰航空和卡塔尔航空扩大合作后，南航再与寰宇一家成员英航扩大代码共享等合作。据悉，英航是世界上最大的航空公司之一，同时也是寰宇一家的创始会员之一。主要枢纽是伦敦希思罗机场及伦敦盖特威克机场，航线网络覆盖全球200多个目的地。目前每日各有1个航班由北京出发以及每周10个航班由上海出发直飞伦敦。对南航来说，接连与多家航司扩大代码共享等合作，可见退出天合联盟之后的双边甚至多边合作更加自由。不断与寰宇一家成员加深合作，也让业内一直传言称南航将加入寰宇一家，但南航只是强调与先进航司合作，并未正面回应。业内专家指出，航司去联盟化的趋势之下，南航是否入盟要看南航在联盟内博弈的成本和收益来决定，自身的利益和发展才是最重要的考虑因素。","情感倾向是积极。"
"2019-01-24 14:44:33","南航推出特色餐食 温暖旅客春节归家路","1月23日，春运第3天。全天南航计划执行航班1900余班，承运旅客超过30万人次。记者从南航了解到，春运航班上，南航推出了新研发的“南航大碗粥”以及韩式酱烧牛肉、番茄牛腩拼肉片饭、水煮肉片等特色餐食。温暖旅客春节归家路。据了解，从除夕到年初二，南航还将为旅客提供具有美好祝愿和年味的餐食。在经济舱配备油饺、笑口枣、麻团、金币巧克力等带有年味的小食品。广州出发航班明珠经济舱中配送具有岭南风味的腊味饭。头等舱和公务舱餐食将配送水饺，并推出具有岭南特色的“大盆菜”。为确保餐食卫生、安全，航空餐食生产过程有着严格的执行操作规范。以禽蛋类加工为例，经清洗消毒的蛋类，必须在24小时内使用完。餐食热加工环节，生产人员在进行烹制时，须控制加工餐食的烹制温度和持续时间。餐食装配时，必须摆好餐谱，对食品、餐具进行检查，校对是否符合餐谱要求。装配组装完的餐食将被推送到指定冷库存放。在生产车间，有专人负责现场监督检查，确保餐食生产过程符合食品安全国家标准。餐食装车配送前，航机部门将检查食品车辆，保证车厢温度在不超过10℃，食品出库温度不超过5℃。餐食上按照冷链控制要求压放干冰、套保温罩后装入餐车，配送至航班上。","该文本情感是积极的。"
"2019-01-10 17:52:23","厦航董事长车尚轮届满退休继任者暂未确定","今日(1月10日)上午，厦门航空(以下简称厦航)召开干部会，会上，福建省委组织部和南航党组宣布了厦航党委书记、董事长车尚轮届满到期退休的消息。关于接任者，厦航方面向记者表示，目前尚未公布，将由现任厦航总经理赵东主持工作。厦航成立于1984年，为南方航空控股子公司。车尚轮于2009年加入厦航，在此之前，他担任南方航空党委常委，北京分公司总经理、党委副书记。公开资料显示，在车尚轮执掌厦航的十年间，厦航的飞机数量从43架增长至210架，航线从2009年的40多条发展到如今的500多条，其中已陆续开通11条洲际航线。","该文本情感是中性的。"
"2019-01-09 16:49:54","南航航班出现短时通讯故障决定返航 已正常降落","南航深圳分公司今日通过官方微博发布通报称，1月9日，南航CZ6763航班(深圳-洛阳-呼和浩特，14:42起飞)在飞行途中飞机出现短时通讯故障信息。为确保飞行安全，机组按照操作程序决定返航。飞机已于15:30正常降落深圳机场，机务工程人员正在对飞机进行检查维护。南航深圳分公司表示，将另调换飞机执行该航班。对旅客出行造成不便，深表歉意。（文章来源：中国新闻网）","以上文本情感是中性的。"
"2019-01-09 13:16:55","南航获卡塔尔航空增持 能否深度合作尚待观望","南航受卡塔尔航空增持消息带动，股价连续上扬。股权合作之后，虽然南航暂时并未表露出进一步加深合作的意图，但全球“买买买”的卡塔尔航空却十分看好中国民航市场的增量。南航获卡塔尔航空增持至5% 股价上扬1月7日，南方航空A股涨幅达到2.78%，收盘价从1月2日的6.58元/股升至7.03元/股。自1月3日以来，南航A股连续三日上涨，涨幅一度达到3%。股价上扬，是受到1月2日晚卡塔尔航空增持南航的消息带动。根据1月2日南航发布的公告显示，2018年12月28日，卡塔尔航空买入南航8600股A股及6000股H股，加上此前持有的股份，卡塔尔航空对南航的持股比例增至5%，同时卡塔尔航空表示考虑在未来12个月内进一步增持南航股份。对于卡塔尔航空的增持，南航发布回复声明称，对卡塔尔航空的支持表示感谢，但未披露双方进一步的合作意向。南航方面对外表示双方目前的合作还在SPA(特殊比例分摊协议，共享特定航线的运力)的初步合作阶段，暂时还不会深入合作。对南航来说，引入航企投资已经不是第一次。2017年3月，南航引入同样是外航的美国航空，持股2.68%，随后又从股权合作延伸到代码共享、航线联营等业务合作，意图提高双方在中美航线的话语权。2018年民航混改加速，2018年9月春秋航空8.46亿元入股南航，占南航A股股本的1.63%，并表示双方将探索在低成本航空业务模式上合作的可能性。双方航线互补性差，深度合作不易达成本次卡塔尔航空入股南航，与之前的航企入股有所不同。卡塔尔航空是直接通过A股和H股这类二级市场购买股票，而非像美航是先与南航签署合作协议、然后认购股份的方式入股。对此，民航专家林智杰直言，卡塔尔航空入股南航是在二级市场上进行的公开收购，并不是通过增资扩股的方式，所以钱没有直接落到南航的口袋里。与此同时，林智杰指出卡塔尔航空和南航进一步深度合作最大的问题是航线网络的互补性相对比较差，同时存在航线的竞争关系。据了解，卡塔尔航空在中国已经开通了包括北京、上海、广州、成都及重庆飞往多哈枢纽的航线，并希望可以将中国旅客通过多哈中转到欧洲、非洲等区域。但是南航目前从广州飞往多哈的航线很少，并且南航作为全球网络型的航空公司，也同样看重洲际市场。林智杰对记者表示，卡塔尔航空希望中国旅客通过多哈中转去欧洲，南航则希望国内旅客通过广州中转去欧洲，在这方面，广州和多哈是相互竞争的两大枢纽。民航专家綦琦的看法不同，他对记者表示，卡塔尔航空入股南航之后会进一步进行业务领域的合作，比如代码共享等，提升南航旅客往返中东的便利性，借助卡塔尔航空让旅客更加方便地到达欧洲和非洲的非南航航点。- 预测","该文本情感是积极的。"
"2019-01-03 20:11:41","卡塔尔航空增持南航 晋身重要股东","在美国航空入股南方航空之后，南方航空(600029.SH)近日又获得了卡塔尔航空公司的增持，后者通过二级市场交易买入南航股票，最新持股比例已达5%。1月2日，南航公告称，公司股东卡塔尔航空2018年12月28日通过沪港通在上交所的集中交易系统购买8600股公司A股股票，并通过港交所集中交易系统购买6000股公司H股股票。根据《简式权益变动报告》，卡塔尔航空已于2018年11月、12月分批购入南航A股4.3亿股和H股1.8亿股，合计占南航总股本的4.9999%。此次交易权益变动后，卡塔尔航空合计持有的南航股份达5%，构成举牌。经济观察网记者查阅南航2018年第三季度报发现，截止2018年第三季度，南航排名前十的股东包括中国南方航空集团有限公司(持股36.92%)、香港中央结算(代理人)有限公司(14.27%)、南龙控股有限公司(13.32%)、中国航空油料集团有限公司(4.06%)等。公开资料显示：南龙控股是南航集团在香港的全资子公司，香港中央结算(代理人)有限公司实为南航H股股东账户总和。因而南航第二大股东为中国航空油料集团有限公司，持股4.06%。此次交易后，卡塔尔航空持股份额将超过中国航空油料集团有限公司，晋升为南航第二大股东。卡塔尔航空称，此次收购南航股份系其战略投资的一部分，拟由此继续增强运营能力和航空网络连接，并考虑在未来12个月内进一步增持南航股份。“卡塔尔航空入股南方航空应是战略投资的意愿。”民航专家綦琦在接受经济观察网记者采访时分析说，从地缘来讲，卡塔尔的航线网络枢纽为多哈，属于一带一路的重要节点，以欧亚非中转旅客为市场主体。而2017年连续断交事件发生，使得中东四国不允许卡塔尔飞机过境，对于多哈网络枢纽造成较大影响。因而，卡塔尔航空以高比例持股南航再谋求双方的业务合作是大概率事件。卡塔尔航空属于寰宇一家的成员，去年10月份有媒体报道称，卡塔尔航空因与盟内成员的矛盾威胁要“退群”。“卡塔尔航空想退出寰宇一家其实说明联盟成员之间的竞争已经很激烈了。”中国民航管理干部学院教授邹建军对经济观察网记者说，粗放式的联盟合作已经逐渐走向破产，跨联盟股权合作与同盟股权合作或将成为航空公司一种新的合作方向。卡塔尔航空为卡塔尔国企，成立于1993年11月22日，属于快速崛起的三大海湾航企之一。近年来，通过在国外资本市场上收购或参股众多国外航空公司的战略，逐步构建起有助于其国际业务迅速扩张的航空股权联盟。公开资料显示，卡塔尔航空目前持有英国航空的母公司国际航空集团20%股份，南美洲LATAM航空集团10%股份。（文章来源：经济观察网）","情感倾向是积极。"
"2019-01-03 06:59:47","卡塔尔航空举牌南方航空","南方航空今日公告，公司股东卡塔尔航空公司于2018年12月28日通过沪港通在上海证券交易所的集中交易系统购买8600股南方航空A股股票，并于同日通过香港联合交易所有限公司集中交易系统购买6000股南方航空H股股票。本次权益变动后，卡塔尔航空持有3.5056%南方航空A股股票，并持有1.4944%南方航空H股股票，合计持有5%公司股份。公告显示，卡塔尔航空本次收购南方航空的股份，系其战略投资的一部分，拟由此继续增强其运营能力和航空网络连接。受限于适用的法律法规，卡塔尔航空可能考虑在未来12个月内进一步增持南方航空的股份。据公告，卡塔尔航空2018年11月以6.1810元/股至7.3179元/股的价格买入3.33亿股南方航空A股股票，以4.3563港元/股至5.4596港元/股的价格买入1.38亿股南方航空H股股票；2018年12月卡塔尔航空又以6.6590元/股至7.6147元/股的价格买入9724.74万股南方航空A股股票，以4.6517港元/股至5.6298港元/股的价格买入4573万股南方航空H股股票。本次权益变动前，卡塔尔航空合计持有南方航空4.9999%股权。截至1月2日收盘，南方航空A股股票报收于6.58元/股，南方航空H股股票报收于4.680港元/股。（文章来源：上海证券报）","情感倾向是积极。"
"2019-01-03 03:52:33","“海湾土豪”举牌南方航空 南航要被拉入“新群”？","卡塔尔航空利用雄厚的资金实力，打造的全球“航空股权联盟”又多了一位新成员——南方航空(600029)。南方航空1月2日晚间公告，公司股东卡塔尔航空2018年12月28日通过沪港通在上交所的集中交易系统购买8600股公司A股股票，并通过港交所集中交易系统购买6000股公司H股股票。本次权益变动前，卡塔尔航空合计持有4.9999%公司股份；权益变动后，卡塔尔航空合计持有5%公司股份。卡塔尔航空可能考虑在未来12个月内进一步增持公司股份。公告称，卡塔尔航空本次收购南方航空的股份，系其战略投资的一部分，拟由此继续增强其运营能力和航空网络连接。南航也是喜接“绣球”，当日即发布声明称，“对卡塔尔航空公司对南航的信任与支持表示衷心感谢。”值得一提的是，卡塔尔航空同时还是寰宇一家航盟成员。如此看来，南航“退群”天合联盟之后，与全球航空公司的合作将更具腾挪空间。刚“退群”卡航就买入卡塔尔航空举牌距离南航宣布“退群”尚不足两月。一个需要关注的细节是，公开资料显示，卡塔尔航空此前买入南航股票的时间正是去年11月~12月。也就是说，南航在宣布退出天合联盟的同时，卡塔尔航空即开始集中买入其股权。此细节再加上卡塔尔航空寰宇一家成员的身份，双方牵手合作的默契已经露出端倪。此外，就在2018年10月份，南方航空申请开通四条国际定期航线，其中有一条航线是，自2019年2月起，开通广州-特拉维夫往返定期客运航线。现在看来，南方航空开辟中东航线的合作方应是寰宇一家成员卡塔尔航空。简单梳理南方航空“退群”始末。2018年11月15日晚间，南方航空发布公告称，公司基于自身发展战略的需要和顺应全球航空运输业合作模式的新趋势，决定自2019年1月1日起不再续签天合联盟协议，2019年内完成各项过渡工作。南方航空的官方口径是“将与全球各地先进航空公司探索建立新型合作伙伴关系”。分析认为南方航空退出天合联盟一方面是因为其在联盟内部的边缘化，另一方面也是自身加速国际化的需求。意在拓展国际化空间相比国内其它两大航，南航的国际化比例并不在前列。财报显示，南方航空2017年国际航线营业收入占比为25.19%，中国国航和东方航空则分别为35.29%和29.92%。南方航空为扩充美国航线，首先选择与寰宇一家的成员美国航空(AA)合作。2017年3月27日，美国航空收购了南航香港上市公司约2亿美元的股份，占股2.68%。同时，美航和南航达成了战略合作协议，包括代码共享，联运协议等一系列商务合作。上述此举意味着，亚洲运输飞机最多和旅客运输量最大的航空公司南航将联手拥有全世界最大机队的美国航空，抗衡星空的中国国航与美联航，天合的东方航空与达美两大组合，争夺中美航线。2018年1月18日起，南航与美国航空正式建立代码共享合作伙伴关系，此举将进一步完善双方在中美市场的航线网络布局。","情感倾向是积极。"
"2019-01-03 01:56:52","南方航空：获卡塔尔航空增持至5% 构成举牌","1月2日晚间，南方航空(600029)发布公告称，公司股东卡塔尔航空通过沪港通购买8600股公司A股股票，并通过港交所购买6000股公司H股股票。权益变动后，卡塔尔航空合计持有5%公司股份，构成举牌。受限于适用的法律法规，卡塔尔航空可能考虑在未来12个月内进一步增持公司的股份。公告显示，2018年11月份及12月份，卡塔尔航空曾多次购入南方航空股份，共持有南方航空4.30亿股A股股份以及1.83亿股H股股份，合计占总股本的4.99%。另外，公告显示，卡塔尔航空还在多家航空公司持有股份，具体来看，持有国泰航空9.99%股份，国际航空集团IAG(英航母公司)20%股份，以及LATAM航空集团10%的股份。据悉，卡塔尔航空由卡塔尔政府全资持有，经营范围为乘客和货物的航空运输(包括航空公司而非旅行社)；货物的装运和卸货；飞机租赁；租用航空运输设备；飞机地面服务。公司称，卡塔尔航空本次收购公司的股份，系其战略投资的一部分，拟由此继续增强其运营能力和航空网络链接。本次权益变动不触及要约收购，也未导致公司控股股东及实际控制人发生变化。业内人士认为，虽然中国市场对卡塔尔航空有不少的吸引力，但从入股方式和网络协同上来看，卡塔尔航空入股南航更像是财务投资。（文章来源：中证网）","情感倾向是中性。"
"2019-01-02 21:44:03","“海湾土豪”举牌南方航空！退群天合联盟 南航被拉入“新群”？","1月2日晚间公告，公司股东卡塔尔航空2018年12月28日通过沪港通在上交所的集中交易系统购买8600股公司A股股票，并通过港交所集中交易系统购买6000股公司H股股票。本次权益变动前，卡塔尔航空合计持有4.9999%公司股份；权益变动后，卡塔尔航空合计持有5%公司股份。卡塔尔航空可能考虑在未来12个月内进一步增持公司股份。公告称，卡塔尔航空本次收购南方航空的股份，系其战略投资的一部分，拟由此继续增强其运营能力和航空网络连接。南航也是喜接“绣球”，当日即发布声明称“对卡塔尔航空公司对南航的信任与支持表示衷心感谢。”值得一提的是，卡塔尔航空同时还是寰宇一家航盟成员。如此看来，南航“退群”天合联盟之后，与全球航空公司的合作将更具腾挪空间。刚“退群”卡航就买入卡塔尔航空举牌距离南航宣布“退群”尚不足两月。一个需要关注的细节是，公开资料显示，卡塔尔航空此前买入南航股票的时间正是去年11月-12月。也就是说，南航在宣布退出天合联盟的同时，卡塔尔航空即开始集中买入其股权。此细节再加上卡塔尔航空寰宇一家成员的身份，双方牵手合作的默契已经露出端倪。此外，就在2018年10月份，南方航空申请开通四条国际定期航线，其中有一条航线是，自2019年2月起，开通广州-特拉维夫往返定期客运航线。现在看来，南方航空开辟中东航线的合作方应是寰宇一家成员卡塔尔航空。简单梳理南方航空“退群”始末。2018年11月15日晚间，南方航空发布公告称，公司基于自身发展战略的需要和顺应全球航空运输业合作模式的新趋势，决定自2019年1月1日起不再续签天合联盟协议，2019年内完成各项过渡工作。南方航空“退盟”的官方口径是“将与全球各地先进航空公司探索建立新型合作伙伴关系”。分析认为南方航空退出天合联盟一方面是因为其在联盟内部的边缘化，另一方面也是自身加速国际化的需求。","情感倾向是积极。"
"2019-01-02 20:44:52","南航：股东卡塔尔航空增持股份至5% 拟未来一年进一步增持","卡塔尔航空小幅增持南航至5%。1月2日，南方航空(600029.SH，01055.HK，NYSE:ZNH)公告称，当日收到股东卡塔尔航空公司的《简式权益变动报告书》。公告显示，12月28日，卡塔尔航空通过沪港通在上海证券交易所的集中交易系统购买南方航空A股股票8600股，并通过香港联合交易所有限公司集中交易系统购买南方航空H股股票6000股，合计14600股，此次权益变动后，卡塔尔航空持有南方航空总股本比例5%，构成举牌。公告称，受限于适用的法律法规，卡塔尔航空可能考虑在未来12个月内进一步增持南方航空的股份。在此次权益变动前，卡塔尔航空共持有南方航空430,027,566股A股股份以及183,318,000股H股股份，合计占南方航空总股本的4.9999%。公告提示，本次权益变动不触及要约收购，不会导致南方航空控股股东及实际控制人发生变化。卡塔尔航空由卡塔尔政府100%持有，除此次举牌南航外，卡塔尔航空还持有香港国泰航空9.99%股权，英国航空母公司国际航空集团(International Consolidated Airlines Group， S.A。)20%股权，南美最大航空公司LATAM航空集团10%股权。对于此次股权收购的目的，公告称，卡塔尔航空本次收购南方航空的股份，系其战略投资的一部分，拟由此继续增强其运营能力和航空网络连接。需要注意的是，卡塔尔航空与南方航空另一重要股东美国航空，均为寰宇一家成员，其中美国航空为创始成员，是全球最大航空公司。美航在南航的混合所有制改革过程中扮演重要角色。2017年3月28日，南航正式与美国航空在广州签署《框架协议》《股份认购协议》及系列商务合作协议。据协议，美航将向南航投资2亿美元，用于认购南方航空拟增发的H股股份。增发完成后，美航取得的H股股份占南航在香港上市H股股份的约8.8%以及总股本的2.7%，南航董事会委任美航的一名人士作为董事会观察员。此次美航入股也被认为是南航在混合所有制改革的重要一步。而目前国际性航空公司联盟分别为寰宇一家、天合联盟和星空联盟，原属于天合联盟的南航已于2018年11月宣布退出联盟，自2019年1月1日起不再续签天合联盟协议。","情感倾向是积极。"
