"Date","Title","Content","qwen_lora2_情绪提取"
"2019-09-03 13:18:28","南航招募旅客 体验9月20日前后首航大兴机场","刚刚，中国南方航空公司在其官方微信公众号面向公众发出首航大兴机场的邀请。其公众号称，南航将于20日前后首航大兴机场。公众号消息称，本次首航将从北京飞往广州。旅客们现在报名便有机会提前抢购首航机票。预订机票后，可获南航大兴首飞纪念邮册及首日封、A380机模等极具纪念意义的首航大礼包，幸运旅客还将享受到首航免费机票。此外，首航当天还有机会体验大兴机场南航专车、轻轨等专属服务。南航表示，旅客从大兴机场出发乘机将更加便捷。以国内航班为例，从进候机楼到登机全程需约20分钟，与首都机场T3航站楼相比，可节约近40分钟。在大兴机场乘坐南航的航班，航程时间更短。相比首都机场，南航从南方和华东方向进出京的旅客，可累计省下30分钟至40分钟。另外，机场实现了无纸化出行一证通关，旅客刷证件就能通关，无需出示登机牌。过安检的同时会采集面像，登机时刷脸即可通过。通道运行更加快捷顺畅，减少排队所花费的时间。大兴国际机场中转流程更为便捷，比如国际转国内、国内转国际都只需60分钟，对比首都机场T2航站楼，分别节省1小时、30分钟。航站楼内将会有机场酒店，南航也将在离航站楼步行10分钟左右的位置，为中转过夜的旅客提供住宿。","该文本情感是积极的。"
"2019-08-30 22:50:06","三大航空央企上半年净赚68亿：净利集体下滑 证金持股不变","三大航空央企2019年上半年财报公布。8月27日、8月28日、8月30日，南方航空(600029.SH，01055.HK)、中国国航(601111.SH，00753.HK)、东方航空(600115.SH，00670.HK)三大航空央企，陆续发布2019年上半年财报。三家航空公司合计实现营收1970.36亿元，均实现正增长；实现归属于上市公司股东净利润67.72亿元，均呈现负增长态势。其中，南航营收在三者中排名第一，至729.39亿元；东航营收增长率位居第一，增幅为8.02%。归属于上市公司股东净利润方面，三大航均为负增长态势，其中南航跌幅最大，下降20.92%，国航和东航分别下降9.49%和14.89%。在扣除非经常性损益后，三家航空公司的净利润仍为下降态势，其中东航下降最大降幅达26.29%，南航和国航分别下降21.85%和3.49%。证金公司在今年上半年对三大航空央企的持股数量均保持不变，对南航、国航、东航的持股分别为2.61%、2.14%和2.97%。在客运方面，三大航空央企在2019年上半年的客运率均保持在80%以上，其中东航客运率最高达82.66%，国航客运率最低为80.99%，三大航的客运率均呈现上升态势，国航上升最多。受益于三大航空央企中机队规模最大的南航，在2019年上半年可用座公里(ASK)和收费客公里(RPK)两项重要指标均为第一，但东航对应的增长率则赶超南航。目前南航的机队规模达到849架，远超国航的676架和东航的719架，不过东航在2019年上半年的机队规模增幅则位居第一，达到9.94%。南航、东航将大兴机场视为发展重点","该文本情感是中性的。"
"2019-08-30 22:33:35","南方航空：向中国商飞购买35架ARJ21-700飞机","南方航空(600029)8月30日晚间公告，向中国商飞购买35架ARJ21-700飞机，ARJ21-700飞机的公开市场报价为每架约3800万美元。此次交易的35架ARJ21-700飞机的基本价格合计为13.3亿美元(约人民币94.3亿元)。","情感倾向是中性。"
"2019-08-29 08:14:52","南方航空：短期内航空需求羸弱 看好票价提升潜力","华泰证券发布南方航空的研报指出，公司运力结构中国内线占比较高，短期受地缘政治影响较小，油汇同比基数较低，且 737Max 停飞时长若超预期，将利好行业供需结构改善，叠加票价放开将继续推进，看好公司票价提升潜力。但短期内航空需求羸弱，人民币走势存在风险，下调 2019E/20E/21E 年净利润预测值各 23.0%/20.9%/27.3% 至 71.3/107.1/144.5 亿。因 2019 年 ROE 有望回升，给予 1.7x-1.8x 2019PB (预计 2019 年 BPS 为 5.68 元，公司历史 8 年 PB 倍数均值 1.5x PB)， 调整目标价区间 9.66-10.22 元人民币，维持“买入”评级。","该文本情感是积极的。"
"2019-08-28 07:57:05","南方航空上半年实现净利16.9亿元 同比下降两成","昨日晚间，南方航空(600029.SH)披露半年报。2019年上半年，南方航空实现营业收入729.39亿元，同比增长7.97%；归属于上市公司股东的净利润16.90亿元，同比下降20.92%；实现归属于上市公司股东的扣除非经常性损益的净利润14.34亿元，同比下降21.85%；经营活动产生的现金流量净额为134.84亿元，同比增长43.55%。上半年，南方航空主营业务收入为716.66亿元，同比增加8.01%，该公司称主要是本报告期内客运收入的增加；其他业务收入为12.73亿元，同比增加5.73%，主要是本报告期内酒店及旅游收入增加所致。费用方面，南方航空分析称，2019 年上半年，本集团销售费用为33.33亿元，同比增加3400万元，主要是由于本报告期内电脑订座费增加；管理费用为16.96亿元，同比增加1.69亿元，主要是由于本报告期内折旧费增加；财务费用为32.43亿元，同比增加12.07亿元，其中，汇兑净损失为3.12亿元，较去年同期减少25.71%，主要由于本报告期执行了新租赁准则，租赁负债利息支出上升所致；本报告期租赁负债的利息支出为25.29亿元，较去年同期增加123.81%，主要是由于本报告期内执行新租赁准则。","该文本情感是中性的。"
"2019-08-27 20:32:50","南方航空上半年净利下降21%","南方航空披露半年报，公司2019年上半年实现营业收入为729.39亿元，同比增长7.97%；归属于上市公司股东的净利润16.9亿元，同比下降20.92%；每股收益0.14元。","以上文本情感是中性的。"
"2019-08-27 17:36:27","南方航空上半年实现净利16.90亿元 广州-北京“双枢纽”战略取得重大进展","南方航空(600029)8月27日盘后发布2019年半年报，上半年，南方航空实现营业收入729.39亿元，同比增长7.97%；实现归属于上市公司股东的净利润16.90亿元，同比减少20.92%。公告显示，报告期内，南方航空引进飞机28架(包括经营租赁飞机13架、融资租赁飞机11架、自购飞机4架)，退出飞机19架(包括经营租赁飞机15架、自购飞机4架)，融资租赁转自购飞机1架。截至报告期末，南方航空机队规模达到849架，较上年期末净增加9架。南方航空广州-北京“双枢纽”战略也取得重大进展。公司高标准建设大兴机场南航基地，五大功能区全部竣工，建成亚洲跨度最大机库及亚洲最大运行控制中心和航空食品生产基地；圆满完成试飞工作，南航A380飞机率先降落大兴机场；有序推进转场准备工作，持续优化增班计划、储备机务维修资源、积极争取配套政策，全力为北京枢纽运营做好准备。南方航空表示，将围绕大兴机场全力打造北京核心枢纽，按照承担大兴机场航空旅客业务量40%的目标，建设覆盖国际国内的航线网络。按照发展规划，到2025年，南方航空预计在大兴机场投放飞机超过200架，日起降航班超过900班次。","情感倾向是积极的。"
"2019-08-27 17:17:04","南方航空：上半年净利16.9亿元 同比降21%","南方航空(600029)8月27日晚间披露2019半年报，公司2019年上半年实现营业收入为729.39亿元，同比增长7.97%；净利润16.9亿元，同比下降20.92%；每股收益0.14元。","该文本情感是中性的。"
"2019-07-29 10:54:25","利润持续走低 南航引广东国资改善经营","近日，作为中国南方航空集团有限公司(以下简称“南航集团”)旗下A股唯一上市平台，中国南方航空股份有限公司(600029.SH，以下简称“南方航空”)发布公告称，广东恒健投资控股有限公司、广州市城市建设投资集团有限公司、深圳市鹏航股权投资基金合伙企业分别以现金向南航集团增资100亿元人民币。据悉，此轮股权多元化之后，南航集团最新股权结构为国务院国资委对南航集团持股61.798%，广东省三方各持股10.445%，社保基金会持股6.866%。值得注意的是，南方航空公告中明确此轮增资主要用途之一是服务粤港澳大湾区战略。业内专家认为，此次南航集团股权多元化之后，将形成中央与地方合作的新模式。原先国资委考核商业央企主要看经营指标，地方入股后，央企不只是要盈利，也将愿意更多地支持地方经济发展。混改现新模式南航集团此轮股权多元化改革，早有预兆。早在2018年12月6日，南方航空公告称，为贯彻落实深化国有企业改革的有关要求，南航集团拟进行股权多元化改革。而7个月之后，股权多元化方案终于出炉。国务院国资委主任郝鹏就此事曾对媒体记者表示，南航集团引入广东省国有资本实施股权多元化改革，是深化国有企业改革的一项大事。此举对于完善南航集团公司法人治理结构、培育具有全球竞争力的世界一流企业、更好落实国家重大战略、推动区域经济协调发展，都具有十分重要的意义。事实上，国内三大航的混改都在持续推进。2019年6月，中国东方航空股份有限公司(以下简称“东航”)也走出股权多元化重要一步。东航公告显示，其非公开发行A股股票的申请获批，其发行对象为吉祥航空、均瑶集团及其下属全资子公司上海吉道航和结构调整基金。其中，吉祥航空及其关联方将合计持有东航交易后不超过A股总股本的10%。同期，吉祥航空非公开发行A股股票的申请也通过证监会审核，其发行对象为东航关联方东方航空产业投资有限公司(以下简称“东航产投”)。值得一提的是，2019年1月初，东航产投已受让了吉祥航空7%的股份。此次交易之后，东航与吉祥航空将通过定增成为对方股东，实现交叉持股。业内专家表示，航空公司的经营特点是高风险、利润率单薄。据测算，航空公司营业收入每减少1%，利润便会减少三分之一。国内民航业市场集中度可能会一步增加，从而逐步走向规模化经营，以防止经营风险。就股权多元化相关问题，《中国经营报》记者致函南航集团方面，截至发稿，暂未获回复。","该文本情感是中性的。"
"2019-07-26 10:27:00","南航部分航班推出电子行李牌服务","昨日，南航新研发的黑科技项目率先落地，电子行李牌服务正式在广州始发的国内航班中推出。南航成为中国民航首家推出电子行李牌服务的航空公司。即日起，乘坐南航从广州出发的国内航班的旅客，通过南航官方APP办理电子登机牌后，在行程页面会发现“电子行李牌”办理选项，只要拥有一块“Bagtag”电子行李牌，旅客在家就可直接点击办理。系统将生成行李牌号码，通过手机蓝牙将数据传输到电子行李牌上，只需十几秒，行李牌的电子墨水屏上就会显示出条形码、航班号等信息。到了广州白云国际机场T2航站楼以后，旅客只需把挂好电子行李牌的行李放上自助托运机上，按步骤操作完成扫描安检即可。行李的重量等信息会同步到南航APP上，旅客可通过南航APP的行李查询功能，就能全程追踪行李的托运状态，到达后可凭APP上的行李牌号核对提取。","情感倾向是中性。"
"2019-07-22 06:26:50","粤穗深国资各增资100亿元 南航集团股权多元化改革首尝央地合作模式","7月20日，南航集团在京宣布正式实施股权多元化改革。国务院国资委有关负责人在发布会上宣读了对中国南航集团股权多元化改革事项的批复，国资委原则同意中国南方航空集团的股权多元化改革方案，广东省、广州市、深圳市各以100亿元现金增资，同时实施国资充实社保资金，以增资前南航集团10%国有股权划转至社保基金会。增资后，国资委对南航集团持股61.798%，广东省三方各持股10.445%，社保基金会持股6.866%，国有股权划转社保事宜由国资委统筹安排。据悉，南航集团股权多元化改革，是第一家采取央企和地方合作模式，推进中央企业集团层面股权多元化改革的创新样本。上市公司南方航空7月22日公告，南航集团近日与广东省、广州市、深圳市确定的投资主体广东恒健投资控股有限公司、广州市城市建设投资集团有限公司、深圳市鹏航股权投资基金合伙企业(有限合伙)签订《增资协议》，三者分别以现金向南航集团增资100亿元，推进南航集团股权多元化改革。本次增资资金将主要用于航空运输主业，服务“一带一路”建设和粤港澳大湾区战略。记者了解到，当前，在“一带一路”沿线38个国家和地区的68个城市，南航已开通了172条航线，年承运旅客1500多万人次，是中国与沿线国家和地区航空互联互通的主力军。南航集团在发布会上承诺，未来将继续支持广州、深圳民航发展，加大宽体机投放，持续拓展国际航线网络；同时兼顾珠海、惠州、揭阳、湛江、梅州等省内二线城市投入，全面推动广东民航发展和区域协调发展。南航集团有关负责人还表示，南航集团股权多元化改革之后，将大幅降低资产负债率，为企业发展提供强有力的资金保障。同时，建立现代企业制度，完善董事会决策机制和市场化经营机制，进一步激发企业的发展活力，实现高质量发展，不断向建设世界一流航空运输企业的目标迈进。业内人士认为，此项改革实施后，南航集团的法人治理结构将更加完善，集团、股份、投资公司三层级治理体系将更加规范，有利于南航集团做强做优做大国有资本，也有利于深入推进央企和地方合作，促进广东经济发展和扩大对外开放水平。南航集团负责人表示，下一步，南航将在国务院国资委、广东省委省政府的指导下，扎实推动改革落地见效。同时，紧紧抓住国企改革发展政策机遇，推动实施下属双百企业的混合所有制改革。在南航股份公司层面，探索与国际优质航空公司加强国际航线的合作和协同，增强公司主营业务的核心竞争力，进一步提升公司盈利水平。","情感倾向是积极。"
"2019-07-22 00:16:41","南方航空：恒健投资等三公司分别向南航集团增资100亿元","南方航空(600029)7月21日晚公告，公司控股股东南航集团于近日与国务院国资委、广东恒健投资控股有限公司、广州市城市建设投资集团有限公司、深圳市鹏航股权投资基金合伙企业(有限合伙)共同签署增资协议，以推进南航集团股权多元化改革。广东恒健投资控股有限公司、广州市城市建设投资集团有限公司、深圳市鹏航股权投资基金合伙企业(有限合伙)分别以现金向南航集团增资100亿元。","该文本情感是积极的。"
"2019-07-22 00:11:58","南方航空：恒健投资等三公司拟向南航集团合计增资300亿元","南方航空(600029)7月21日晚间公告，为贯彻落实中央关于深化国有企业改革的有关要求，公司控股股东南航集团于近日与国务院国资委、广东恒健投资控股有限公司、广州市城市建设投资集团有限公司、深圳市鹏航股权投资基金合伙企业(有限合伙)共同签署增资协议，以推进南航集团股权多元化改革。广东恒健投资控股有限公司、广州市城市建设投资集团有限公司、深圳市鹏航股权投资基金合伙企业分别以现金向南航集团增资100亿元，合计增资300亿元。本次增资到位后，南航集团作为国务院国资委监管中央企业的现状不变，作为公司控股股东的地位不变。根据《增资协议》，本次增资资金主要用于航空运输主业，服务国家“一带一路”建设和粤港澳大湾区战略。据介绍，在国务院国资委的指导下，经广东省、广州市、深圳市和南航集团充分协商，广东省、广州市、深圳市通过其确定的投资主体以现金方式各向南航集团增资100亿元。同时实施国资充实社保资金，将增资前南航集团10%的国有股权划转至社保基金。本次增资和股权划转后，南航集团股权结构为：国资委持股61.798%，广东省三方投资主体各持股10.44%，社保基金会持股6.866%。国有股权划转社保基金事宜由国资委统筹安排实施。","该文本情感是积极的。"
"2019-07-22 00:11:18","央地合作模式开启！南航集团引“一省二市”增资300亿","7月21日晚间，南方航空(600029)发布公告称，南航集团于近日与国务院国有资产监督管理委员会、广东恒健投资控股有限公司、广州市城市建设投资集团有限公司、深圳市鹏航股权投资基金合伙企业(有限合伙)共同签署《关于中国南方航空集团有限公司之增资协议》(以下简称 “《增资协议》”)， 以推进南航集团股权多元化改革。公告显示，根据《增资协议》， 广东恒健投资控股有限公司、广州市城市建设投资集团有限公司、深圳市鹏航股权投资基金合伙企业(有限合伙)分别以现金向南航集团增资100亿元人民币，共计300亿人民币。本次增资到位后， 南航集团作为国务院国资委监管中央企业的现状不变， 作为本公司控股股东的地位不变。民航业内资深专家綦琦对新京报记者表示，本次增资开启了南航版国企混改模式，这次混改模式突出了地方投资平台注资央企的探索。300亿注资集团，将有效增加南航的资本金，也有利于南航集团各板块高质量发展。未来集团注资南航股份也可以期待，可降低股份公司的资产负债率。央企首例央地合作模式项目南航方面公告称，为贯彻落实中共中央和国务院关于深化国有企业改革的有关要求， 南航集团于近日与国务院国有资产监督管理委员会、广东恒健投资控股有限公司(以下简称“恒健投资”)、广州市城市建设投资集团有限公司(以下简称“广州城投”)、深圳市鹏航股权投资基金合伙企业(有限合伙)共同签署《增资协议》， 以推进南航集团股权多元化改革。公开资料显示，恒健投资成立于2007年8月20日，是经广东省人民政府批准设立，由广东省人民政府国有资产监督管理委员会履行出资人职责的国有独资投资控股公司，注册资本为202.17亿元。截至2019年3月31日，恒健投资公司资产总额为2766.79亿元，净资产1732.39亿元，是净资产最大的省属企业，实际控制或参股粤电力A、深圳能源等多家上市公司。广州城投成立于2008年12月10日，是经广州市人民政府授权从事城市基础设施投融资、建设、运营和管理的大型国有企业，注册资本为173.94亿元。企查查显示，深圳市鹏航股权投资基金合伙企业(有限合伙)是经深圳市政府批准，为支持南航集团股权多元化改革、推动粤港澳大湾区特别是深圳市航空运输业发展而设立的专项产业基金，授权深圳市属国企深圳市鲲鹏股权投资管理有限公司管理，注册资本为40.01亿元。南航方面介绍，集团引入广东省、广州市和深圳市的国有资本，实施集团股权多元化改革，是第一家采取央企和地方合作模式，推进中央企业集团层面股权多元化改革的创新样本。增资将用于服务国家“一带一路”和粤港澳大湾区战略","情感倾向是积极的。"
"2019-07-21 17:45:42","南方航空：恒健投资等三公司分别拟向南航集团增资100亿元","南方航空(600029)7月21日晚公告，公司控股股东南航集团于近日与国务院国资委、广东恒健投资控股有限公司、广州市城市建设投资集团有限公司、深圳市鹏航股权投资基金合伙企业(有限合伙)共同签署增资协议，以推进南航集团股权多元化改革。广东恒健投资控股有限公司、广州市城市建设投资集团有限公司、深圳市鹏航股权投资基金合伙企业(有限合伙)分别以现金向南航集团增资100亿元。","该文本情感是中性的。"
"2019-07-20 16:18:55","央企混改现新路径 这家公司率先引入地方资本 增资额高达300亿","近来不断提速的“央地联动”再现新路径。与此前原本归属于地方国资委的国有企业正在快速迎来“央企化”大潮不同，央企在集团层面引入地方资本的合作项目也于今日实现首例落地，增资额高达300亿元。南航集团股东多元化7月20日，南航集团在北京宣布，正式实施股权多元化改革。在集团层面引入广东省、广州市、深圳市确定的投资主体广东恒健投资控股有限公司、广州市城市建设投资集团有限公司、深圳市鹏航股权投资基金合伙企业(有限合伙)的增资资金各100亿元，合计增资300亿元，成为多元股东的央企集团。南航集团股权多元化改革，是第一家采取央企和地方合作模式，推进中央企业集团层面股权多元化改革的创新样本。与云铝股份、驰宏锌锗、海峡股份、马钢股份等A股公司的实际控制人已经或正在筹划从地方国资委变更为国务院国资委不同，南航集团成为实现“央地联动”的B路径。实际上，本次南航集团引入广东等地增资资金，并非突然。2018年1月，新修订的《国内投资民用航空业规定》正式实施。与此前明确要求三大航应保持国有或国有控股不同，新规定放宽国航、东航、南航三大航国有控股要求，允许国有(资本)相对控股，并要求“国有相对控股”应当由单一国有投资主体及其控股企业相对控股。同时，在相对控股概念中增加了能够对企业“实际支配”的要求，保证国有控制力。此后市场便一直存在航空公司集团层面的引资预期。在2019年6月，南航集团负责人王昌顺明确，集团股比会适当放开，股份公司也有一定空间。当时王昌顺表示，目前南航集团是100%国资持股。下一步从国家改革的情况来看，集团层面股权会适当放开，南航股份公司层面，也还有一定空间。近日，南航集团还收到国务院国资委批复，原则同意公司股权多元化改革方案。这为本次集团层面央地重大资本合作项目落地再度推开了大门。又一标志性事件e公司记者通过梳理南航集团发展史发现，本次南航集团央地重大资本合作项目落地，可以视为集团层面又一个标志性事件，个中脉络大体如下：首先，独立运营及上市阶段：1991年，中国南方航空公司成立，与民航广州管理局实行“一套机构、两块牌子”的管理模式。1992年民航体制改革完成，实行政企分离，南航开始市场化独立运营。1997年7月，经股份制改造后，南航分别在纽约、香港两地成功挂牌上市，2003年7月在上海证券交易所挂牌上市。第二，联合重组阶段：2002年10月11日，南航与北方航、新疆航联合重组，成立中国南方航空集团公司，总部设在广州，是中央管理的三大骨干航空集团之一，公司主营航空运输业务，兼营飞机发动机维修、进出口贸易、金融理财、传媒广告、地产等相关产业。","情感倾向是积极的。"
