"Date","Title","Content","qwen_lora2_情绪提取"
"2019-07-23 18:29:38","中信建投：对科创板负面评价是员工起草的内部汇报稿 已被作废且从未对外提供过","中信建投(601066)7月23日晚间公告，近日，某微博账号提及公司全资子公司资本公司的文件含有对科创板的负面评价和对监管政策的不恰当言论。经查，前述微博账号所述内容，是资本公司某基层员工于2019年3月起草的一份内部汇报初稿，随即被资本公司负责人严厉批评并责令纠正，该文稿被作废且并从未对外提供过。该微博账号发布相关材料的行为，向市场传递了不实信息，严重侵犯了公司权益。","情感倾向是中性。"
"2019-07-23 16:46:37","7月23日股指期货成交持仓龙虎榜","交易日:20190723交易日:20190723","该文本情感是中性的。"
"2019-07-19 11:07:26","中信建投证券股份有限公司关于行使“16信投G2”公司债券发行人赎回选择权的第三次提示性公告","证券代码：601066 证券简称：中信建投公告编号：临2019-067号债券代码：136606 债券简称：16信投G2本公司董事会及全体董事保证本公告内容不存在任何虚假记载、误导性陈述或者重大遗漏，并对其内容的真实性、准确性和完整性承担个别及连带责任。2019年6月28日，中信建投证券股份有限公司(以下简称“公司”或“发行人”)发布了《中信建投证券股份有限公司关于行使“16信投G2”公司债券发行人赎回选择权的公告》(详见2019年6月28日上海证券交易所网站)。本公告为上述事项的提示性公告。《中信建投证券股份有限公司公开发行2016年公司债券(第二期)募集说明书》(以下简称“《募集说明书》”)有关中信建投证券股份有限公司2016年公司债券(第二期)(以下简称“16信投G2”公司债券)发行人赎回选择权的条款约定如下：发行人有权于本期债券第3个计息年度付息日前的第30个交易日，在中国证监会规定的信息披露场所发布关于是否行使赎回选择权的公告。若发行人决定行使赎回权，本期债券将被视为在第3年末全部到期，发行人将以票面面值加最后一期利息向投资者赎回全部本期债券。赎回的支付方式与本期债券到期本息支付方式相同，将按照本期债券登记机构的相关规定办理。若发行人未行使赎回权，则本期债券将继续在后2年存续。公司于2016年8月9日完成“16信投G2”公司债券的发行工作，2019年8月9日为本期公司债券第3个计息年度付息日。根据《募集说明书》有关条款的约定，公司可于第3个计息年度付息日前的第30个交易日，决定是否行使发行人赎回选择权。公司决定行使“16信投G2”公司债券发行人赎回选择权，对赎回登记日登记在册的“16信投G2”公司债券全部赎回。公司将根据相关业务规则，做好“16信投G2”公司债券赎回事宜的后续信息披露及本息兑付工作。特此公告。中信建投证券股份有限公司董事会2019年7月18日","该文本情感是积极的。"
"2019-07-19 08:39:46","中信建投证券股份有限公司关于发行金融债券获得人民银行行政许可的公告","证券代码：601066 证券简称：中信建投公告编号：临2019-068号本公司董事会及全体董事保证本公告内容不存在任何虚假记载、误导性陈述或者重大遗漏，并对其内容的真实性、准确性和完整性承担个别及连带责任。日前，中信建投证券股份有限公司(以下简称“公司”)收到《中国人民银行准予行政许可决定书》(银市场许准予字[2019]第116号)。根据该行政许可决定书，中国人民银行同意公司发行不超过40亿元人民币金融债券，核准额度自该决定书发出之日起1年内有效，有效期内公司可自主选择金融债券发行时间。公司将严格按照《全国银行间债券市场金融债券发行管理办法》(中国人民银行令[2005]第1号)和《全国银行间债券市场金融债券发行管理操作规程》(中国人民银行公告[2009]第6号)等有关规定，认真做好金融债券发行和存续期间的信息披露等相关工作。特此公告。中信建投证券股份有限公司董事会2019年7月18日","情感倾向是中性。"
"2019-07-19 08:26:45","中信建投两天两罚单:ABN未备案发行 子公司内控失当","券商的私募基金子公司违规问题正在被监管部门所关注。7月18日晚，北京证监局发布《关于对中信建投证券股份有限公司采取责令增加内部合规检查次数措施的决定》，指出中信建投证券私募基金子公司—— 中信建投资本管理有限公司在完成组织架构规范整改公示前实际开展业务，同时国债期货等品种自营交易的投资决策和交易执行未能有效分离，均违反有关证券公司及私募基金子公司的相关规定。“对于券商私募子公司的相关监管事宜，一般是由派出机构负责的，因为过去经历过一段时间券商内部很多私募子公司，另类投资公司的情况，而且一些子公司并没有经过相关部门报批。”一位接近中信建投人士表示，“这次建投的私募子公司其实也是在这个背景下开展组织架构规范和整改的。”“投资决策和交易执行未能分离，很有可能是做投资决策的人直接进行了交易操作，一些专户、子公司的风控标准和流程可能确实不比母公司，容易出现这种问题。”上述接近中信建投人士称。对此，北京证监局责令中信建投在决定书作出之日起3个月内改正，完善内部控制流程，加强对子公司的合规管理，并在2019年6月30日至2020年6月30日期间，中信建投须每6个月开展一次内部合规检查，于每次检查后10个工作日内，向北京证监局报送合规检查报告，其整改情况也将在北京证监局的日常监管中被持续关注。值得一提的是，这是中信建投当天被公开的第二张罚单。就在此前一日的7月17日，银行间市场交易商协会公布的纪律处分信息显示，中信建投证券连通前海结算商业保理有限公司(下称前海结算)在五矿地产的ABN(资产支持票据)产品上存在未向协会备案即发行、财报信披不准确等情形。交易商协会认为，中信建投作为前海结算ABN的主承销商，在相关债务融资工具发行和存续期间存在违规行为，一是多达4只五矿地产ABN产品未能向交易商协会本案便启动发行，而是某一直ABN发行文件中的财务信息披露不准确。对此，交易商协会对中信建投予以通报批评处分，并责令其针对本次事件中暴露出的问题进行全面深入的整改。业内人士认为，中信建投密集暴露合规问题，可能说明公司内部业务流程和治理存在一定亟待补漏的情形。“如果是单纯的一个子公司或者一个团队的问题，可能是偶然情况，但两期合规事件同时密集出现，说明中信建投在整体业务的合规、内控框架上应当由更完善的建制和建设。”西南地区一家上市券商合规人士指出。","该文本情感是消极的。"
"2019-07-19 03:11:55","中信建投缘何两天两罚单：ABN未备案发行、子公司内控失当","券商的私募基金子公司违规问题正在被监管部门所关注。7月18日晚，北京证监局发布《关于对中信建投证券股份有限公司采取责令增加内部合规检查次数措施的决定》，指出中信建投证券私募基金子公司—— 中信建投资本管理有限公司在完成组织架构规范整改公示前实际开展业务，同时国债期货等品种自营交易的投资决策和交易执行未能有效分离，均违反有关证券公司及私募基金子公司的相关规定。“对于券商私募子公司的相关监管事宜，一般是由派出机构负责的，因为过去经历过一段时间券商内部很多私募子公司，另类投资公司的情况，而且一些子公司并没有经过相关部门报批。”一位接近中信建投人士表示，“这次建投的私募子公司其实也是在这个背景下开展组织架构规范和整改的。”“投资决策和交易执行未能分离，很有可能是做投资决策的人直接进行了交易操作，一些专户、子公司的风控标准和流程可能确实不比母公司，容易出现这种问题。”上述接近中信建投人士称。对此，北京证监局责令中信建投在决定书作出之日起3个月内改正，完善内部控制流程，加强对子公司的合规管理，并在2019年6月30日至2020年6月30日期间，中信建投须每6个月开展一次内部合规检查，于每次检查后10个工作日内，向北京证监局报送合规检查报告，其整改情况也将在北京证监局的日常监管中被持续关注。值得一提的是，这是中信建投当天被公开的第二张罚单。就在此前一日的7月17日，银行间市场交易商协会公布的纪律处分信息显示，中信建投证券连通前海结算商业保理有限公司(下称前海结算)在五矿地产的ABN(资产支持票据)产品上存在未向协会备案即发行、财报信披不准确等情形。交易商协会认为，中信建投作为前海结算ABN的主承销商，在相关债务融资工具发行和存续期间存在违规行为，一是多达4只五矿地产ABN产品未能向交易商协会本案便启动发行，而是某一直ABN发行文件中的财务信息披露不准确。对此，交易商协会对中信建投予以通报批评处分，并责令其针对本次事件中暴露出的问题进行全面深入的整改。业内人士认为，中信建投密集暴露合规问题，可能说明公司内部业务流程和治理存在一定亟待补漏的情形。“如果是单纯的一个子公司或者一个团队的问题，可能是偶然情况，但两期合规事件同时密集出现，说明中信建投在整体业务的合规、内控框架上应当由更完善的建制和建设。”西南地区一家上市券商合规人士指出。","情感倾向是消极。"
"2019-07-18 18:14:35","中信建投：中国人民银行同意公司发行不超过40亿元金融债券","7月18日，中信建投发布公告称，日前收到《中国人民银行准予行政许可决定书》，中国人民银行同意公司发行不超过40亿元人民币金融债券，核准额度自该决定书发出之日起1年内有效，有效期内公司可自主选择金融债券发行时间。","以上文本情感是积极的。"
"2019-07-18 17:58:13","中信建投：发行不超40亿元金融债券获央行许可","中信建投(601066)7月18日晚间公告，中国人民银行同意公司发行不超过40亿元金融债券，核准额度自人民银行行政许可决定书发出之日起1年内有效。","以上文本情感极性属于积极。"
"2019-07-18 15:33:56","中信建投因内控不完善被证监局责令增加合规检查次数","因内部控制不完善，对重要业务部门和子公司经营管理行为的合规性监督检查不到位等问题，中信建投近期被北京证监局责令增加内部合规检查次数。北京证监局出具《关于对中信建投证券股份有限公司采取责令增加内部合规检查次数措施的决定》显示，中信建投私募子公司建投资本在完成组织架构规范整改公示前实际开展业务，违反《证券公司私募投资基金子公司管理规范》第三十七条的规定；另外，中信建投在开展国债期货等部分品种自营交易的投资决策和交易执行未分离，违反了《证券公司内部控制指引》第五十条的规定。北京证监局表示，上述问题反映出中信建投内部控制不完善，对重要业务部门和子公司经营管理行为的合规性监督检查不到位；根据《证券公司监督管理条例》第七十条第一款第一项的规定，决定责令中信建投在决定书作出之日起3个月内改正，完善内部控制流程，加强对子公司的合规管理，并在2019年6月30日至2020年6月30日期间，每6个月开展一次内部合规检查，在每次检查后10个工作日内，报送合规检查报告。《证券公司私募投资基金子公司管理规范》第三十七条规定，本规范发布之日起十二个月内，证券公司及其私募基金子公司应当达到本规范的要求；规范发布实施前证券公司设立的直接投资业务子公司以自有资金直接进行股权投资或已设立的下设基金管理机构及基金不符合相关要求的，不得新增业务，存量业务可以存续到项目到期，到期前不得开放申购或追加资金，不得续期。《证券公司内部控制指引》第五十条则规定，证券公司自营业务的研究策划、投资决策、交易执行、交易记录、资金清算和风险监控等职能应相对分离； 重要投资要有详细研究报告、风险评估及决策记录。附全文：关于对中信建投证券股份有限公司采取责令增加内部合规检查次数措施的决定中信建投证券股份有限公司：经查，你公司存在以下问题：一、你公司私募子公司中信建投资本管理有限公司(以下简称建投资本)在完成组织架构规范整改公示前实际开展业务，违反《证券公司私募投资基金子公司管理规范》第三十七条的规定。二、你公司开展国债期货等部分品种自营交易的投资决策和交易执行未分离，违反了《证券公司内部控制指引》第五十条的规定。上述问题反映出你公司内部控制不完善，对重要业务部门和子公司经营管理行为的合规性监督检查不到位，根据《证券公司监督管理条例》第七十条第一款第一项的规定，我局决定责令你公司在决定书作出之日起3个月内改正，完善内部控制流程，加强对子公司的合规管理，并在2019年6月30日至2020年6月30日期间，每6个月开展一次内部合规检查，在每次检查后10个工作日内，向我局报送合规检查报告，我局将在日常监管中持续关注你公司的整改情况。","该文本情感是消极的。"
"2019-07-17 14:09:13","中信建投证券股份有限公司2018年非公开发行公司债券（第四期）2019年付息公告","证券代码：601066 证券简称：中信建投公告编号：临2019-066号债券代码：150563 债券简称：18信投F4本公司董事会及全体董事保证本公告内容不存在任何虚假记载、误导性陈述或者重大遗漏，并对其内容的真实性、准确性和完整性承担个别及连带责任。重要内容提示：债权登记日：2019年7月23日债券付息日：2019年7月24日中信建投证券股份有限公司(以下简称“公司”或“发行人”)于2018年7月24日发行了中信建投证券股份有限公司2018年非公开发行公司债券(第四期)(以下简称“本期债券”)，将于2019年7月24日开始支付自2018年7月24日至2019年7月23日期间(以下简称“本年度”)的利息。根据《中信建投证券股份有限公司2018年非公开发行公司债券(第四期)募集说明书(面向合格投资者)》(以下简称“《募集说明书》”)有关条款的规定，为保证付息工作的顺利进行，现将有关事宜公告如下：一、本期债券基本情况(一)债券名称：中信建投证券股份有限公司2018年非公开发行公司债券(第四期)。(二)债券简称及代码：18信投F4(代码：150563)。(三)发行规模：人民币25亿元。(四)票面金额及发行价格：票面金额为100元，按面值平价发行。(五)债券期限：本期债券期限3年。(六)债券利率：采用固定利率形式，票面利率为4.84%。(七)债券形式：实名制记账式。(八)还本付息方式：本期债券采用单利按年计息，不计复利。每年付息一次，到期一次还本，最后一期利息随本金的兑付一起支付。","该文本情感是中性的。"
"2019-07-16 14:25:43","中信建投证券股份有限公司2019年度第四期短期融资券发行结果公告","证券代码：601066 证券简称：中信建投公告编号：临2019-065号本公司董事会及全体董事保证本公告内容不存在任何虚假记载、误导性陈述或者重大遗漏，并对其内容的真实性、准确性和完整性承担个别及连带责任。中信建投证券股份有限公司2019年度第四期短期融资券已于2019年7月12日发行完毕，相关发行情况如下：本期发行短期融资券的相关文件已在中国货币网(www.chinamoney.com.cn)和上海清算所网站(www.shclearing.com)上刊登。特此公告。中信建投证券股份有限公司董事会2019年7月15日","该文本情感是中性的。"
"2019-07-15 20:03:45","中信建投完成发行30亿元短期融资券","7月15日，中信建投发布公告称，公司2019年度第四期短期融资券已于2019年7月12日发行完毕。该期债券实际发行总额30亿元人，票面利率2.7%，债券简称“19中信建投CP004”。","以上文本情感是中性的。"
"2019-07-15 18:59:06","7月15日股指期货成交持仓龙虎榜","交易日:20190715交易日:20190715","情感倾向是中性。"
"2019-07-12 16:15:05","7月12日股指期货成交持仓龙虎榜","交易日:20190712交易日:20190712","该文本情感是中性的。"
"2019-07-12 12:54:40","中信建投两日下跌7% 紧急公告撇清与承兴国际关系","7月12日早盘，券商股持续低迷，中原证券跌超7%，国盛金控、中信建投、华泰证券均跌超2%。此前一天，中信建投(601066)盘中跳水，股价最大跌幅逾9%。截至当天收盘，中信建投收报20.29元，下跌4.61%。截至12日中午，这两日中信建投股价已经下跌7%。自6月25日，中信证券公告清仓减持中信建投以来，中信建投股价跌跌不休，加上此前与最近暴雷的承兴国际有业务来往，令中信建投股价今日进一步承压。有传闻指出中信建投与最近资本市场“黑天鹅事件”中的承兴国际有业务关联，针对此事，中信建投今日发布紧急公告称2015年，中信建投国际为China Base Group Limited担任收购方财务顾问，收购香港上市公司Fittec(奕达国际集团有限公司)，该笔交易于2016年完成。中信建投国际为China Base Group Limited提供了约7亿港元收购融资额度，实际使用约5亿港元；China Base Group Limited向中信建投国际提供了股权及约2亿港元现金作为抵押品。China Base Group Limited的收购融资已于2016年全部还清，目前与中信建投国际无存续的融资业务及其他业务。公告发出后，中信建投在下午开盘时股市情况有所好转，但仍处于跌盘状态。而今日券商板块同样表现疲软。中原证券、华林证券、华泰证券分别下跌4.77%、2.08%和1.94%。Wind数据显示，非银金融板块今日上涨0.21%。除了受承兴国际事件拖累之外，中信建投6月25日还曾发布公告称，中信证券将通过大宗交易方式合计减持其所持有中信建投全部A股股票4.27亿股，占公司总股本比例5.58%。中信证券将在公告披露之日起15个交易日后的6个月内通过集中竞价方式及/或自本公告披露之日起3个交易日后的6个月内通过大宗交易方式合计减持。该公告发布以来，中信建投股价出现异常波动，于2019年6月26日、6月27日、6月28日连续3个交易日内日收盘价格跌幅偏离值已达到20%。","情感倾向是消极。"
"2019-07-11 18:48:42","中信建投：政策利好医疗信息 龙头企业受益明","医疗信息化行业受政策利好，将持续保持高景气度，持续看好龙头企业的发展：预计创业慧康2019-2020年的归母净利润达到2.81亿元、3.58亿元，维持买入评级；预计卫宁健康2019-2020年的归母净利润达到4.22亿元、5.51亿元，维持买入评级；建议关注思创医惠和万达信息。","该文本情感是积极的。"
"2019-07-11 17:19:23","中信建投：子公司与承兴国际方面已无存续融资业务及其他业务","近日，港股上市公司承兴国际控股(02662，HK)成为资本市场关注焦点，与其有过业务交集的金融机构也被关注到。有媒体报道提及中信建投证券所属的全资子公司中信建投(国际)金融控股有限公司(以下简称“中信建投国际”)与承兴国际(2662.HK)的业务合作。对此，中信建投发布澄清公告表示，2015年，中信建投国际为China BaseGroupLimited担任收购方财务顾问，收购香港上市公司Fittec(奕达国际集团有限公司)，该笔交易于2016年完成。中信建投国际为China BaseGroupLimited提供了约7亿港元收购融资额度，实际使用约5亿港元；ChinaBaseGroupLimited向中信建投国际提供了股权及约2亿港元现金作为抵押品。China BaseGroupLimited的收购融资已于2016年全部还清，目前与中信建投国际无存续的融资业务及其他业务。承兴国际中期报告显示，ChinaBase GroupLimited共持有承兴国际6.77亿股，持股比例62.84%。","情感倾向是中性。"
"2019-07-11 15:02:43","中信建投澄清与承兴国际无业务合作 股价一度逼近跌停","7月11日早盘，中信建投股价一度逼近跌停，截至发稿，跌幅收窄，跌逾6%，报19.99元。近日，个别媒体报道提及中信建投证券股份有限公司所属的全资子公司中信建投(国际)金融控股有限公司(以下简称“中信建投国际”)与承兴国际(2662.HK)的业务合作。对此，7月10日晚，中信建投发布澄清公告称，2015年，中信建投国际为China Base Group Limited(承兴国际股东)担任收购方财务顾问，收购香港上市公司Fittec(奕达国际集团有限公司)，该笔交易于2016年完成。中信建投国际为China Base GroupLimited提供了约7亿港元收购融资额度，实际使用约5亿港元；China Base GroupLimited向中信建投国际提供了股权及约2亿港元现金作为抵押品。中信建投表示，China Base GroupLimited的收购融资已于2016年全部还清，目前与中信建投国际无存续的融资业务及其他业务。","以上文本情感是消极的。"
"2019-07-11 14:14:36","中信建投证券股份有限公司澄清公告","证券代码：601066 证券简称：中信建投公告编号：临2019-062号中信建投证券股份有限公司澄清公告本公司董事会及全体董事保证本公告内容不存在任何虚假记载、误导性陈述或者重大遗漏，并对其内容的真实性、准确性和完整性承担个别及连带责任。一、传闻简述近日，个别媒体报道提及中信建投证券股份有限公司(以下简称“本公司”)所属的全资子公司中信建投(国际)金融控股有限公司(以下简称“中信建投国际”)与承兴国际(2662.HK)的业务合作。二、澄清声明2015年，中信建投国际为China Base Group Limited担任收购方财务顾问，收购香港上市公司Fittec(奕达国际集团有限公司)，该笔交易于2016年完成。中信建投国际为China Base Group Limited提供了约7亿港元收购融资额度，实际使用约5亿港元；China Base Group Limited向中信建投国际提供了股权及约2亿港元现金作为抵押品。China Base Group Limited的收购融资已于2016年全部还清，目前与中信建投国际无存续的融资业务及其他业务。三、郑重提醒感谢各界对本公司长期以来的关注与支持，本公司将持续做好信息披露，有关本公司信息请以本公司在上海证券交易所网站、香港交易及结算所有限公司披露易网站、本公司官网及指定信息披露媒体的相关公告为准，敬请广大投资者理性投资，注意投资风险。特此公告。中信建投证券股份有限公司董事会2019年7月10日","情感倾向是中性。"
"2019-07-11 11:56:04","中信建投曾给罗静融资？公司昨晚紧急澄清！股价盘中仍大跌逾9%","中信建投证券因在2015年罗静收购弈达国际事项中向其提供了7亿融资，近日被舆论多有猜测。虽然7月10日晚间中信建投进行了紧急澄清，但是今日股价仍然一路走低，临近午盘股价有所回升。截至上午收盘，跌5.08%，报20.19元/股。盘中最大跌幅逾9%。中信建投紧急澄清近两日，多家自媒体发布文章起底承兴国际创始人罗静，从1996年创办承兴国际，初期毫无起色，至2015年收购奕达国际后，走上“发达”之路。而中信建投证券在罗静2015年发起的收购中扮演了重要的角色——向其提供7亿港元融资。当年，罗静通过一家注册在英属处女群岛的公司宣布收购香港上市公司奕达国际(2662，HK)74.35%的股权，每股0.7435港元，总价5.35亿港元。中信建投在10日晚间的公告中表示，2015年，中信建投国际为China Base Group Limited担任收购方财务顾问，收购香港上市公司Fittec(奕达国际集团有限公司)，该笔交易于2016年完成。中信建投国际为China Base GroupLimited提供了约7亿港元收购融资额度，实际使用约5亿港元；China Base GroupLimited向中信建投国际提供了股权及约2亿港元现金作为抵押品。China Base GroupLimited的收购融资已于2016年全部还清，目前与中信建投国际无存续的融资业务及其他业务。","以上文本情感极性属于消极。"
