"Date","Title","Content","qwen_lora2_情绪提取"
"2019-06-26 07:46:07","大事件！中信证券百亿清仓减持中信建投！两公司渊源颇深","中信证券清仓后的中信建投以后还能叫中信建投么？6月25日晚间，中信建投的一纸公告引发业内关注。公告披露，持股5.58%的股东中信证券，拟在未来6个月内计减持其所持有的中信建投全部A股股票。对于本次减持的原因，公告披露为“股东自身经营需要”。按照25日收盘价估算，中信证券此次减持金额超过113亿元。业内分析人士认为，此次减持或对中信建投股价形成压力。中信证券清仓减持公告称，中信证券计划根据市场价格情况，自本公告披露之日起15个交易日后的6个月内通过集中竞价方式及/或自本公告披露之日起3个交易日后的6个月内通过大宗交易方式合计减持其所持有的中信建投全部A股股票4.27亿股，占公司总股本比例5.58%。此次减持距离中信建投登陆A股市场刚刚一年时间。公告指出，中信证券曾向中信建投出具持股期限承诺、持股意向及减持意向承诺并载于公司A股IPO招股说明书，中信证券承诺在中信建投首次公开发行A股并上市之日起12个月内不得转让其所持股份。中信建投在6月13日曾发布部分首次公开发行A股股票限售股上市流通公告，公告称本次限售股上市流通数量为4.64亿股；上市流通日期为2019年6月20日。两公司渊源颇深早前，华夏证券与南方证券、国泰证券并称为中国最早三大全国性证券公司。市场上曾有“一个华夏证券就是整个中国证券业”的说法。但2000年左右开始，华夏证券开始走下坡路，2004年更是陷入危机四伏的境地。彼时，试图收购广发证券未能实现的中信证券开始筹划重组华夏证券。2005年8月12日，中信证券正式宣布与中国建银投资有限公司(下称“建银投资”)联合重组华夏证券。中信证券与建银投资出资27亿元筹建中信建投证券有限责任公司，其中，中信证券出资比例为60%，出资额16.2亿元。中信建投证券设立之后，将以受让华夏证券现有的全部证券业务及相关资产为基础，按照综合类证券公司的标准进行经营。2010年11月9日，中国证监会下发《关于核准中信建投证券有限责任公司变更持有5%以上股权的股东的批复》(证监许可[2010]1588号)，核准北京国管中心受让中信证券原持有的中信建投45%的股权。2010年11月23日，中国证监会出具《关于核准中信建投证券有限责任公司变更持有5%以上股权的股东的批复》(证监许可[2010]1693号)，核准世纪金源受让中信证券原持有的中信建投有限8%的股权。2016年11月3日，中信建投在境外首次公开发行不超过12.38亿股H股股票。","情感倾向是消极。"
"2019-06-25 21:41:53","惊动A股：中信证券也要清仓减持！100亿卖掉中信建投一股不留 中信建投跌停","受消息影响，中信建投今日开盘跌停，截止收盘，中信建投跌10.01%，报23.83元，封单逾72万手。6月25日傍晚，证券圈出了一件大事。中信建投一则公告，震惊了所有人，股东之一的另外一家券商中信证券，打算清仓减持了！前者被市场成为牛市旗手，后者被称为牛市发动机，如今双方要彻底说拜拜？市场对此极为关注。究竟发生了什么事情？我们一起来看看。中信证券百亿减持中信建投6月25日晚，中信建投一则公告，让券商圈都震动了。大股东之一，也是A股的龙头券商——中信证券，要清仓减持中信建投，一股不留。公告显示，中信证券持有中信建投股份 427,000,000 股(占公司总股本比例 5.58%)。这些股份是中信证券在中信建投首次公开发行A股股票前获得的股份。怎么减持呢？本公告披露之日起15个交易日后的6个月内通过集中竞价方式，以及，公告披露之日起3个交易日后的6个月内通过大宗交易方式合计减持其所持有的中信建投全部A股股票。","以上文本情感极性属于消极。"
"2019-06-25 20:17:53","再遭看空？中信证券拟清仓中信建投4.27亿股 套现超百亿！","6月25日，中信建投发布股东减持股份计划公告称，中信证券拟清仓减持5.58%股份。中信建投表示，截至本公告披露日，中信证券持有中信建投股份4.27亿股，占公司总股本比例5.58%。而截至6月25日收盘，中信建投收盘价为26.48元，据此计算，中信证券套现金额达113.07亿元。根据公告，上述股份系中信证券在中信建投首次公开发行A股股票前获得的股份。中信证券计划根据市场价格情况，自本公告披露之日起15个交易日后的6个月内通过集中竞价方式或自本公告披露之日起3个交易日后的6个月内通过大宗交易方式合计减持其所持有的本公司全部A股股票4.27亿股。财报显示，中信建投2018年实现营收109.07亿元，同比减少3.50%；归属于母公司股东的净利润30.87亿元，同比减少23.11%；基本每股收益为0.38元，同比减少25.49%。截至2018年12月31日，中信建投资产总额1950.82亿元，较上年末减少5.25%；负债合计1472.19亿元；经营活动产生的现金流量净额为45.03亿元，较上年末-457.89亿元，由亏转盈。今年6月6日，中信建投发布5月财务数据。2019年5月，中信建投(母公司)营业收入6.81亿元，环比减少25.53%；净利润3141.39万元，环比减少90.92%。值得一提的是，今年年初A股上涨迅速，中信建投是领头羊。截至3月7日收盘，中信建投报收于31.16元，年内涨幅达257.75%。随着股价的持续高歌猛进，3月6日、7日，中信建投曾接连发布两份风险提示公告称，公司A股股票价格波动较大，特别提醒投资者注意二级市场交易风险。公告提示，该公司市盈率高于行业平均市盈率一倍，特别提醒广大投资者，注意投资风险，理性决策，审慎投资。3月8日，华泰证券也曾发布一篇将中信建投评级下调至“卖出”的研报。该研报指出，中信建投A股2019年PB估值4.5倍，显著高于同梯队券商当前1.4-2倍PB和国际投行1-2倍PB估值水平，并称其“估值远高于同梯队券商和国际投行，有下行风险”。券商对同行发布看空报告，在A股市场非常罕见，整个市场一度震惊。中信建投股价跳水。当时，华泰证券研报给出的中信建投合理价格为13.86元-17.33元；报告显示中信建投3月7日收盘价31.16元，看空下跌幅度为44.38%-55.52%。6月25日，中信建投报收于26.48元，上涨5.75%。","情感倾向是消极。"
"2019-06-25 19:31:43","中信证券拟清仓减持中信建投5.58%股份 市值逾百亿","6月25日晚间，券商股龙头中信建投证券股份有限公司(中信建投，601066.SH；06066.HK)公告称，股东中信证券股份有限公司(中信证券，600030SH；06030.HK)因自身经营需要，拟清仓减持5.58%股份，即4.27亿股。按中信建投6月25日收盘价26.48元/股计算，该部分股权市值113.07亿元。中信建投在公告中称，中信证券计划根据市场价格情况，自公告披露之日起15个交易日后的6个月内，通过集中竞价方式及/或自公告披露之日起3个交易日后的6个月内通过大宗交易方式，合计减持其所持有的公司全部A股股票。减持期间为2019年7月1日至2019年12月27日。中信建投2018年6月20日登陆上海证券交易所，目前无实际控制人，北京国有资本经营管理中心持股35.11%为第一大股东，第二大股东中央汇金投资有限责任公司持股31.21%。中信建投的前身为中信建投证券有限责任公司，2005年由中信证券与中国建银投资有限责任公司以现金出资设立。其中，中信证券出资16.2亿元，占比60%；中国建银投资有限责任公司出资10.8亿元，占比40%。此后，经过多次股权转让中信证券让出了控股股东地位，目前为第四大股东。中信建投亦于2016年在H股上市，2018年完成A股交易。中信证券为中国券商业的龙头企业，成立于1995年10月，是中国首家A+H股上市的证券公司。","情感倾向是中性。"
"2019-06-25 18:53:39","中信建投： 证监会对公司申请发行金融债券无异议","6月25日晚，中信建投发布公告称，日前公司收到中国证监会《关于中信建投证券股份有限公司发行金融债券的监管意见书》，中国证监会对公司申请发行金融债券无异议。中信建投表示，公司将严格按照《全国银行间债券市场金融债券发行管理办法》等有关规定，做好金融债券的发行、交易、信息披露及募集资金使用等工作，同时采取有效措施，加强流动性管理，确保按时偿还本息。","该文本情感是积极的。"
"2019-06-24 16:34:04","中信建投待偿还短期融资券余额上限为209亿元","6月24日，中信建投发布公告称，近日，公司收到《中国人民银行金融市场司关于中信建投证券股份有限公司短期融资券最高待偿还余额有关事项的通知》。根据该通知，公司的待偿还短期融资券余额上限为209亿元。中信建投表示，公司将按照《证券公司短期融资券管理办法》和《关于证券公司短期融资券管理有关事项的通知》等规定对短期融资券余额进行管理，待偿还短期融资券余额将不违反关于余额上限的相关规定。","以上文本情感极性属于中性。"
"2019-06-24 16:23:26","6月24日股指期货成交持仓龙虎榜","交易日:20190624","情感倾向是中性。"
"2019-06-20 19:01:42","6月20日股指期货成交持仓龙虎榜","交易日:20190620","情感倾向是中性。"
"2019-06-18 18:38:34","6月18日股指期货成交持仓龙虎榜","交易日:20190618","情感倾向是中性。"
"2019-06-13 16:27:14","6月13日股指期货成交持仓龙虎榜","交易日:20190613","该文本情感是中性的。"
"2019-06-12 19:53:30","中信建投4.64亿股限售股6月20日解禁","6月12日，中信建投发布公告称，中信建投首次公开发行完成后，公司股本变更为76.46亿股，其中59.85亿股为限售股，占公司总股本的78.28%。根据《上海证券交易所股票上市规则》相关规定，59.85亿股限售股中，股东中信证券和世纪金源所持有的合计4.64亿股限售股12个月的锁定期即将到期，将于2019年6月20日起上市流通。","情感倾向是中性。"
"2019-06-11 16:42:18","6月11日股指期货成交持仓龙虎榜","交易日:20190611","情感倾向是中性。"
"2019-06-10 15:03:33","中信建投证券股份有限公司当年累计新增借款超过上年末净资产百分之二十的公告","证券代码：601066 证券简称：中信建投公告编号：2019-050号中信建投证券股份有限公司当年累计新增借款超过上年末净资产百分之二十的公告本公司董事会及全体董事保证本公告内容不存在任何虚假记载、误导性陈述或者重大遗漏，并对其内容的真实性、准确性和完整性承担个别及连带责任。根据《公司债券发行与交易管理办法》、《公司债券日常监管问答(五)》的相关规定，中信建投证券股份有限公司(以下简称“公司”)就2019年1-5月累计新增借款情况予以披露，具体情况如下：一、主要财务数据概况截至2018年12月31日，公司经审计合并口径的净资产为478.63亿元，借款余额(含公司发行的、计入股东权益-其他权益工具的50亿元永续次级债券)为687.74亿元。截至2019年5月31日，公司借款余额为795.81亿元，累计新增借款金额108.07亿元，累计新增借款占上年末(即2018年末)经审计净资产比例为22.58%，超过20%。二、新增借款的分类披露(一)银行贷款截至2019年5月31日，公司银行借款余额较2018年末减少1.46亿元，变动额占上年末经审计净资产的比例为-0.31%，主要系短期借款余额减少所致。(二)企业债券、公司债券、金融债券、非金融企业债务融资工具截至2019年5月31日，公司发行债券(包括公开发行公司债券、非公开发行公司债券、次级债券、证券公司短期公司债券、证券公司短期融资券、境外美元债及永续次级债券等)余额较2018年末增加115.37亿元，变动额占上年末净资产的比例为24.10%，主要系公司发行次级债券、证券公司短期融资券余额增加所致。(三)委托贷款、融资租赁借款、小额贷款不适用。(四)其他借款截至2019年5月31日，公司其他借款(含收益凭证、转融资等)余额较2018年末减少5.83亿元，变动额占上年末净资产的比例为-1.22%，主要系收益凭证余额减少所致。三、本年度新增借款对偿债能力的影响分析上述新增借款符合相关法律法规的规定，属于公司正常经营活动范围。公司财务状况稳健，目前所有债务均按时还本付息，上述新增借款事项不会对公司经营情况和偿债能力产生不利影响。上述数据均为合并口径数据，除2018年末净资产外均未经审计，新增借款的分类披露合计数因四舍五入与公司新增借款总数略有差异，敬请投资者注意。特此公告。中信建投证券股份有限公司董事会2019年6月6日","该文本情感是中性的。"
"2019-06-10 10:42:16","券商股集体跳水中信建投逼近跌停 5月券商业绩难言乐观","周一早盘，券商板块大幅跳水，截至发稿，板块整体跌超4%，中信建投逼近跌停，华鑫股份跌8%，国元证券、南京证券、东北证券、国盛证券等跌超7%，天风证券等集体单边下挫。数据显示，截至目前，在已公布5月成绩的31家券商中，仅有12家券商5月净利润呈现同比增长，另外，有三家券商5月净利润呈现亏损，华鑫股份亏损0.22亿元，东北证券亏损0.18亿元，国元证券亏损1.65亿元。此前，据《中国基金报》报道，截至6月6日晚7点半，共有23家上市券商披露了5月业绩，总体来看，5月券商业绩仍难言乐观，营收和净利润环比均下降。按照母公司口径计算，23家券商5月合计实现营收101.49，环比下降18.05%，净利润合计32.97亿元，环比下降30.9%。","情感倾向是消极。"
"2019-06-06 17:34:15","中信建投5月净利润环比减少逾90%","6月6日，中信建投发布5月财务数据。2019年5月，中信建投(母公司)营业收入6.81亿元，环比减少25.53%；净利润3141.39万元，环比减少90.92%。","情感倾向是消极。"
"2019-06-06 16:50:54","中信建投证券股份有限公司关于获准发行永续次级债券的公告","证券代码：601066 证券简称：中信建投公告编号：临2019-049号中信建投证券股份有限公司关于获准发行永续次级债券的公告本公司董事会及全体董事保证本公告内容不存在任何虚假记载、误导性陈述或者重大遗漏，并对其内容的真实性、准确性和完整性承担个别及连带责任。2019年3月14日，中信建投证券股份有限公司(以下简称“公司”)2019年第一次临时股东大会审议通过了《关于申请继续发行永续次级债券的议案》。具体内容详见公司于2019年1月 24日、3月14日在《中国证券报》、《上海证券报》、《证券时报》、《证券日报》及上海证券交易所网站(www.sse.com.cn)发布的相关公告。近日，公司收到中国证券监督管理委员会(以下简称“中国证监会”)《关于中信建投证券股份有限公司发行永续次级债券有关意见的复函》(机构部函[2019]1348号)。根据该函，中国证监会对公司发行永续次级债券事项无异议。公司将严格按照中国证监会的相关要求完成永续次级债券的发行工作。特此公告。中信建投证券股份有限公司董事会2019年6月5日","情感倾向是中性。"
"2019-06-06 16:30:30","中信建投：母公司5月份净利润3141万元","中信建投(601066)6月6日晚间公告，2019年5月，中信建投(母公司)净利润为3141.39万元。公司此前披露，中信建投(母公司)4月份净利润为3.46亿元。","该文本情感是积极的。"
"2019-06-04 19:29:47","中信建投：预计5月CPI同比增速回升至2.8%左右","中信建投表示，预计CPI同比增速反弹，PPI增速回落。PPI方面，基于行业高频数据测算，5月PPI环比增速约0.1%，同比增速回落至0.6%左右。CPI方面，猪肉、鲜果、蛋类等支撑食品价格增速回升明显，预计5月CPI同比增速回升至2.8%左右。","情感倾向是积极的。"
"2019-05-31 08:47:37","31家券商助推新三板企业A股IPO 中信建投保荐8家位居第一","今年以来，IPO上会数量有所减少，但新三板挂牌企业申请IPO的热情却未减少。据《证券日报》记者统计，截至5月30日，正在排队待审的IPO项目中，包括83家新三板转板企业，占比达26.4%，较年初增长了19个百分点，新三板挂牌企业申请IPO的热情仍未减少。从总体数据来看，今年以来虽然IPO上会数量有所减少，但受理的IPO审核申报企业数量并没有下滑趋势。东方财富Choice数据显示，截至5月30日，证监会受理的IPO审核申报企业为314家，其中处于“已受理”状态的有77家，“已反馈”的有97家，“已预披露更新”有139家，“暂缓表决”有1家。新三板转板方面数量也有所增长。排队待审的拟IPO企业中，新三板挂牌公司的IPO首发申报共有83家，占比达26.4%，较年初增长了10个百分点。增长十分明显。这83家排队待审拟IPO新三板企业中，为“已受理”状态的有22家，“已反馈”状态有23家，“已预披露更新”状态有38家。值得注意的是，据《证券日报》记者不完全统计，今年以来还有44家新三板企业宣布正式开始冲刺IPO，进入上市辅导阶段。该数据与去年同期基本持平。不难看出，在今年IPO上会企业数量有所下滑的背景下，新三板挂牌企业申请IPO的热情却仍未减少。对此，联讯证券新三板研究负责人彭海对《证券日报》记者表示，“新三板IPO数量增多实际上说明了现在新三板中有一批企业的成长性良好，企业的发展体量已经达到了主板上市的要求。企业上市一是融资需求，二是交易价值，从融资角度来看，如果新三板在未来提高解决融资需求问题能力，自身成长较好的新三板企业也未必一定需要进行转板。”从目前正在排队上市的新三板转板企业的保荐机构情况来看，有31家券商帮助新三板企业转板IPO。有8家新三板挂牌企业的保荐机构选择了中信建投证券。一直以来，中信建投证券在IPO、新三板承揽承销业务方面均位居行业前列。民生证券和国金证券分别担任7家和6家正在排队的新三板转板企业的保荐机构。另外，招商证券、光大证券、中金公司、广发证券的保荐数量也在4家以上，排在各券商保荐项目数量前列。不过，近期新三板挂牌数量跌下10000家，新三板流通性问题备受市场关注，对此，中国市场学会金融学术委员、东北证券研究总监付立春对《证券日报》记者表示：“目前新三板确实面临着一些压力，但新三板的后续发展一定是从量的扩张到质的提高的阶段。目前新三板企业的数量还是非常多的，企业的规范性、基本面千差万别。所以所谓的政策优惠是不太可能的，要提高质量还是要通过分层的方式。目前，科创板也在为新三板在内的其他板块提供了一个试点方向，这些方向包括注册制、以信息披露为核心等。同时，新三板企业也要更好更多地履行信息披露职责，从投资者关系、公司规范化治理等方面来进行升级。”","情感倾向是积极的。"
"2019-05-28 21:54:42","中信建投、华泰证券将增资旗下另类投资子公司","5月28日，中信建投、华泰证券同日发布董事会决议公告。两家券商公告中均显示，董事会审议通过了对旗下另类投资子公司进行增资的议案。中信建投5月28日公告称，公司第二届董事会第十三次会议审议通过《关于对中信建投投资有限公司增资的议案》，同意对中信建投投资有限公司(简称“中信建投投资”)增资人民币 12 亿元。中信建投年报显示，中信建投投资为中信建投的全资另类投资子公司，于 2017 年 11 月 27 日成立，2018 年 1 月 3 日完成首次注资，承担证券自营投资品种清单以外的另类投资业务，注册资本人民币 10 亿元。同日，华泰证券公告称，公司召开第四届董事会第二十二次会议，审议通过公司将华泰创新投资有限公司(简称“华泰创新投资”)注册资本增加至人民币 35 亿元，用于华泰创新投资有限公司的业务开展及相关投资。此外，同意授权公司经营管理层按照公司投资管理相关规定及流程，根据其业务开展时点在董事会授权额度和期限内分批划拨相应款项。最后，同意授权公司经营管理层按照法律法规及监管规定办理有关本次增资所需的登记、注册等相关程序。华泰证券年报显示，华泰创新投资为华泰证券全资的另类投资子公司，于2013年11月21日成立，注册资本5亿元，目前经营范围为项目投资、投资管理、销售贵金属、酒店管理。有业内人士表示，科创板跟投制度下，券商另类投资子公司对保荐机构的重要性不言而喻，券商增资另类子公司或是为后续跟投做准备。","该文本情感是积极的。"
"2019-05-28 17:54:36","中信建投证券执委会委员调整","中信建投证券5月28日公告称，公司通过董事会决议，胡斌不再担任公司执委会委员，并增补彭文德为公司执委会委员。公开信息显示，胡斌是中信建投国际总经理，彭文德则是中信建投期货董事长。","以上文本情感极性属于中性。"
"2019-05-28 17:18:28","中信建投证券拟向中信建投投资增资12亿元","中信建投证券5月28日下午公告称，公司全票通过董事会决议，拟向中信建投投资有限公司增资12亿元。工商信息显示，中信建投投资是中信建投证券的全资子公司，目前注册资本10亿元。","该文本情感是中性的。"
"2019-05-20 04:16:37","空缺两年多 中信建投证券迎来新首席经济学家","证券时报记者获悉，中国首席经济学家论坛理事、原东兴证券首席经济学家张岸元，已于5月17日正式履职中信建投证券，出任首席经济学家。自2016年12月份，中信建投证券原首席经济学家周金涛离世，该职位已空缺了两年有余。卖方研究正在加速“供给侧改革”，中信建投证券研究发展部的目标是三年内挤入行业前五名。记者了解到，去年四季度，中信建投研究所明确了新的考核和激励机制，坚定贯彻人员“有进有出”，传媒行业首席分析师杨艾莉亦已正式履职，接下来还将有多位行业首席陆续亮相。打造总量研究团队记者了解到，张岸元将与中信建投证券研究发展部联席负责人、宏观固收首席分析师黄文涛，以及策略首席张玉龙、金融工程及大类资产配置首席丁鲁明，共同打造中信建投证券在总量研究方面的最强阵容。中信建投证券研究发展部行政负责人武超则对证券时报记者表示，“张岸元到任后，将进一步提升中信建投证券在市场和公众眼中的品牌知名度和影响力。当然，中信建投研究所的整体研究实力也将进一步提高，尤其是在总量研究方面将如虎添翼。”据记者了解，近两年来，中信建投证券一直努力寻找适合的首席经济学家人选。武超则表示，“张岸元具备优秀首席经济学家的三大要素：出身名门，熟悉政策；学有专长，善于沟通；性格沉稳，谦逊务实。”张岸元出生于1970年，毕业于南开大学国际经济研究所，2004年进入国家发展改革委员会宏观经济研究院，曾作为中方主要专家为众多发展中国家提供财政金融政策援助。2016年，张岸元进入券商研究领域，担任东兴证券首席经济学家。“对政策的把握和解读都非常到位。”有资深业内人士如此评价张岸元。研究所改革进行时中信建投研究所正在践行改革，自去年10月上任起，武超则就大力推进研究所改革，一方面推进新的激励机制，一方面计划引入8至10名业内有较大影响力的分析师、优秀销售等。记者了解到，自推行全新的人才考核激励制度以来，中信建投研究实现人员“有进有出”，研究人才队伍结构不断优化。国内推出科创板并试点注册制，对券商研究所的研究深度和定价能力都提出了更高要求，卖方研究正迎来一个新的历史机遇期。","情感倾向是积极。"
