"Date","Title","Content","qwen_lora2_情绪提取"
"2019-03-21 04:28:25","中信建投再次遭遇看空 多家券商下调其评级","随着年报出炉，10多天前刚被券商出具“看空”研报的中信建投，又被3家券商下调估值。截至昨日，3月份至少有6家券商对中信建投做出最新点评，其中3家给出“中性”评级，1家给出“持有”评级，2家直接给出“卖出”评级。下调估值的券商至少增至4家。证券时报记者梳理发现，各研究机构均认可中信建投的投行业务领跑优势，但基于前期涨幅过大、公司盈利能力难长期支撑目前估值、全年计提信用减值损失较同业更为充分等原因，而做出下调估值或“中性”评级。又有3家券商下调中信建投估值2018年年报显示，中信建投证券去年营收109亿元，同比微降3.5%；归母净利润31亿元，同比下滑23.11%。整体表现优于行业，此前研究机构估算券业净利润整体下滑幅度达41%。截至3月20日，加上此前率先发布看空研报的华泰证券，已至少有4家券商下调对中信建投估值，其中天风证券将其从“增持”下调至“持有”，中银国际证券从“增持”下调“中性”，华金证券则从“买入-B”下调至“卖出-B”。光大证券和山西证券研报则对中信建投进行首次覆盖，双双给出“中性”评级。其中，光大证券将目标价格定为23.5元。天风证券分析称，中信建投去年业绩下滑主要是受计提信用减值损失、手续费及佣金收入下滑影响。其中，受市场震荡下行、交易量萎缩、监管政策变化的影响，2018年累计手续费及佣金净收入64亿元，同比下滑16%；全年计提信用减值损失12亿元，计提规模较同业更为充分。中信建投2018年基本每股收益0.38元，同比下滑25%；未来6个月给予“持有(调低评级)”。华金证券则是基于三点原因将中信建投证券的评级由“买入”下调至“卖出”。首先，2月以来，中信建投股价快速上涨超110%，涨幅大幅超越其他上市券商，并且相较H股溢价425%；其次，公司ROE(净资产收益率)并不突出，尤其是130亿元增发完成后，公司盈利能力难长期支撑目前估值；第三，33亿股限售股将于6月20日解禁，届时自由流通市值较小而产生的流动性溢价将不复存在。中银国际证券上调了中信建投未来3年的预测盈利值，但由于前期涨幅过大，下调至中性评级。另外，在估值方面，光大证券认为，中信建投于2018年完成首次公开发行A股，募资22亿元，进一步充实资本金。结合行业估值，考虑到次新股通常享有溢价，中信建投目标价为23.5元。研报公认投行业务有优势在年报点评上，各家券商研报对中信建投的业务优势并无异议。作为行业龙头券商，中信建投2018年投行业务领跑、资管业务转型等成效均在研报中得到肯定。投行业务是中信建投的第一大营收来源，2018年中信建投投行业务手续费净收入占营收的比例达到28.74%，高于第二大营收来源自营收入6个百分点。中信建投证券在年报中披露了经营数据：2018年，公司股权融资主承销家数位居行业第二名，主承销金额位居行业第一名；债券业务主承销家数和主承销金额均位居行业第二名，其中公司债的主承销家数和主承销金额均位居行业第一名；并购业务方面，重大资产重组项目家数位居行业第一名。2018年中信建投投行业务收入31.34亿元，同比下降6.37%。光大证券在研报中表示，由于审核从严、市场环境较弱，2018年市场股权融资规模同比下降32%，但中信建投市占率逆市提升，股权融资主承销金额位居行业第二。公司项目储备丰富，截至2018年底在审IPO、股权再融资项目数分别位于行业第一及第二名。","情感倾向是消极。"
"2019-03-21 02:34:08","中信建投连遭看空 券商估值提升空间犹存","据中国证券报记者统计，截至记者发稿，继3月8日华泰证券对中信建投A股出具“卖出”评级后，又有5家券商研报对中信建投A股做出点评。具体来看，有2家券商系首次覆盖并给出“中性”评级，有2家券商下调评级至“中性”或“持有”，1家券商下调评级至“卖出”。分析人士认为，在金融持续改革下，近期的小幅调整不影响对行业估值及业绩持续提升的预期。非银龙头连遭评级下调山西证券和光大证券均对中信建投A股出具了“中性”评级，且均系首次覆盖。光大证券引用中信建投的年报数据称，2018年中信建投实现收入109亿元，同比下降3.5%，归属于母公司股东扣非净利润30.6亿元，同比下降23.3%，好于行业平均降幅(41%)。光大证券认为，中信建投投行业务继续领跑，科创板优势明显。由于审核从严、市场环境较弱，2018年全市场股权融资规模同比下降32%，但中信建投市占率逆市提升，股权融资主承销金额位居行业第二，且项目储备丰富。光大证券认为，公司当前估值高于行业平均，并考虑到次新股通常享有溢价，给予其“中性”评级。山西证券在研报中认为，中信建投的投行业务领先，资管转型成效显著，但前期涨幅过高，故而维持“中性”评级；中银国际证券也认为其前期涨幅过大，下调至中性评级；天风证券认为其当前估值高于行业平均水平，将评级从“增持”调低至“持有”。值得注意的是，华金证券在其研报中称，中信建投股价快速上涨超110%，涨幅大幅超越其他上市券商。此外，中信建投33.0亿股限售股(是目前流通盘8.25倍)将于今年6月20日解禁，届时自由流通市值较小而产生的流动性溢价将不复存在。因此华金证券将其评级由“买入”下调至“卖出”。中长期利好券商估值提升国君非银团队表示，尽管近期券商板块出现一定程度的调整，但政策超预期和业绩超预期逻辑依然存在，依然建议增持券商板块。从目前市场监管导向及在路演过程中的客户反馈来看，预计市场稳健、理性的上行是未来最可能的结果，建议优选低估值、基本面改善明显的龙头个股。华创证券表示，在金融持续改革下，近期的小幅调整不影响对行业估值及业绩持续提升的预期。科创板及试点注册制作为近十年来资本市场范围内最为重要的改革举措，将持续驱动直接融资市场的发展。券商作为资本市场的中介桥梁，在制度改革过程中将持续扮演重要角色，股权融资市场规模的扩大也将从中长期利好于券商估值提升。中泰证券认为，市场活跃有望持续提升，目前多家券商已上线科创板交易权限申请，经纪业务有望持续受益；科创板试点注册制提升直接融资效率，推动现代化投资银行转型发展，审核重点转变弱化“牌照通道”效用，资金实力+研究能力+合规风控能力+机构服务能力等综合实力均有望提升；科创板同时试行保荐人相关子公司的“跟投”制度，中介机构可通过子公司使用自有资金进行跟投，券商私募股权融资渗透率有望加深，同时叠加并购重组政策改善，退出渠道通畅，直投未来业务发展可期，持续看好资本实力雄厚、市场化运作程度较高的龙头券商。","情感倾向是积极。"
"2019-03-20 17:34:52","华兴资本：投行业务成业绩增长主力","作为当前资本市场的重中之重，科创板不仅考验着拟上市企业的资质，也是保荐机构比拼综合实力的平台。随着科创板开闸，各券商均在投行业务方面加足马力，以期抢占增量市场。保荐机构实力如何？中信建投(601066.SH)、华兴资本(1911.HK)两家科创板热门券商在日前发布了2018年业绩报告，值得一提的是，这也是上述两家在2018年分别于A股、港股上市后的首份年报。综合来看，投行业务成为其业绩增长的核心动能，新经济和投行业务占据半壁江山的迹象愈发明显。不过，业内人士认为，科创板对券商业绩的刺激更偏中长期。华兴资本：投行业务成业绩增长主力据华兴资本3月19日发布的2018年度业绩公告显示，2018年公司总收入录得2.11亿美元，较2017年同比增长51.2%，经营利润为4018.9万美元，较2017年同期强势提振。在排除优先股、附带权益收入等会计处理影响后，经调整净利润稳步增长至6730.1万美元。投行业务成业绩增长动能。财报显示，三大业务分部的收入表现上，投资银行业务在2018年度收入1.47亿美元，同比增长49.4%。“新经济公司首次公开发售增加，导致股票承销服务费用增加等。”对于投行业务增长的原因，华兴资本给出上述解释，同时，去年并购业务与私募融资顾问收入出现双增也是助力因素。从业务分部的经营利润方面来看，投资银行2018年经营利润为3733.8万美元，同比增长181.0%，为业务增长最多分部，此外，投资管理业务2018年经营利润为1490.6万美元，同比增长56.8%；华菁2018年度经营损失收窄58.8%。华兴资本去年9月底登陆港交所，华兴资本参与过的新经济项目包括：2011年的大众点评、赶集，2012年的优酷土豆，2013年的百度、PPS、奇虎360,2014年的新浪微博及陌陌，2015年的滴滴快的、美团点评，58赶集，2017年的快手、摩拜，2018年的优信等。华兴资本在发布业绩报告的同时，还表示将继续“加码”新经济，在未来一段时间计划扩大新经济行业覆盖面、持续开发产品组合等。中信建投：再遭“看空”评级虽然券商2月经营业绩回暖给市场注入一针强心剂，但从去年全年指标来看，券商仍承受着“寒冬”的影响。从国内龙头券商中信建投2018年业绩指标来看：据中信建投3月18日晚间发布的2018年年报显示，公司去年全年营业收入为109.07亿元，同比减少3.5%；归属于母公司股东净利润为30.87亿元，同比下降23.11%。年报出炉后，中信建投又遭“看空”，华金证券、中银国际、天风证券等多家机构均不同程度下调对中信建投评级。","该文本情感是积极的。"
"2019-03-20 12:35:07","又见看空报告！三家券商集体下调中信建投评级：超800亿元限售股将要解禁","继此前被华泰证券“看空”，中信建投又“中枪”了。3月18日，中信建投披露了2018年年度报告。2018年中信建投营收109.07亿元，同比下降3.50%；扣非归母净利润30.6亿元、同比下降23.3%；其中投行收入31.3亿元，同比下降6.4%。年报出炉后，中信建投再遭同行券商华金证券“看空”，华金证券将中信建投的评级由“买入”下调至“卖出”。与此同时，中银国际下调其评级至“中性”，天风证券则从“增持”调低至“持有”。截至今日早盘收盘，中信建投报25.78元，微涨0.47%，盘中一度涨逾3%。华金证券“看空”中信建投另两家券商下调评级之所以“看空”中信建投，华金证券在报告中列出了以下三点原因：1、2月中旬以来，公司股价快速上涨超110%，涨幅大幅超越其他上市券商。此外，互联互通、同股同权情况下公司A股价格已是H股的425%。2、公司ROE并不突出(中信建投2018年加权平均ROE为6.79%)，尤其130亿元增发完成后。10%左右的长期可持续ROE支撑2.0-2.5xP/B是合理的。公司目前2018A、19EP/B达4.26x和3.49x，大幅高于可比公司。公司盈利能力难长期支撑目前估值。3、33.0亿股限售股(是目前流通盘8.25倍)将于6月20日解禁，届时自由流通市值较小而产生的流动性溢价将不复存在。","该文本情感是消极的。"
"2019-03-20 10:12:00","牛市龙头再遭棒喝！中信建投年报刚出炉又遭3机构下调评级","自2019年开年以来，中信建投股价涨幅达194%，位居A股上市券商之首，堪称本轮牛市的龙头。作为2018年上市回A的H股券商，中信建投回归A股第一年的业绩表现格外受到市场关注。3月18日晚间，中信建投披露2018年年报，全年营收109.07亿元，同比减少3.5%；归母净利润30.87亿元，同比下滑23.11%。但在发布财报的第二日，中信建投就遭到天风证券、中银国际和华金证券3家机构下调评级，其中天风给予“持有”评级，中银给予“中性”评级，而华金证券则给予“卖出”评级。值得一提的是，就在几天前的3月8日，华泰证券刚刚将中信建投评级下调至“卖出”，这也是近年来罕见的券商沽空个股报告，一度引发市场热议。不过中信建投股价走势似乎并未受看空研报的影响，今日早盘低开后一路上攻，最高时涨至26.59元，截至发稿时涨幅有所收窄。年报发布后再遭3机构下调评级华金建议“卖出”3月18日，中信建投发布2018年年报，全年营收109.07亿元，同比减少3.5%；归母净利润30.87亿元，同比下滑23.11%。虽然业绩出现小幅下滑，但考虑到2018年国内市场环境等因素，对比行业整体41%的业绩下滑幅度，其市场表现仍较为突出。在年报发布后第二天，天风证券、中银国际和华金证券却发布研报下调公司评级，其中天风和中银分别给予“持有”“中性”的评级，而华金则建议“卖出”。","情感倾向是消极。"
"2019-03-20 09:10:03","中信建投股价被看空背后：市盈率超60倍 2018年净利降两成","去年登陆A股的中信建投，于3月18日晚间交出了上市后的首份年报。年报显示，中信建投2018年实现营收109.07亿元，同比下降3.5%；净利润30.87亿元，同比下降23.11%。至于原因，中信建投表示，主要受宏观环境影响，证券市场出现大幅波动。从细分业务看，中信建投的财富管理业务营收最高，为36.19亿元，但与上年同期相比下滑22.79%；投资银行和投资管理业务分别实现营收30.49亿和14.07亿元，同比下滑6.63%和12.60%，不过，公司交易及机构客户服务收入增长54.85%至22.99亿元。年报披露，2018年中信建投股权融资主承销金额居于行业首位，家数则居于第二；债券业务主承销家数和主承销金额均位居行业第二，其中公司债的主承销家数和金额均居行业第一；并购业务方面，中信建投的重大资产重组项目家数位居行业第一。新三板持续督导创新层挂牌公司数量位居主办券商第二。二级市场上，截至3月19日收盘，中信建投的股价为25.66元/股，较年初低点上涨192.26%，市盈率为63.55倍，而广发证券、国泰君安、招商证券均不足30倍。目前，中信建投的总市值为1962.06亿元在谈及中信建投股价上涨的原因时，一私募人士表示，主要是股市转暖交投活跃所致，中信建投还曾在研报《牛市的起点》唱多券商板块。面对“士气如虹”的股价，中信建投于3月6、7日，接连发布两份风险提示公告，称根据申万证券II指数公布的41家A股上市券商的加权平均静态市盈率(TTM)为37.2 倍，而中信建投的静态市盈率(TTM)为77.2倍，高出行业平均市盈率约一倍。华泰证券也于3月8日发布了一篇将中信建投评级下调至“卖出”的研报。该研报指出，中信建投A股2019年PB估值4.5倍，显著高于同梯队券商当前1.4-2倍PB和国际投行1-2倍PB估值水平。乐观估计公司2019-2020年ROE水平约10%、10.5%，公司2019年EPS0.67元，BPS6.93，预计合理股价在13.86至17.33元/股。中信建投如何评价2018年的业绩，又会如何看待被同行看空等问题，中国网财经记者先后致电致函中信建投，但截至发稿尚未收到回复。","情感倾向是消极的。"
"2019-03-20 00:07:31","上市首年净赚30亿！中信建投年内涨幅达194.6% 看空研报成评级分水岭","自2018年6月20日登陆A股，中信建投上市后首份年报近日出炉。2018年，中信建投实现营业收入109.07亿元，同比下降3.50%；归属于本公司股东的净利润为30.87亿元，同比下降23.11%。基本每股收益0.38元，加权平均净资产收益率6.79%。同时，公司提出每10股派现1.8元(含税)的分红预案。2018年度，中信建投合计给高管发放薪酬逾6000万元。此外，13名高管收到2013年度的递延薪酬，累计2600万元。3月19日，中信建投A股报收25.66元，下跌3.17%，年初至今股价涨幅达194.6%。此前，曾因股票连续多日涨停，中信建投被华泰证券下调至“卖出”评级，研报趋势自此成为分水岭。1净利下滑逾两成3月18日晚间，中信建投披露2018年年报，为A股上市后交出的首份“成绩单”。受市场大幅波动等因素影响，公司营收净利双降。2018年，中信建投实现营业收入109.07亿元，同比下降3.50%；归属公司股东净利润为30.87亿元，同比下降23.11%。记者查阅中国证券业协会数据发现，2018年证券行业131家证券公司未经审计的净利润总计为666.2亿元，同比下滑41.2%。从净利润下滑的程度来看，中信建投交出的“成绩单”略好于行业平均水平。进一步来看，中信建投2018年度营业收入构成中，投行等分项收入出现不同程度降幅。记者翻阅利润报表发现，中信建投2018年度经纪业务手续费净收入为22.91亿元，较2017年下降24.77%；资管业务手续费净收入6.91亿元，同比下滑17.52%；投行业务手续费净收入为31.34亿元，同比下滑6.37%。另一方面，利息净收入和自营收入同比增长。其中，利息净收入为19.93亿元，相较2017年上涨50.42%。参照“自营收入=投资收益-对联营企业和合营企业的投资收益+公允价值变动收益”的公式进行大致估算，中信建投证券2018年自营收入为24.17亿元，同比微涨0.11%。中银国际证券非银金融分析师王维逸表示，在去年二级市场持续低迷的情况下，中信建投主动将权益类投资的比重由7%下降至3%，同时中信建投加大了对场外期权等衍生品资产的投资力度，取得了可观的收益。2科创板助力投行可期得益于前期项目储备丰富等因素影响，中信建投投行业务表现较为显眼。相关数据显示，2018年，一级市场股权融资394家，募集资金1479.75亿元，股权融资家数同比下降60.04%，融资规模下降31.81%。其中，IPO发行数量大幅下降，全年仅发行上市105家，同比下降76.03%，募集资金1378.15亿元，同比下降40.11%。2018年，中信建投完成股权融资项目31个，位居行业第二名；主承销金额940.52亿元，位居行业第二名。其中，IPO项目10个，主承销金额143.74亿元；再融资项目21个，主承销金额796.78亿元。2018年，公司债务融资业务完成共计586个主承销项目，累计主承销项目总规模为6283.88亿元，均位居行业第二名。中信建投在年报展望中充满信心：“2019 年，设立科创板并试点注册制将带来增量IPO业务，股权再融资制度有望优化，预计股权融资一级市场业务保持相对稳定。公司将继续发挥均衡全能的投资银行业务优势，在优质客户开发方面加大力度，重视项目质量控制和风险管理，稳健推进股权融资业务发展。”","该文本情感是积极的。"
"2019-03-19 16:13:49","被开出“卖空研报”的中信建投晒业绩：去年净利下降23%","3月18日晚间，在本轮行情中曾被视作券商龙头股的中信建投(601066)披露了2018年年报，其2018年全年营业收入为109.37亿元，同比(较上年同期)减少3.5%；归属于母公司股东净利润为30.87亿元，同比下降23.11%。另外，中信建投拟采用现金分红方式，以2018年12月31日的股本总数7646385238股为基数，向全体股东每10股派发现金红利1.80元(含税)。中信建投在年报中称，在政策支持下，设立科创板并试点注册制将带来增量IPO业务，股权再融资制度有望优化，预计股权融资一级市场业务保持相对稳定。公司将继续发挥投资银行业务优势，在优质客户开发方面加大力度，重视项目质量控制和风险管理，稳健推进股权融资业务发展。值得一提的是，此前的3月8日，华泰证券发布研报称，中信建投估值远高于同梯队券商和国际投行，有下行风险，下调至“卖出”评级。这份研报导致中信建投当时的连涨势头受挫。3月19日，中信建投收报25.66元/股，跌3.17%。投行业务是重要营收来源2018年年报显示，中信建投将业务板块主要分为四块——投资银行、财富管理、交易及机构客户服务、投资管理。具体来看，投资银行业务板块实现营业收入合计30.49亿元，同比下降6.63%；财富管理业务板块实现营业收入合计36.19亿元，同比下降22.79%；交易及机构客户服务业务板块实现营业收入合计22.99亿元，同比增长54.85%；投资管理业务板块实现营业收入合计14.07亿元，同比下降12.60%。中信建投的投行业务一直具有行业优势，近期“巨无霸”京沪高速铁路股份有限公司正式启动A股上市工作，委托的上市辅导机构就是中信建投。2018年，中信建投完成股权融资项目31个，位居行业第2名；主承销金额达940.52亿元， 位居行业第2名。其中IPO项目10个，主承销金额为143.74亿元；再融资项目21个，主承销金额为796.78 亿元。据中信建投在年报中透露，截至2018年12月31日，公司在审IPO项目36个，位居行业第1名，在审股权再融资项目16个，位居行业第2名。随着科创板的继续推进，中信建投的投行优势再次凸显。在已经披露辅导进展的拟上科创板企业中，哈尔滨新光光电科技股份有限公司的保荐机构就是中信建投。中信建投也在年报中称，2019年，虽然宏观经济形势仍不容乐观，但在政策支持下，设立科创板并试点注册制将带来增量IPO业务，股权再融资制度有望优化，预计股权融资一级市场业务保持相对稳定。中信建投还透露了财富管理业务板块的经营数据以及未来布局。2018年公司财富管理业务板块实现营业收入合计人民币36.19亿元，同比下降22.79%。其中，经纪业务手续费净收入为22.91亿元。2018年，公司代理买卖证券业务净收入市场占比3.08%，位居行业第10名。在财富管理板块，中信建投特别提到投资研究业务方面，“近年来，买方机构对卖方研究机构的综合实力越来越重视，在新财富最佳分析师评选暂停以后，市场对高端机构客户的研究服务竞争日趋激烈。2019年，公司将加大引入高端人才力度，不断提高研究覆盖的广度和深度，并在合规基础上积极推进与公司其他业务线的协作，为各类机构客户及各业务线提供更加全面和深入的服务。 ”此前被华泰证券看空市场较为关注的还是中信建投的股价，3月19日，中信建投收报25.66元/股，跌3.17%。而在此前，中信建投被市场认为是券商股的上涨龙头，在3月8日之前的10个交易日实现了8次涨停，从年初至今的涨幅为204.25%。","该文本情感是消极的。"
