"Date","Title","Content","qwen_lora2_情绪提取"
"2019-07-24 23:43:13","150亿大甩卖！谁是“接盘侠”？猥亵女童案还在发酵","新城控股大甩卖正在进行中！7月24日晚间，新城控股发布了一则转让项目公司股权的公告，此前所称的拟出售部分项目公司股权正在逐步推进。而根据最新的董事会决议，新城控股此次筹划的项目公司股权及相关债权转让，交易总额或达到150亿元。甩卖仍在持续，目前交易已逾40亿元公告称，截至2019年7月24日，新城控股子公司就杭州聚厉企业管理有限公司等10个项目公司与交易对方签订了相关股权及债权转让协议，交易对价合计约为41.54亿元，约占公司2018年末经审计归母净资产的13.62%，全部以现金支付。其中，有5个项目公司的相关股权及债权转让协议是在7月24日签订的，交易对价合计约为17.65万元，所涉及的受让方包括中骏集团、宝龙地产、金科股份、仁恒置地、旭辉控股等。几乎同时，金科股份发布了受让房地产项目公司股权的公告，称其全资子公司拟平价收购新城控股下属6家房地产项目公司股权。交易完成后，金科股份将持有6家房地产项目公司100%股权，预计本次交易成交总额约为17.21 亿元。","情感倾向是消极。"
"2019-07-24 23:29:07","新城控股作价41.54亿元转让10个项目","7月24日晚，新城控股(601155)发布公告称，截至2019年7月24日，公司子公司就杭州聚厉企业管理有限公司等10个项目公司与交易对方签订了相关股权及债权转让协议，交易对价合计约为41.54亿元，约占公司2018年末经审计归母净资产的13.62%，全部以现金支付。本次交易实施不存在重大法律障碍。本次交易未构成重大资产重组。本次交易事项在公司第二届董事会第十八次会议授权范围内，无需提交股东大会审议。本次交易预计不会对公司2019年度经营业绩和财务状况产生较大影响。这10个项目具体包括，杭州聚厉企业管理有限公司24%股权转让，许昌金宏房地产有限公司51%股权转让，常熟新城悦欣房地产开发有限公司85%股权转让，上饶市悦盛房地产开发有限公司100%股权转让，宿州新城金悦房地产开发有限公司100%股权转让，平湖悦泽房地产开发有限公司100%股权转让，青岛悦茂房地产开发有限公司100%股权转让，日照亿鼎房地产开发有限公司100%股权转让，太原新城悦拓房地产开发有限公司100%股权转让以及平湖创域房地产有限公司100%股权转让。","情感倾向是中性。"
"2019-07-24 23:02:28","王晓松壮士断腕 新城仍有100亿项目待售","壮士断腕，方能破釜沉舟。新城控股新任董事长王晓松已经作出选择。7月22日深夜，新城宣布，已就5个项目与交易对方签订了股权转让协议，交易成交总额约为24亿元。此后交易继续，新城摆上台面售卖的公告至少有40个之多。两天后，新城控股再卖5个项目股权。细节显示，今日，新城就杭州聚厉企业管理有限公司等5个项目公司与交易对方签订了相关股权及债权转让协议，包括股权、债权在内，交易对价合计约为17.65亿元。包括此前的5个项目，截至2019年7月24日，新城控股已签约转让了10个项目公司，约占公司2018年末经审计归母净资产的13.62%，全部以现金支付，公司可通过此，一次性回笼41.54亿元资金。据了解，项目的转让仍在继续，新城有高管每日的主要工作都是与潜在买方进行谈判。新城在公告中声称，此番计划出让的项目总金额将不超过150亿。从最新公告来看，第一个转让的资产是杭州聚厉股权。新城共持有杭州聚厉企业管理有限公司24%股权。新城控股子公司新城鼎宏分别杭州中骏、浙江宝龙、金华昌仁转让其持有的杭州聚厉9%、 9%及6%股权，转让费均是0元，但上述三方需按受让股权比例承接新城鼎宏对杭州聚厉的股东借款共1.92亿元并支付相应的资金占用费。杭州中骏是中骏的全资子公司、浙江宝龙的控股股东是宝龙地产、而金华昌仁是旭辉的全资子公司。交易之前，杭州聚厉的持股结构是新城鼎宏持股24%、杭州中骏持股24%、浙江宝龙持股24%、金华昌仁持股28%。杭州聚厉的核心资产是义乌江东街道青口片区项目，该项目占地面积72267.73平方米，容积率2.75。项目处于前期开发准备阶段。义乌市自然资源和规划局信息显示，这是一宗商服+住宅用地，于今年5月成功出让给杭州聚厉。也就说，杭州聚厉是一个项目公司，新城、中骏、宝龙、旭辉组成联合体拿下，如今新城转让股权，完成退出项目。除了杭州聚厉，新城还转让了许昌金宏房地产有限公司51%股权，接盘侠是金科百俊，金科百俊是金科的全资子公司，涉及费用是1.72亿元。许昌金宏是为开发许昌市CD2018-66#宗地(东城区B1-3-2#)项目而设立的项目公司，今年5月10日成立，是新城与金科的合资公司。","情感倾向是消极。"
"2019-07-24 22:58:46","新城控股41.5亿元出售第一批10个项目股权","宣布转让旗下40个项目股权的新城控股(601155.SH)，在2天后对外公布了首批10个项目的交易方及具体转让项目情况。7月24日晚间，新城发公告称，10个项目与交易对方签订了相关股权及债权转让协议，交易对价合计约为41.5亿元，约占公司2018年末经审计归母净资产的13.62%，全部以现金支付。接下10个项目股权的房企有6家，分别是金科、龙湖、宝龙、中骏、仁恒和旭辉。其中，金科数量最多为6个项目。金科也发布公告称，收购新城下属6家房地产项目股权，交易完成后金科将持有这6个项目100%股权，预计本次交易成交总额约为 17.21 亿元。新城此番转卖项目股权，共一次性拿出了40个项目，首批交易已经完成。经济观察网记者从接近新城人士确认，40个项目出售几乎全部完成，剩余项目交易还在最终谈判阶段，下一批买家还包括招商、新力、阳光城、弘阳等房企。根据公告，新城出售股权的40个项目均为新获取纯住宅项目，于前期开发阶段尚未销售。今年上半年，新城大举拿地，土地投资金额约为550亿元。新城在公告中称，如本轮交易完成，新城可收回部分上半年已支付的土地款，预计可新增净现金约150亿元，上半年土地投资金额可减少至约400亿元。预计可减少该部分项目当年度后续开发成本及费用约30亿元，增加货币资金、改善资产负债结构，提高流动比率，增强偿债能力。新城方面称，交易对价参考项目公司的累计投入确定， 以不低于投入成本收回投资。本轮交易拟转让项目总货值约450亿元，其中2019年可推货值约100亿元、2020年可推货值约250亿元、2021年可推货值约100亿元。新城方面表示，出售40个项目股权是为了优化公司资产负债结构。前述知情人士透露，新城今年上半年获取的土地中多为合作项目，转卖股权会优先卖给合作方。经济观察网记者梳理发现，此次首批转让的10个项目中，有2个项目为合作项目，新城通过出售其所持股权全部退出；此外8个项目为新城100%持股项目，其中7个项目将全部股权转让，1个项目转让给仁恒85%股权、新城还保留15%股权。","情感倾向是积极。"
"2019-07-24 22:49:39","王晓松41亿已到手！新城控股披露10项目套现详情","这也是对新任董事长朋友圈的一次小小检验。7月24日晚间，新城控股(601155.SH)公告披露了40项目资产包中10个项目的转让详情。新城控股董事长王晓松一顿操作，在业内演绎了一把“众人拾柴火焰高”，其朋友圈也露出一角。7月24日晚间，新城控股公告董事会决议，称公司拟筹划转让部分项目公司股权及相关债权(即此前报道的40个项目)，预计可新增净现金约150亿元，预计可减少该部分项目当年度后续开发成本及费用支出约30亿元。截至2019年7月24日，公司已累计就10个项目公司签署了相关股权及债权转让协议，交易对价合计约为415392.92万元，约占公司2018年末经审计归母净资产的13.62%，全部以现金支付。其中，新城杭州子公司——杭州聚厉企业管理有限公司就转让了5个项目公司，交易对价合计约为176,515.77万元(其中股权转让款约为10,000万元，债权转让款约为166,515.77万元)，全部以现金支付。新城杭州项目转让目前占比约为41%。中骏、宝龙、旭辉、仁恒、金科、百俊、郑州瑞湖等8家房企接盘了10个项目。其中百俊房地产由金科地产与光明地产于2018年投资成立，总部位于常州。上述10个项目分布于杭州、青岛、郑州、江阴、江西上饶等地，其中中骏、宝龙、旭辉联手接盘1个，金科(含旗下的百俊)接盘6个，中骏接盘2个，仁恒与郑州瑞湖各接盘1个。新城控股拟出售项目套现150亿对业绩是否产生负面影响？据公告披露，拟转让项目均为近期新获取、尚未销售的纯住宅项目，对目前公司在售项目与商业综合体项目均无影响。2019年上半年新城土地投资金额约为550亿元，扣除本轮交易拟转让部分后，2019年上半年土地投资金额约为400亿元，相比去年同期增长约为15%。从本轮交易拟转让项目的总货值也可推测对2019年度销售的影响：40个项目总约为450亿元，其中2019年可推货值约为100亿元、2020年可推货值约为250亿元、2021年可推货值约为100亿元。新城方面认为，本轮交易拟转让项目的交易对价参考公司对项目公司的累计投入确定，以不低于投入成本收回投资，对新城控股净资产不会产生不利影响。此外，新城控股此次董事会除了传递今年2700亿销售目标不变等信息之外，还强调了持续发展投资性房地产的战略。在2019年度40亿元租金和管理费收入的基础上，2020年、2021年，新城控股投资性房地产的租金和管理费收入目标不低于60亿元和90亿元。10个项目，从透露转让意向，到实现签约转让，时间之短，在业内罕见。这说明，王晓松带领下的新一届管理层，思想统一，行动坚决，效率奇高。而朋友圈的房企这么快就与其达成协议，不仅仅是人缘关系，最重要的恐怕还是这些项目质地并不错。毕竟，这还是生意，不小的生意。至于41亿套现到手，新城控股是否就此安全了，没有人敢打包票，但至少让投资者、金融机构和公司员工放心多了。如果其余30个项目亦能迅速套现，如期换得150亿净现金，那新城基本是安全了。","情感倾向是积极。"
"2019-07-24 22:25:36","新城控股：已售出10个项目 卖项目总共将换回150亿现金","7月24日晚间，新城控股(601155.SH)发布公告称，公司就5个项目转让事项于金科股份签订交易协议，交易对价合计约为17.65亿元。涉及受让方包括中骏集团、宝龙地产、金科股份、仁恒置地、旭辉控股等。截至2019年7月24日，公司子公司就杭州聚厉企业管理有限公司等10个项目公司与交易对方签订了相关股权及债权转让协议，交易对价合计约为41.54亿元，约占公司2018年末经审计归母净资产的13.62%，全部以现金支付。同一天，金科股份(000656.SZ)晚间发布公告，称全资子公司拟平价收购新城控股下属6家房地产项目公司股权，预计成交总额约为17.21亿元。金科股份表示，此次交易涉及项目公司主要从事住宅项目开发，交易完成后预计可为公司新增计容建筑面积102.22万平方米。出售项目引发市场对新城控股资金及未来规模增幅的担忧。受此影响，7月23日，新城控股跌停至26.73元/ 股，7月24日低开最终以0.90%的微弱涨幅收盘。7月24日，新城控股召开紧急董事会，并公布董事会内部，明确当前公司经营策略、未来目标，试图消除市场影响，提振信心。董事会解释称，此举为资产结构优化措施，是为执行公司当前经营策略，增强抗风险能力和经营稳健性。公告显示，公司拟筹划转让部分项目公司股权及相关债权，交易总额不超过150亿元，且不存在亏本交易，转让对价不会低于投入成本。据悉，转让项目为近期公开市场新获取的纯住宅项目，项目均处于前期阶段，尚未销售。交易完成后，公司可新增净现金约150亿元，预计可减少该部分项目当年度后续开发成本及费用支出约30亿元。公司表示，本轮交易拟转让项目的总货值约为450亿元，其中2019年可推货值约为100亿元、2020年可推货值约为250亿元、2021年可推货值约为100亿元。新城控股表示，新获取的净现金及公司现有货币资金将对公司其余项目的各项支出及稳定、安全运营提供保障。在回收约150亿元土地款后，上半年新城控股土地投资金额约为400亿元，相比去年同期仍有约15%的增长。交易完成后，公司的土地储备依旧布局均衡、货值充裕，足以应对周期轮动和市场风险，保障公司未来几年内的平稳及可持续发展；增加公司货币资金、改善资产负债结构，提高公司流动比率，增强偿债能力。新城控股董事会在明确当前公司策略时称，未来两年，公司销售规模将会于2019年的2700亿元持平，但来自于投资性房地产的租金维持每年50%的增幅，至2021年将达到90亿元。","情感倾向是消极的。"
"2019-07-24 21:50:53","新城控股价值41.54亿元项目出售 金科收购6项目","几乎同时，金科股份发布了受让房地产项目公司股权的公告，公告称，金科股份全资子公司拟平价收购新城控股下属6家房地产项目公司股权，交易完成后金科股份将持有6家房地产项目公司100%股权，预计本次交易成交总额约为17.21 亿元。本次交易涉及项目公司主要从事住宅项目开发，交易完成后预计可为金科股份新增计容建筑面积102.22万平方米。易居研究院智库中心研究总监严跃进对新京报记者表示，从项目本身来说，住宅项目的去化效果还是不错的，而商业项目本身在资金回笼等方面有障碍，另外商业项目也容易受当地消费习惯等影响，所以这都会使得住宅项目的收购性价比更高。对于此类住宅项目的出售，可以加快资金回笼。新城控股近期不管是否有资金压力，积极做好资金充裕，总会显得不被动，这也有助于后续应对各类经营上的问题。","情感倾向是积极。"
"2019-07-24 21:15:18","新城控股：转让10个项目公司股权 交易对价约41亿","据上交所消息，新城控股董事会及全体董事保证本公告内容不存在任何虚假记载、误导性陈述或者重大遗漏，并对其内容的真实性、准确性和完整性承担个别及连带责任。重要内容提示：截至2019年7月24日，公司子公司就杭州聚厉企业管理有限公司等10个项目公司与交易对方签订了相关股权及债权转让协议，交易对价合计约为415,392.92万元，约占公司2018年末经审计归母净资产的13.62%，全部以现金支付。本次交易实施不存在重大法律障碍。　　本次交易未构成重大资产重组。本次交易事项在公司第二届董事会第十八次会议授权范围内，无需提交股东大会审议。","该文本情感是中性的。"
"2019-07-24 17:11:38","新城控股回应传闻：约40个项目正在谈、协商出售","7月10日，上海市普陀区人民检察院依法对犯罪嫌疑人王某某、周某某批准逮捕。案件正在进一步办理中。因为这起案件被卷入舆论风波的上市公司新城控股，在最近不到一个月的时间里，经历了股价暴跌、内部人事变动等，而这场风波对公司的影响也并未平息。7月22日晚间，新城控股发布澄清公告，回应有关市场传闻称：公司正与合作伙伴就公司近期公开市场新获取项目的合作方式进行洽谈、协商，筹划出售部分项目公司股权。截至目前，公司已在洽谈、协商出售的项目约为40个(含合联营项目)，但拟出售的标的项目公司范围、交易对方及交易金额均存在不确定性。如上述交易最终完成，公司可通过转让项目公司股权收回部分上半年已支付的土地款，增加公司货币资金、优化公司资产结构。截至目前，公司已就5个项目与交易对方签订了股权转让协议，交易成交总额约为24亿元，约占公司2018年末经审计归母净资产的8%。此前，有知情人士告诉《每日经济新闻》记者，新城控股确有平价转让项目的情况存在，但具体涉及多少项目不便透露。记者同时获悉，除了卖项目以外，新城控股在南京、合肥等地的部分项目已开始相继撤资。新城控股方面回复记者称：相关信息以公司公告为准。对于金科成为新城控股项目首个买家的传闻，金科相关负责人向记者表示，有些东西不便告知，之前集团和新城控股就有合作，当然有这种想法，最后还是以公告为准。而另一家正在与新城控股接洽的房企人士则告诉记者，现在还在看，肯定是收住宅项目，涉及若干个项目，现在谈判还没结果。多家企业参与洽谈收购虽然金科方面尚未确认接盘新城控股项目，但记者注意到，金科与新城控股的合作其实早已有之。早在2017年，新城控股便与金科联手，将首个合作项目——新城金科桃李郡落子重庆北部新区。今年4月8日，金科以350万元/亩摘得阜阳经开区[2018]-130号地，总价约9.746亿元。该地块由金科与新城合作开发，楼盘名称为新城金科江山城。4月9日，新城控股联手金科地产以520万元/亩的单价，将宿州政务区稀缺住宅用地——2018-31#地块收入囊中，总价约8.72亿元，楼面价约为3545.45元/平方米。7月7日晚间，金科股份公告称，金科地产控股项目公司拟向合作方上海新城万嘉房地产有限公司提供不超过1.5亿元的财物资助。本次财务资助期限2年，按照年化利率8%向项目公司支付资金占用费用。而上海新城万嘉房地产有限公司背后的控股股东为新城控股。据《每日经济新闻》记者了解，新城控股这一批次转让项目因所处位置不错，参与洽谈收购的企业也不少，并且前来进行项目考察的不少是上市公司，如弘阳等。对于此次资产包出售，接近新城的人士告诉记者，住宅项目主要讲究的是规模，因而利润率并不高，因此新城会选择舍弃一些不操盘、利润率不高的项目，只要接盘方愿意接受，价格合理就很容易谈成。优质区域住宅平价转让值得注意的是，新城控股此次“准备出售”资产包的住宅项目，大部分位于长三角地区，区域位置相对优越。那么，为什么新城控股会作出这样的决定？前述接近新城控股的人士表示，一方面，整个行业下半年融资趋紧，新城也不例外，在作最坏的打算，更看重现金流，在规模和现金流之间做一个平衡；其次，从新城角度来说，(此次出售的项目)一方面是合作里不操盘的，还有一些是新项目，主要是收现金流，基本都是平价卖出去的，不会是亏着来卖。现阶段渡过危机最重要，万一下半年遇到危机，可以凭此挺过难关，增加经营安全性。","情感倾向是中性。"
"2019-07-24 13:37:45","新城40项目出售近收尾曝光：账面资金或达安全值","记者通过多名接近新城控股知情人士处获悉，目前新城拟出售的40项目资产包几近出售完毕。记者此前从接近王晓松的知情人士了解到，新城此次处置资产几乎都为平价出售。这批项目的出售，保守估算，至少可以回笼150亿资金，且各接盘方给到新城的付款方式和周期均对新城有利。新城经过这一轮资金回血，增加了足够的防御现金流，足以应对公司下半年刚性经营支出及到期债务偿还，以及下一步的应对风险处置。","该文本情感是积极的。"
"2019-07-24 12:44:58","新城控股正在洽谈出售约40个项目","23日，刚从舆论漩涡中缓过气来的新城控股突然再度跌停，股价逼近前期低位。有分析认为，新城控股再度跌停可能跟其发布的一份澄清公告有关。根据周二交易所龙虎榜，在23日跌停中，沪股通买入1.01亿元，为第一大买方席位。同时，沪股通账户还卖出6434.42万元。当天沪股通净买入3453.18万元。而方正证券重庆分公司净卖出1.38亿元，为第一大卖出席位。新城控股在23日的公告中透露，截至目前，已就5个项目与交易对方签订了股权转让协议，交易成交总额约为24亿元，约占公司2018年末经审计归母净资产的8%。同时，已在洽谈、协商出售的项目约为40个(含合联营项目)，但拟出售的标的项目公司范围、交易对方及交易金额均存在不确定性。新城控股表示，上述项目尚未开始销售，转让该部分项目公司股权不会对公司2019年经营业绩产生较大影响。今年全年的销售目标依然是2700亿元。记者对比发现，今年以来，新城控股经营情况已经出现波动。根据财报，2018年新城控股实现归属于上市公司股东净利润104.91亿元，同比增长74.02%。但今年一季度，归属于上市公司股东净利润下降至2.07亿元，同比减少42.63%。因此，有分析认为，从财务数据来看，新城控股一季度营业收入和净利润双双负增长，负债率上升。而变卖项目成为目前较为直接的获取现金的方式。","情感倾向是消极。"
