"Date","Title","Content","qwen_lora2_情绪提取"
"2019-07-05 00:23:56","股债双杀！百余只基金或“踩雷”新城控股","尽管连夜更换掌舵人，新城控股仍未能逃脱被资本抛弃的命运。7月4日，新城控股开盘即遭“股债双杀”。股价方面，新城控股一字跌停，跌停板封单资金超百亿元，报收38.42元。旗下两家港股上市公司也未能幸免，自7月3日股价开启暴跌模式，截至7月4日收盘，新城发展控股和新城悦服务累计跌幅均超30%。债券方面，新城控股发行的“15新城01”、“18新控05”今日跌幅分别达8.46%、8.65%。百余只基金或“踩雷”作为一家全国前十强房企，新城控股备受公募青睐。东方财富网显示，截至2019年一季度末，共有133只基金合计持有新城控股8553.64万股，占总股本的3.79%。其中，有50只基金将其纳入前十大重仓股之列。▲图片来源：东方财富网此外，新城控股前十大流通股股东中，出现了2只公募专户和2只公募基金的身影，而其中3只产品是今年一季度才新进该股。","情感倾向是消极。"
"2019-07-05 00:21:10","新城一夜","一小时蒸发165亿港元7月3日下午，一条新城控股时任董事长王振华被刑拘的传言，令新城系上市公司遭遇大挫。据人民网报道，7月3日晚间，上海普陀警方通报一起备受关注的猥亵女童案。据警情通报信息，受害女童被其母亲的朋友周某某(女，49岁，江苏人)从江苏老家带至上海，入住酒店后在房间内遭到猥亵，犯罪嫌疑人王某某(男，57岁，江苏人)7月1日下午到公安机关接受调查。目前，王某某、周某某因涉嫌猥亵儿童罪已被普陀警方刑事拘留。人民网称，犯罪嫌疑人王某某被多家媒体向警方证实为新城控股时任董事长王振华。王振华系江苏常州人，生于1962年，这与警情通报所披露犯罪嫌疑人王某某的籍贯和年龄信息吻合。这位57岁江苏商人在资本市场掌控着三家上市公司，包括新城控股(601155.SH)、新城发展(01030.HK)、新城悦(01755.HK)。下午传言流出时，因A股新城控股临近收盘，股价未受影响，报收42.69元，上涨3.79%。港股新城发展控股于3点一刻前后开始闪崩，最大跌幅超过27%，报收8.04港元，下跌23.86%；同时，集团旗下物业上市公司新城悦的遭遇也与前者类似，最大跌幅达31.25%，报收6.56港元，下跌23.72%。短短一小时内，两家港股上市公司的市值合计蒸发超165亿港元。7月3日晚间10点刚过，新城控股发布公告称，接到上海市公安局普陀分局通知，公司实际控制人、董事长王振华先生因个人原因被刑事拘留。","情感倾向是消极。"
"2019-07-04 23:18:56","最狠5个跌停！57岁董事长猥亵女童案发酵 重仓基金净值大跌 还有大雷？100亿净利润遭质疑","这几天，相信重仓了新城控股的基金经理们心里是又愤怒又郁闷。上市公司爆雷的路有千万条，研究员们千算万算，哪能想到一个千亿市值的大房企，背后竟然藏着一个魔鬼。以如此不堪的作恶方式出现。连人民日报都连发三问：究竟是猥亵还是强奸？“输送”幼女是否存在病态利益链？嫌犯有无性侵女童前科？王振华旗下有三家上市公司，一家A股两家港股，基金公司也给出了最新估值，最多五个跌停。股债双杀三大上市公司2天蒸发300亿7月3日下午有媒体曝光之后，夜间上海警方也发布通告，证实新城控股董事长涉嫌猥亵9岁女童一事。随后旗下三家上市公司齐发公告，王振华之子王晓松任公司董事长。另外两家港股称，王振华被刑事拘留，拘留与公司经营无关，公司经营保持正常。消息证实，今天4日一开盘，资金夺命出逃，A股港股的公司股价都崩了。A股上市公司新城控股(601155.SH)盘前集合竞价时已经被砸到跌停位置，开盘后一字跌停，跌停板封单资金超百亿，市值跌去96.4亿元人民币。加上昨日港股的暴跌，新城系三家上市公司这两天市值蒸发300亿元左右。当然这仅仅只是开始，由于A股设有涨跌停限制，新城控股的崩塌肯定不止一个跌停板，4日晚间，不少基金公司发布了对它的估值调整。多家基金公司下调估值最狠给出5个跌停陷入前任董事长“王振华涉嫌猥亵女童丑闻”旋涡已超过30个小时的新城控股，港股新城发展控股两日大跌34.43%，昨日A股上市公司新城控股也无悬念跌停，今日晚间，多家基金公司通过深交所发布估值调整公告，绝大多数都是按照31.12元，相比7月3日收盘价，3个跌停估值。","以上文本情感极性属于消极。"
"2019-07-04 22:57:25","还有2个跌停！基金公司今晚集体下调新城控股估值","7月3日，一则关于上市公司新城控股董事长王振华因涉嫌猥亵女童被上海警方刑拘的新闻引爆全网，消息面对资本市场的影响逐渐发酵，7月4日早间，新城控股不出意料一字跌停。新城控股的黑天鹅事件也引得基金公司齐齐下调其估值，7月4日晚间，包括东证资管、平安基金、国投瑞银、富国基金、景顺长城、融通基金、中银基金等多家基金公司率先下调了新城控股估值至31.12元，按昨日42.69元/股收盘价计算，相当于三个跌停板。估值下调3个跌停板新城控股原董事长王振华的儿子王晓松临危受命也依然没能挽回公司股价跳水的命运，毫无悬念，新城控股今日开盘就跌停了。截至7月4日收盘，新城控股股价收报38.42元/股，单日成交金额仅有2352万元，跌停板封单资金超百亿，新城控股最新市值867亿，较前一日市值已蒸发近百亿元。跌停的同时新城控股遭遇大额资金无情甩卖。交易所盘后披露的龙虎榜显示，新城控股当日净卖出1848万元，其中沪股通专用、川财上海分公司、兴业石狮八七路、东莞惠州分公司、光大深圳深南达到分别卖出238万元、77万元、75万元、64万元、50万元。7月4日晚间，多家基金公司率先对新城控股估值作出调整，如景顺长城基金晚间公告表示，自7月4日起，对旗下持有新城控股基金进行估值调整，估值价格调整至31.12元。同日作出31.12元/股估值调整的还有融通基金、富国基金、上海东方证券资管、平安基金和国投瑞银。数据显示，截至一季度末共有44家基金公司的132只基金持有新城控股7990万股，持有市值36.08亿元，其中景顺长城、富国基金、平安基金、分别持有231.8万股、704.28万股、79.34万股。某公募基金经理向《每日经济新闻》记者表示，对于新城控股估值，我们预估5个左右跌停是比较合适的，后续还会有更多的基金公司对估值作出调整 “发生这种事情后，基本面面临的压力在于银行抽贷以及成本的上升，其实它的质地本身还是不错的，这件事是董事长的个人行为，更像是黑天鹅，机构在调研过程中也很难判断。”“基金公司做出三个跌停的估值调整是可以理解的，不过这只是现阶段的调整，还要看后续的市场变化，新城董事长丑闻虽然是个人事件，也对公司声誉产生了极大的伤害，作为高负债的房企，一旦现金流收紧，公司经营就会出现风险，会产生多米诺骨牌效应。”某第三方基金平台人士评价道。黑天鹅致股债齐跌","消极。"
"2019-07-04 22:36:14","还有两个跌停：多家基金下调新城控股估值至31.12元/股","7月4日，深陷丑闻的新城控股(601155)开盘一字跌停，并保持跌停至收盘，报38.42元。7月4日晚间，东证资管及多家基金公司发布估值下调公告，自7月4日，将新城控股估值下调至31.12元，相当于未来还有2个跌停。","消极"
"2019-07-04 22:17:12","股民用脚投票！董事长作孽 新城控股“一字”跌停 各方切割、排查、观望","实控人、董事长王振华涉嫌犯罪，新城控股(601155)股价今日全天封死“一字”跌停板，市值较前一交易日蒸发约96亿元。分析人士预计，后市该股继续跌停的概率非常大，公司逾3.8万户股东欲哭无泪。王振华实际控制的两间港股公司新城发展控股(1030.HK)和新城悦服务(1755.HK)截至港股收盘，股价分别下跌11.57%和13.41%，市值较前日收盘时缩水达55亿港元和7亿港元。新城控股旗下多只债券也遭遇暴跌。其中，“15新城01”全天最大跌幅为下跌11.51%；“18新控05”盘中最大跌幅达13.46%。今日晚间，东证资管、平安基金、国投瑞银、富国基金、景顺长城、融通基金、中银基金等多家基金公司，下调旗下基金持有的新城控股股票估值，估值价格均为31.12元/股进行估值。新城控股今日跌停，报38.42元/股，前述估值相当于目前股价继续两个跌停。股债双杀，如此惨烈的原因都在于实控人、董事长王振华的自作孽，其日前因涉嫌猥亵儿童罪已被上海普陀警方刑事拘留。北京分公司表面平静相比于A股和债券市场上的惨状，新城控股实际运营层面如何？在联系多位新城控股管理人员未果的情况下，中国证券报记者7月4日下午3时许，来到位于东城区某大厦的新城控股北京公司实地探访。尽管遭遇董事长被刑拘的负面消息影响，新城控股北京公司整体显得秩序井然，不时有多位前来洽谈房地产业务的相关人士到访，在公司前台，记者看到诸如会议室安排以及到访人员安排的相关纸质单据，显得整体业务流转较为正常。一位前来洽谈售楼处装修业务的人士还因没有办公室而与新城控股人员在大厅对谈。","以上文本情感是消极的。"
"2019-07-04 22:14:52","6家机构下调新城控股估值","截止至证券时报记者发稿，已有平安基金、国投瑞银基金、富国基金、景顺长城、广发基金、东证资管等多家机构发布新城控股估值下调公告，将该公司估值统一下调至31.12元，距离7月4日的收盘价38.42元还差两个跌停。","情感倾向是消极。"
"2019-07-04 22:05:58","东证资管下调新城控股估值至31.12 元/股 相当两个跌停","今日晚间，东证资管给出关于旗下集合资产管理计划持有的新城控股股票估值调整的公告，自2019年07月04日起，公司对旗下集合资产管理计划持有的新城控股(股票代码：601155)股票进行估值调整，按照31.12元/股进行估值。据记者计算，该估值相当于目前股价继续两个跌停。","情感倾向是消极。"
"2019-07-04 22:05:12","多家基金公司下调新城控股股票估值至31.12元/股 相当于两个跌停","今日晚间，东证资管、平安基金、国投瑞银、富国基金、景顺长城、融通基金、中银基金等多家基金公司，下调旗下基金持有的新城控股股票估值，估值价格均为31.12元/股进行估值。新城控股今日跌停，报38.42元/股，前述估值相当于目前股价继续两个跌停。","情感倾向是消极。"
"2019-07-04 21:55:00","重磅！东证资管回应：下调新城控股估值至31.12元 相当于两个跌停","新城控股董事长王某因猥亵9岁女童，于7月1日在上海被采取强制措施。该消息立刻在资本市场上引起轰动，今日新城控股跌停一字跌停，报收38.42元，全天仅成交2352万元，至收盘跌停板上封单近310万手。盘后数据显示，沪股通专用位居买一席位买入237.82万元；华泰证券股份有限公司深圳深南大道基金大厦证券营业部卖出2131.54万元，一机构席位卖出220.91万元。市值损失近百亿。一日损失近7000万大白马新城控股的暴跌拖累A股141家机构投资者，其中东证资管旗下明星产品东方红有两只产品损失惨重。其中东方红内需增长集合资产管理计划持有1013.4万股；东方红8号双向策略集合资产管理计划持有557.5万股，均位列前十大流通股东，两只计划合计占比达到0.7%。今日新城控股的暴跌，让这两只产品合计损失达到6707.7万元。机构如何应对？今日晚间，东证资管给出关于旗下集合资产管理计划持有的新城控股股票估值调整的公告：根据《中国证券监督管理委员会关于证券投资基金估值业务的指导意见》(证监会公告[2017]13号)等有关规定，经与资产管理计划托管人协商一致，自2019年07月04日起，本公司对旗下集合资产管理计划持有的新城控股(股票代码：601155)股票进行估值调整，按照31.12元/股进行估值。本公司将密切关注“新城控股”后续经营情况及其他重大事项，进行合理评估，并与资产管理计划托管人协商，必要时进一步确定其估值价格。待上述股票的交易体现了活跃市场交易特征后，将恢复按市场价格进行估值，届时不再另行公告。敬请投资者予以关注。据记者计算，该估值相当于目前股价继续两个跌停。【相关报道】多家基金公司下调新城控股股票估值至31.12元/股 相当于两个跌停今日晚间，东证资管、平安基金、国投瑞银、富国基金、景顺长城、融通基金、中银基金等多家基金公司，下调旗下基金持有的新城控股股票估值，估值价格均为31.12元/股进行估值。新城控股今日跌停，报38.42元/股，前述估值相当于目前股价继续两个跌停。(来源：证券时报网)跌停！新城控股市值蒸发96亿 东证资管损失1.4亿7月4日新城控股旗下两只在港上市公司股价重挫，其中港股新城控股发展、新城悦服务开盘跌超10%。消息面上，新城控股董事长王振华因涉嫌猥亵9岁女童，于本月1日在沪被采取强制措施。A股集合竞价期间，新城控股已巨单登上跌停板，开盘后封死在跌停板上，市值蒸发约96亿","情感倾向是消极的。"
"2019-07-04 19:57:03","新城控股撞上“黑天鹅”","7月4日上午，位于上海普陀区的新城控股(601155.SH)总部像往常一样安静，不少员工匆匆赶来上班，8点半后，办公大楼大堂和整个园区恢复平静，办公区之外，几名新城控股的工作人员静候着前来采访的媒体。4日下午，随着媒体和外来人员不断增多，新城控股总部办公大楼的保安人员开始不断增加。在外来人员中，有一部分来自金融机构和合作方的人士被接待到楼上的办公区开会， 媒体守候在附近守株待兔。过去几年里，这家来自江苏常州的黑马房企，一手是商业地产吾悦广场，一手是住宅地产，两大业务相互配合不断在发展历史上的迎来高光时刻，短短几年时间跃进一线房企序列。转折出现在7月1日，这一天下午，正在主持召开新城控股营销反思会的原董事长王振华被上海警方带走调查。7月3日，上海警方通报了王振华因涉嫌猥亵儿童罪被刑事拘留。新城控股也以最意想不到的方式迎接了“黑天鹅”。王振华不仅仅是新城控股的实控人和董事长，还是港股上市的新城发展(01030.HK)和新城悦服务(01755.HK)两家上市公司的实控人。猥亵儿童事件爆发后，也将新城控股这家蒸蒸日上的房企推向不确定的未来。7月3日晚间，三家上市公司紧急发布公告，1987年出生的王晓松在危急情况下接替其父王振华，担任新城控股董事长。经济观察报获悉，在发布公告以后，新城内部立即面向全体员工发布了一则言简意赅的通知。这则收件人显示为“新城控股、新城发展、新城悦、新城实业各位同事”的通知表示，“公司各项业务在董事长兼总裁王晓松先生及总裁室成员的带领下有序开展，经营情况一切正常。请各位同事各司其职，确保各项业务按计划推进。”但资本市场并不平静，7月3日，王振华涉事消息一经发出，新城发展和新城悦两家公司跌幅均逾20%，市值合计蒸发约166亿港元。7月4日，新城控股开盘即跌停，新城发展和新城悦跌幅均超过10%。债券方面，新城控股发行的“15新城01”、“18新城05”跌幅超过13%。王振华涉案也将新城控股陷入漩涡中，一位新城员工表示：“你可以批判王振华的个人行为，但不能否定新城数万员工合力打下的江山，这对员工来说并不公平。”对于临危受命的王晓松而言，困难和考验才看看开始，由于王振华涉及刑事案件，有可能会让新城控股部分债务发生违约，而且股价大幅跳水也有可能会触及质押平仓线，新城控股还有一系列难题等待他去一一化解。","情感倾向是消极。"
"2019-07-04 19:34:46","新城控股董秘被约谈？公司回应：不属实 系先前约定","新城控股公关负责人7月4日18时许对新京报记者表示，关于江苏省证监局约谈新城控股董秘，提示做好信息披露的消息不属实，7月4日，由于江苏证监局专管员的人员变动，新城控股董秘前往江苏省证监局与新任专管员进行对接，此次拜访系先前与江苏证监局专管员约定好的，本来约定时间定在7月3日，由于董秘临时有事更改见面时间为7月4日，并非新城控股实控人陷入猥亵案之后的行为，但此次新城控股董秘前往江苏省证监局拜访谈话也涉及实控人陷入猥亵案的情况。","该文本情感是中性的。"
"2019-07-04 19:11:38","新城控股董秘被约谈？回应：不属实 系先前约定","新城控股公关负责人表示，关于江苏省证监局约谈新城控股董秘，提示做好信息披露的消息不属实。7月4日，由于江苏证监局专管员的人员变动，新城控股董秘前往江苏省证监局与新任专管员进行对接，此次拜访系先前与江苏证监局专管员约定好的，本来约定时间定在7月3日，由于董秘临时有事更改见面时间为7月4日，并非新城控股实控人陷入猥亵案之后的行为，但此次新城控股董秘前往江苏省证监局拜访谈话也涉及实控人陷入猥亵案的情况。","该文本情感是中性的。"
"2019-07-04 18:52:19","新城控股董秘被约谈？公司独家回应：不属实 系先前约定","在7月3日新城控股遭遇实际控制人陷入猥亵案的“黑天鹅”事件后，新城控股于7月4日经历了股债双杀，A+H股市值自事件发生以来共计蒸发超287亿元。在7月3日港股上市公司新城发展控股及新城悦股价暴跌，市值共计蒸发超160亿港元之后，7月4日，两港股上市公司股价持续暴跌，收盘前跌幅收窄，截至收盘，新城发展控股股价下跌10.57%，收于7.19港元/股，换手率为9.64%，市值蒸发超50亿港元；新城悦股价暴跌13.11%，收于5.70港元/股，换手率为10.31%，市值蒸发7.05亿港元。自猥亵风波发酵以来，两家港股上市公司市值共计蒸发超217亿港元。港股股价暴跌对A股上市公司新城控股也形成一定抛压，开盘后新城控股股价迅速跌停，收于38.42元/股，换手率仅为0.03%，市值蒸发超96亿元。王振华旗下上市公司市值共计蒸发超287亿元。利空传导到债市，截至16时30分，15新城01下跌8.46%，18新控05下跌8.65%，19新城02下跌10%。在新城控股业绩高速发展的背景下，上市公司的信披问题更是成为投资者最为关注的问题，7月4日下午，《中国经营报》报道指出今天上午，江苏省证监局约谈了新城控股董秘，意在了解公司目前的经营状况以及相关舆情，并提示新城控股做好相关信息披露工作。新城控股公关负责人7月4日18时许对新京报记者表示，关于江苏省证监局约谈新城控股董秘，提示做好信息披露的消息不属实，7月4日，由于江苏证监局专管员的人员变动，新城控股董秘前往江苏省证监局与新任专管员进行对接，此次拜访系先前与江苏证监局专管员约定好的，本来约定时间定在7月3日，由于董秘临时有事更改见面时间为7月4日，并非新城控股实控人陷入猥亵案之后的行为，但此次新城控股董秘前往江苏省证监局拜访谈话也涉及实控人陷入猥亵案的情况。","以上文本情感是中性的。"
"2019-07-04 18:51:57","新城控股爆黑天鹅：百亿卖单封跌停 股民追问能否索赔","7月3日晚间，上市公司新城控股集团股份有限公司(证券简称：新城控股 601155)披露公告称，公司董事会审议通过董事兼总裁王晓松任公司第二届董事会董事长，而王晓松为新城控股原董事长王振华的儿子，王振华日前因涉嫌猥亵女童被上海警方刑拘。百亿卖单封跌停，新城控股一天蒸发约96亿，近4万投资者踩雷此番“子承父业”，被业界解读为新城控股的“切割”行为，但新城控股股价仍旧无法“逃脱”跌停的命运。截至7月4日收盘，新城控股股价全天一字跌停，最终逾309万手、价值近120亿卖单封住跌停板，股价报38.42元/股，全天成交仅2352万元，较前一个交易日8.10亿元大幅缩水，而新城控股总市值也由前一个交易日的963亿元下跌至今天收盘的867亿元，蒸发约96亿元。而王振华控股的另外一家上市公司港股新城发展控股(01030.HK)也录得大跌，其于7月3日大跌23.86%后，于4日收盘再度下跌10.57%。截至2019年一季度末，A股新城控股共有股东38415名，其中，富域发展集团有限公司(下称“富域集团”)、常州德润咨询管理有限公司(下称“常州德润”)分别持股61.06%、6.11%，分列新城控股前两大股东，富域集团和常州德润为新城控股实际控制人王振华所实际控制的企业。此外，新城控股十大股东中出现多名机构投资者，其中，中国证券金融股份有限公司的持股比例为1.25%，UBSAG、东证资管-招行-东方红内需增长集合资产管理计划、中国农业银行股份有限公司-交银施罗德精选混合型证券投资基金、中国银行-华夏回报证券投资基金和东证资管-工行-东方红8号双向策略集合资产管理计划也出现在新城控股十大股东之列。据数据，共计162家机构持有新城控股股份，占流通股比例为5.85%，其中133家基金持有新城控股3.81%的股权，28家券商持有新城控股1.49%的股权，一家QFII持有新城控股0.46%的股权。信披是否违规？律师说信披时点在合理时间范围对此，不少股民在网上提出质疑，新城控股是否涉嫌信披违规？股民是否可以据此提出索赔？公开信息中提到的两个时间点成为关键，“7月1日下午，在警方工作下犯罪嫌疑人王某某(男，57岁，江苏人)至公安机关接受调查”，以及“公司于2019年7月3日接到上海市公安局普陀分局通知”。北京市京师(上海)律师事务所律师李银伟向新京报记者表示：“如果新城控股违规披露，投资者可以要求新城控股给予赔偿。”不过，李银伟表示，根据《上市公司信息披露管理办法》的规定，“公司董事、监事、高级管理人员涉嫌违法违纪被有权机关调查或者采取强制措施”属于应当发布临时报告的“重大事件”。从上海市公安局警情通报的内容看，7月1日，犯罪嫌疑人王某接受警方的刑事调查，此时还无法确定新城控股已经获悉其实际控制人、董事长已经被刑事拘留。7月3日在收到警方证实通知后于当天召开董事会等事由披露，并不违背信息披露的及时性要求。北京寻真律师事务所王德怡律师向新京报记者表示，公安机关决定拘留之后，应当将相关的法律文书送达给其成年家属或所在的单位，送达需要合理期限，上市公司内部走流程审核时也需要时间。目前看来，这是在合理的时间范围内。“法定时限是两个交易日，应该从公安机关将拘留决定送达给上市公司的次日起算。”王德怡表示，“而且这个拘留只涉及前董事长的个人行为，与公司的经营行为没有关联性，投资者没法据此索赔。”","该文本情感是消极的。"
