"Date","Title","Content","qwen_lora2_情绪提取"
"2019-07-09 10:01:40","新城控股盘中打开跌停板 公司回应前董事长被刑拘信息披露全过程","7月9日早盘，新城控股(601155)在开盘时打开跌停板。截至发稿时，股价报28.11元/股，跌幅为9.67%。7月8日晚间，新城控股在回复上交所监管工作函时还原了原董事长王振华被采取强制措施的全过程。公告称，经公司核实，2019年7月2日，公司现任董事长、总裁王晓松接到上海市长风新村派出所(简称“派出所”)电话后，于当日23:00左右前往派出所，得知公司原董事长王振华被采取强制措施。为避免内幕信息扩散，自2019年7月3日9:30起，王晓松逐一通知公司董事及主要高管要求召开紧急会议。公司董事(董事袁伯银因出差未参加会议)及主要高管从各自岗位陆续到达会议室后，王晓松于2019年7月3日13:00-14:00 统一口头告知与会董事及主要高管关于王振华被采取强制措施事宜。与会董事及主要高管建议尽快取得正式拘留通知书，以确定信息的真实准确性。2019年7月3日15:00 左右，王晓松接到派出所通知，前往派出所。王晓松领取了书面拘留通知书后于16:30左右回到公司。根据派出所于2019年7月3日出具的《拘留通知书》(沪公普刑拘通字[2019]400066 号)，王振华于2019年7月2日16:58因涉嫌犯罪被刑事拘留。公司董事会自此确认董事长被刑事拘留事宜，董事会秘书陈鹏组织开展信息披露工作，并根据董事会要求准备相关信息披露材料。2019年7月3日19:20 左右，公司董事会成员吕小平、王晓松、梁志诚、陈德力、袁伯银、曹建新、Aimin Yan、陈文化共同提议召开第二届董事会第十六次会议，审议通过了《关于选举第二届董事会董事长的议案》，选举公司董事兼总裁王晓松任公司第二届董事会董事长，任期与第二届董事会任期相同。根据《公司章程》规定，王晓松将行使法定代表人职权，签署董事会重要合同、重要文件及其他应由公司法定代表人签署的其他文件。2019年7月3日21:48 左右，公司于上海证券交易所网站上传信息披露文件，并于2019年7月4日刊载于指定信息披露媒体。此外，新城控股还同时披露了截至6月30日的债务情况。公告称，截至2019年6月30日，公司的合并范围内借款金额约900亿元，其中公开市场融资余额约420亿元，包括境外发行美元债约18亿美金、银行间债务融资工具约161亿元、交易所债券约137亿元。公司于2019年下半年到期的公开市场融资金额约63亿元，此外，公司于2019年下半年到期的其他金融机构借款约70亿元。截至2019年6月30日，公司货币资金余额450亿元，其中受限资金约60亿元。货币资金对于下半年到期的有息负债的覆盖倍数约为3倍。截至2019年6月30日，公司对于合联营公司的借款担保金额约260亿元。经公司自查，合联营公司目前经营状况良好，预计后续将通过自身销售回笼偿还其借款。投融资、土地获取情况方面，公司称，目前采取谨慎的投资策略，根据可用资金情况决定投资规模。为避免该事件对公司的融资造成影响，公司正积极与各大银行和非银金融机构、主要合作方以及投资机构等多方面进行及时沟通。","情感倾向是消极的。"
"2019-07-09 09:59:44","新城自救：“切割”王振华 曲德君低调入职","撞上“黑天鹅”的新城控股(601155.SH)正在想方设法进行一场自救。7月8日晚间11点半，新城控股连发7份公告，回应了新城的最新人事动作、公司财务状况、外界关于其信披违规的质疑等问题。根据公告，这次王振华辞去了包括公司第二届董事会董事、提名委员会委员、战略委员会主任委员等在新城控股的一切职务。在新城官网的集团管理层一栏，王振华的名字已消失。虽然在职务上做了切割，在股权层面，王振华依然是新城系三家上市公司的实际控制人。王振华被刑拘前，作为新城控股总裁的王晓松主要负责新城商业开发事业部。老将陈德力负责商业运营，最赚钱的住宅业务仍然由梁志诚亲自负责。7月5日，新城内部下发了一则人事通知，副总裁周科杰协助王晓松分管商业开发事业部。周科杰是1996年就加盟新城的老将。目前辅佐王晓松的大部分均是王振华一手提拔起来的、在新城效力多年的元老级高管，包括陈德力、梁志诚、严政、郭楠楠等人。之外，近日原万达老将曲德君也低调入职新城发展，王振华事件爆发出来后，外界曾担心曲德君入职一事会有变化。根据公告，曲德君的新职位是新城发展执行董事兼副董事长，他还是新城控股第二届董事会董事候选人。在7月8日晚间的公告中，新城在回应上交所监管工作函关于是否“涉嫌信披违规、内幕交易”的问题时，首次披露了王振华涉案调查前后的详细经过。根据公告，7月2日王晓松接到上海市长风新村派出所电话后，于当日 23:00 左右前往派出所，得知王振华被采取强制措施。为避免内幕信息扩散，自7月3日9:30 起，王晓松逐一通知公司董事及主要高管要求召开紧急会议，董事袁伯银因出差未参加会议。王晓松于7月3日13:00-14:00 统一口头告知与会董事及主要高管关于王振华被采取强制措施事宜，与会董事及主要高管建议尽快取得正式拘留通知书，以确定信息的真实准确性。根据公告，7月3日15:00 左右，也是王振华涉案消息爆发在公众视野之际，王晓松接到派出所通知，领取了书面拘留通知书后于 16:30 左右回到公司。在7月3日晚间，新城紧急选举出了新任董事长，即王晓松本人。新城方面在公告中表示，经公司及内幕信息知情人自查，公司及内幕信息知情人均不存在内幕信息提前泄露及违规交易的情况。新城此次还披露了外界颇为关注的公司债务偿还情况。截至2019年6月30日，新城合并范围内借款金额约900亿元，其中公开市场融资余额约420亿元，包括境外发行美元债约18亿美金、银行间债务融资工具约161亿元、交易所债券约137亿元。新城控股2019年下半年到期的公开市场融资金额约63亿元；2019年下半年到期的其他金融机构借款约70亿元，两项合计133亿元。截至2019年6月30日，新城货币资金余额约450亿元，其中受限资金约60亿元，货币资金对于下半年到期的有息负债的覆盖倍数约为3倍。截至2019年6月30日，新城控股对合联营公司的借款担保金额约260亿元。","情感倾向是消极。"
"2019-07-09 09:55:28","万达大将曲德君如约加盟漩涡中的新城 任执行董事兼副董事长","追随王健林17年的原万达高级副总裁曲德君已赴新城系任职，此前外界有猜测，受新城系实际控制人、江苏常州商人王振华被刑事拘留影响，曲德君的新城之旅或不能成行。7月9日，新城发展(01030.HK)公告显示，曲德君获委任为新城发展执行董事兼副董事长；同日，新城控股(601155.SH)公告称，董事会同意补选曲德君为公司第二届董事会董事候选人。55岁的曲德君毕业于东北财经大学获取经济学学士学位，及财务管理学硕士学位，最为外界所知的是17年万达集团经历，拥有15年以上地产开发及企业融资经验，特别是商业地产相关的经验丰富。公开资料显示，曲德君2002年加入万达集团，最近的职位为万达宝贝王集团董事长，负责公司战略规划及运营管理，任期为2018年12月至2019年5月。宝贝王为万达集团旗下集儿童教育、游乐、美食、零售于一体儿童业态产业，拥有乐园、早教、IP三大业务板块。2016年10月至2018年12月，曲德君为万达互联网金融服务(上海)有限公司总裁，负责公司创新发展和经营管理。2015年9月至2016年10月，彼为万达金融集团有限公司总裁，负责万达集团金融及网络科技业务的经营管理。2012年12月至2015年11月，担任大连万达商业地产股份有限公司执行董事，及自2015年11月至2016年9月担任非执行董事。2013年7月至2017年11月，为万达酒店发展有限公司之非执行董事。新城发展为王振华控制的港股上市平台，是A股上市公司新城控股的母公司，同其他新城系公司一样，曲德君入职的两家公司均在面临困难。王振华被刑拘以来，新城系三家上市公司市值损失约520亿港元。为稳定公司，保现金流，新城系正在暂停大额的投资，甚至退出已获取项目的股权。对新城系而言，值得欣慰的时，危急时刻，依然是收获销售的答复增长。今年前6个月，公司实现销售额1224.18亿元，同比增长28.44%；实现销售面积约1049.52万平方米，同比增长35.5%；已完成年初公布的全年销售目标2700亿元的45.3%。期内，公司经营的吾悦广场和办公楼整体出租率98.45%，上半年获取租金收入17.61亿元。根据计划，新城控股2019年全年商业租金及管理费收入目标为40亿元，目前目标完成率达44.02%。新城控股对外公布的数据显示，截至6月底，新城控股已在全国111座城市布局552个项目，其中，商业核心品牌“吾悦广场”已实现96座城市、116个项目的布局规模，实现开业的吾悦广场合计44座。","情感倾向是中性。"
"2019-07-09 09:47:23","新城控股再度触及跌停 成交额43亿元","7月9日早盘，新城控股再度触及跌停，截至发稿成交额43亿元。","以上文本情感极性属于消极。"
"2019-07-09 09:29:36","新城控股打开一字跌停板 成交20亿元","7月9日早盘，新城控股打开一字跌停板，成交73万手，金额20亿元。","以上文本情感极性属于积极。"
"2019-07-09 09:21:29","新城控股还原王振华刑拘后24小时:其子当天获悉案情","7月8日晚，新城控股(601155.SH)一则对上海证券交易所问询的回复公告，还原了公司实际控制人王振华猥亵女童案发后新城控股经历的24小时。公告显示，新城控股于2019年7月4日收到上海证券交易所监管一部下发的《关于新城控股集团股份有限公司实际控制人兼董事长被刑拘事项的监管工作函》(上证公函【2019】0979号)，其中问询了包括案发确切时间，是否存在内幕信息泄露、公司运营以及内部风险等五大问题。当天，已经连续三天股价跌停的新城控股继续切割与王振华关系，继辞去公司董事长之外，王振华辞去了在新城控股所担任的全部职务。王振华7月2日16:58分被刑拘其子当天获得信息7月2日，新城控股现任董事长、总裁王晓松接到上海市长风新村派出所电话后，于当日23:00左右前往派出所，得知公司原董事长王振华被采取强制措施。7月3日9时30分起，为避免内幕信息扩散，王晓松逐一通知公司董事及主要高管要求召开紧急会议。公司董事(董事袁伯银因出差未参加会议)及主要高管从各自岗位陆续到达会议室。7月3日13时-14时，在进入会议室后，王晓松于统一口头告知与会董事及主要高管关于王振华被采取强制措施事宜。与会董事及主要高管建议尽快取得正式拘留通知书，以确定信息的真实准确性。7月3日15时左右，王晓松接到派出所通知，前往派出所。7月3日16时30分，王晓松领取了书面拘留通知书后回到公司。根据派出所于2019年7月3日出具的《拘留通知书》(沪公普刑拘通字[2019]400066号)，王振华于2019年7月2日16:58因涉嫌犯罪被刑事拘留。公司董事会自此确认董事长被刑事拘留事宜，董事会秘书陈鹏组织开展信息披露工作，并根据董事会要求准备相关信息披露材料。7月3日19时20分左右，公司董事会成员吕小平、王晓松、梁志诚、陈德力、袁伯银、曹建新、AiminYan、陈文化共同提议召开第二届董事会第十六次会议，审议通过了《关于选举第二届董事会董事长的议案》，选举公司董事兼总裁王晓松任公司第二届董事会董事长，任期与第二届董事会任期相同。根据《公司章程》规定，王晓松将行使法定代表人职权，签署董事会重要合同、重要文件及其他应由公司法定代表人签署的其他文件。","该文本情感是中性的。"
"2019-07-09 09:10:50","新城控股昨迎第三个跌停 多家公募基金追加下调估值","新城控股昨日迎第三个“一”字跌停。今日，嘉实基金、前海开源基金等多家基金公司公告追加下调新城控股的估值，最多从31.12元下调至25.21元，即按昨日收盘价两个跌停估值，也有公司追加一个跌停估值。今日，嘉实基金、前海开源基金、财通基金、泰达宏利基金、金鹰基金追加下调新城控股的估值，从31.12元下调到25.21元，相当于7月8日收盘价的2个跌停。景顺长城基金则再追加一个跌停，给出28.01元的估值。追加下调估值的基金公司表示，待“新城控股”股票交易体现活跃市场交易特征后，再恢复采用当日收盘价进行估值。多家公募基金管理人自7月5日起陆续公告下调新城控股的估值，截至发稿，累计有39家基金公司发布下调新城控股估值的公告。其中，30家公募基金管理人自7月4日起、部分公司自7月5日起对旗下证券投资基金持有的“新城控股”股票进行估值调整，多数按照31.12元进行估值，相比其7月3日42.69元的收盘价，相当于3个跌停。华安基金、泰信基金、天弘基金、国联安基金、国泰基金则按28.01元进行估值调整，相当于4个跌停。汇丰晋信基金直接给出5个跌停的估值，下调至25.21元。此外，新华基金按30.74元估值，华安基金按30元估值。今年一季度末，共有包括股票、混合、指数、二级债基等各类基金在内的132只基金重仓持有新城控股，合计重仓持有7990.68万股，持股总市值超过36亿元，其中，两只基金持股超过500万股，6只基金持有该股市值占基金净值比超过8%。","情感倾向是消极。"
"2019-07-09 08:23:17","风暴128小时后 新城控股回应信披违规等质疑","黑天鹅事件爆发至今，新城控股(601155.SH)经历了在悬崖边游走的几个日夜。不仅信披问题、内部交易被质疑，其股价也随事态发展持续震荡。7月4日、7月5日和7月8日连续三个交易日收盘价格跌幅偏离值累计超过20%，属于股票交易异常波动情况。7月8日深夜，沉寂多时的新城控股连发七条公告，就公司前董事长王振华涉案后的种种风波进行回应。新城控股称，公司在收到正式法律文书确认王振华涉案事宜后，及时履行了有关信息披露义务。同时，公司及内幕信息知情人均不存在内幕信息提前泄露及违规交易(包括集合竞价及大宗交易)的情况。而舆论漩涡的王振华已向公司递交辞职报告，因个人原因申请辞去公司第二届董事会董事、提名委员会委员、战略委员会主任委员职务。王晓松7月2日知情7月8日，上海市政协决定撤销王振华上海市政协委员资格。同日，新城控股连续第三个交易日跌停，市值缩水超260亿元。一切危机始于7月3日下午，因公司实控人王振华涉嫌猥亵事件，新城控股瞬间点燃舆论火焰。仅隔一天，7月4日，新城控股便收到上海证券交易所下发的监管函。而随着新城公告披露，王振华案件后的相关细节逐渐浮出水面。据悉，7月2日16:58，王振华因涉嫌犯罪被刑事拘留。当日，王晓松接到上海市长风新村派出所电话后，于23:00左右前往派出所，得知王振华被采取强制措施。7月3日，事态高密度进展。为避免内幕信息扩散，当天9:30起，王晓松逐一通知公司董事及主要高管召开紧急会议。13:00~14:00，王晓松在会议上统一口头告知与会董事及主要高管王振华相关事宜。15:00左右，王晓松接到派出所通知，前往派出所领取书面拘留通知书，并于16:30左右回到公司。公司董事会看到拘留通知书后，确认董事长被刑事拘留事宜。董事会秘书陈鹏组织开展信息披露工作，并据董事会要求准备相关信息披露材料。","该文本情感是消极的。"
"2019-07-09 08:22:35","新城控股估值再遭下调 最低25.21元还有两跌停板","7月8日新城控股股价出现第三个跌停之后，7月8日晚间部分基金继续下调新城控股的估值，有公司将新城控股的估值价格调整至28.01元，意味着后续还有一个跌停；有公司给出的估值价格为25.21元，意味后续还会有两个跌停板。估值再遭下调受相关事件影响，上周多家基金公司下调旗下基金持有的新城控股股票估值，不少公司给出的估值价格为31.12元。经历连续三个交易日的跌停之后，昨日新城控股股价已跌至31.12元，成交额4879万元。中国证券报记者发现，7月8日晚间，部分基金继续下调新城控股的估值，有公司将新城控股的估值价格调整至28.01元，意味着后续还有一个跌停；另有公司给出的估值价格为25.21元，意味后续还会有两个跌停，这也相当于在7月3日收盘价基础上的第五个跌停。数据显示，截至今年一季度，共有141只产品持有新城控股，其中持有数量最多的为基金，有133只产品持有，占流通股比例达到了3.81%；券商有2只，QFII有1只。实际上，基金公司多次调整估值并不鲜见。例如此前随着中兴事件的发展，公募基金曾将其估值一调再调；又如，2017年7月基金首次下调乐视网估值后，当年11月不少大量持有乐视网的基金再次“壮士断腕”，将乐视网估值大幅下调；更早的重庆啤酒也出现了类似情况。综合考虑多重因素上海证券创新发展总部总经理、基金评价研究中心负责人刘亦千认为，调整估值正是体现基金公司投研能力的时候。2013年5月，中国证券投资基金业协会发布了《关于停牌股票估值的参考方法》(以下简称“参考方法”)。依据参考方法，基金可以参照行业指数、可比公司、市场价格、估值模型等来估算不具流动性的股票价格。对于基金公司来说，最理想的状态是准确预测股价走势，按照预测来调整估值。但从实操来看，基金很难预测股价的走势。北京一家公募基金的研究总监介绍个股估值调整的流程时表示，一般来讲，如果遇到风险事件，基金公司的研究部门会根据个股的基本面情况，按照盈利情况、可比估值、历史估值等指标，给出一个合理的价格区间。上述公募基金的研究总监进一步解释，实际操作过程中，还会结合基金的具体持仓情况测算。“这是因为，调整估值就是要调整到最终能够变现的价格，公允地对待所有基金份额持有人。如果持有的‘踩雷股’较少，那么尽早‘脱手’的概率比较大，平均成交价格就不会太低，因此估值下调的幅度就小一些；反过来，如果持有的‘踩雷股’较多，短时间内卖不出去，估值就要调得更低。”“一般来讲，估值调整还是要上投委会，由投委会给出最终估值。”上述公募研究总监说，“当然，没有百分之百准确的估值，根据市场情况的变化，估值还会实时调整，这是正常现象。”","情感倾向是消极的。"
"2019-07-09 06:59:50","新城控股估值再遭基金下调 或还有两个跌停","7月8日新城控股股价出现第三个跌停之后，7月8日晚间部分基金继续下调新城控股的估值，有公司将新城控股的估值价格调整至28.01元，意味着后续还有一个跌停；有公司给出的估值价格为25.21元，意味后续还会有两个跌停板。估值再遭下调受相关事件影响，上周多家基金公司下调旗下基金持有的新城控股股票估值，不少公司给出的估值价格为31.12元。经历连续三个交易日的跌停之后，昨日新城控股股价已跌至31.12元，成交额4879万元。中国证券报记者发现，7月8日晚间，部分基金继续下调新城控股的估值，有公司将新城控股的估值价格调整至28.01元，意味着后续还有一个跌停；另有公司给出的估值价格为25.21元，意味后续还会有两个跌停，这也相当于在7月3日收盘价基础上的第五个跌停。数据显示，截至今年一季度，共有141只产品持有新城控股，其中持有数量最多的为基金，有133只产品持有，占流通股比例达到了3.81%；券商有2只，QFII有1只。实际上，基金公司多次调整估值并不鲜见。例如此前随着中兴事件的发展，公募基金曾将其估值一调再调；又如，2017年7月基金首次下调乐视网估值后，当年11月不少大量持有乐视网的基金再次“壮士断腕”，将乐视网估值大幅下调；更早的重庆啤酒也出现了类似情况。综合考虑多重因素上海证券创新发展总部总经理、基金评价研究中心负责人刘亦千认为，调整估值正是体现基金公司投研能力的时候。2013年5月，中国证券投资基金业协会发布了《关于停牌股票估值的参考方法》(以下简称“参考方法”)。依据参考方法，基金可以参照行业指数、可比公司、市场价格、估值模型等来估算不具流动性的股票价格。对于基金公司来说，最理想的状态是准确预测股价走势，按照预测来调整估值。但从实操来看，基金很难预测股价的走势。北京一家公募基金的研究总监介绍个股估值调整的流程时表示，一般来讲，如果遇到风险事件，基金公司的研究部门会根据个股的基本面情况，按照盈利情况、可比估值、历史估值等指标，给出一个合理的价格区间。上述公募基金的研究总监进一步解释，实际操作过程中，还会结合基金的具体持仓情况测算。“这是因为，调整估值就是要调整到最终能够变现的价格，公允地对待所有基金份额持有人。如果持有的‘踩雷股’较少，那么尽早‘脱手’的概率比较大，平均成交价格就不会太低，因此估值下调的幅度就小一些；反过来，如果持有的‘踩雷股’较多，短时间内卖不出去，估值就要调得更低。”“一般来讲，估值调整还是要上投委会，由投委会给出最终估值。”上述公募研究总监说，“当然，没有百分之百准确的估值，根据市场情况的变化，估值还会实时调整，这是正常现象。”调整时避免高估在估值调整与实际估值偏高和偏低这两类“错误”之间，刘亦千认为，基金公司倾向于给出偏低估值。“如果调得较高而股票实际交易价格更低，投资者赎回基金时，该基金相当于替投资者承担了一部分损失。如果调得低于股票后来的实际价格，投资者赎回时可能会吃一点亏。”刘亦千表示，“投资者看到这一点，往往就不想赎回了，这样一来，基金赎回压力缓解了。”一位基金研究人士也表示，“基金下调估值，就是因为没有流动性，股票卖不出去。其实估得保守一点，是比较有利的。例如，如果只估1个跌停板，但实际可能有4-5个跌停板，那基金净值就是高估的，理性的决策应该是赎回基金。”除了上述指引的限制，估值调到多低，或许还受到其它因素影响。还有业内人士介绍，比如机构占比较高的基金，机构投资者拥有较高话语权。如果机构投资者要赎回，可能会施加压力，基金公司没法将估值调得太低。","情感倾向是消极的。"
