"Date","Title","Content","qwen_lora2_情绪提取"
"2019-08-15 22:01:04","中国平安半年净利润首破千亿 同比大增超6成！","8月15日，中国平安保险(集团)股份有限公司(简称“中国平安”，601318.SH、2318.HK)公布截至2019年6月30日止中期业绩，2019年上半年，中国平安实现归属于母公司股东的营运利润734.64亿元，同比增长23.8%；得益于上半年手续费佣金税务新政带来的104.53亿元一次性影响，净利润同比增长63.3%，达1057.38亿元；归属于母公司股东的净利润976.76亿元，同比增长68.1%。平安拟向股东派发中期每股股息现金0.75元，同比增长21.0%，派息总额136.80亿元；同时，平安顺利实施A股回购计划，截至6月30日，公司通过集中竞价交易方式已累计回购 34.21亿元A 股股份(截至7月31日累计回购约50亿元A股股份)，上半年现金分红加回购合计171.01亿元。在“金融+科技”、“金融+生态”战略规划指引下，平安持续加大科技投入，深化科技能力，将创新技术深度赋能于“金融服务、医疗健康、汽车服务、房产服务、智慧城市”等五大生态圈。集团不断对外输出领先的创新产品和服务，持续扩大科技业务版图，2019年上半年，公司科技业务的总收入同比增长33.6%至384.31亿元。个人业务营运利润同比增长32.1%截至2019年6月30日，集团个人客户总数达1.96亿，较年初增长6.6%，上半年新增客户2,009万，其中33.8%来自于集团五大生态圈的互联网用户；客均营运利润同比增长20.9%至340元；客均合同数同比增长7.9%至2.58个。个人客户交叉渗透程度进一步提高，客户价值稳健增长。2019年上半年，集团个人业务营运利润同比增长32.1%至665.76亿元，占集团归属于母公司股东营运利润的90.6%，占比同比提升5.7个百分点；集团有6,937万个人客户同时持有多家子公司的合同，较年初增长9.0%，在整体客户中占比35.4%，占比较年初提升0.8个百分点。中国平安董事长/首席执行官马明哲表示：“未来，平安将始终坚持以个人客户为中心，不断深化科技创新能力，赋能产品创新优化和服务质量提升，完善客户体验，实现平安个人客户价值与公司价值的共同成长。”寿险及健康险新业务价值率增至44.7%金融业务中，寿险及健康险业务稳健增长。得益于高价值高保障产品的销售策略，新业务价值率同比提升5.7个百分点至44.7%；新业务价值同比增长4.7%至410.52亿元；营运利润同比增长36.1%至484.33亿元；剩余边际余额较年初增长10.3%至8,673.90亿元。集团核心科技赋能寿险业务。辅助代理人筛选的AI面谈官面试覆盖率达100%，高仿真对话机器人“AskBob”对代理人咨询的疑问解答准确率高达95%，任务查询和智能办理功能覆盖代理人90%常用需求。2019年上半年，平安产险实现原保险保费收入1,304.66亿元，同比增长9.7%；综合成本率96.6%，持续优于行业；平安产险的非年化营运ROE达12.4%，营运利润同比增长69.5%至100.39亿元。","该文本情感是积极的。"
"2019-08-15 22:00:08","平安中报科技业务三大看点：收入大增、估值700亿美元、研发人员超3万","8月15日，中国平安发布2019年中期业绩，整体业绩及核心业务保持稳健增长态势，实现归属于母公司股东的营运利润734.64亿元，同比增长23.8%；归属于母公司股东的净利润976.76亿元，同比增长68.1%。值得注意的是，上半年平安科技业务实现总收入384.31亿元，同比增长33.6%，增速超过平安上半年整体营业收入19.2%的增速，标志着平安科技业务正式进入快速发展轨道。截至2019年6月30日，平安旗下科技公司的估值总额达到700亿美元。日前，平安登上《麻省理工科技评论》首份以“中国支点” 为概念进行评选的50家聪明公司榜单，它与其他上榜企业一样，以新兴科技作为自身的核心竞争力，并且成功地进行垂直深化、跨域融合的创新。科技正在成为平安新的核心竞争力，通过不断增加科技投入，平安进一步扩大科技业务板块，将创新科技深度赋能于五大生态圈，让我们一起来看看平安上半年三大科技亮点。亮点一：研发人员超过3万名，专利数位列国际金融机构前列上半年，平安的科技专利申请数较年初增加5779项，累计达18050项，位居国际金融机构前列，其中PCT及境外专利申请数累计达3959项。科技实力的快速发展，主要得益于平安在核心科技领域如人工智能、云、区块链等方面的不断投入、对自主知识产权的高度掌控、以及专业能力强大的人才队伍。平安联席CEO陈心颖曾表示：“平安承诺将1%的集团收入用于研发。2018年，平安聚焦创新技术的研发费用总额为15亿美元，这不包括被归类为联营公司的独角兽的研发支出，所以实际上平安在科技研发方面的支出更多更大。未来十年，平安将投入150亿美元用于科技研发。”目前，平安拥有10.1万名科技从业人员、3.2万名研发人员和2200名科学家。同时，平安还设立了8大研究院，与北京大学、清华大学、复旦大学等顶尖高校和研究机构开展深入合作并产出科研成果。仅2019上半年，平安就荣获超20个权威科技奖项，一举拿下三个医疗影像国际竞赛总冠军，包括肺癌病理分割(ACDC)、内窥镜影像质控(EAD)和病理性近视检测(PALM)。平安还发表了全球首篇AI疾病预测的顶级医学论文，打造的全球第一款智能OCT眼底疾病筛查系统完成了多中心临床试验；获得国际ACL医疗智能问(MEDIQA 2019)医疗问句匹配任务世界冠军、IEEE国际医疗数据修复大赛(DACMI)冠军。人工智能单证识别技术在国际票据扫描件文字识别和信息提取(SROIE)大赛中斩获第一。","该文本情感是积极的。"
"2019-08-15 20:41:47","中国平安上半年净利超千亿元 现金分红加回购合计171亿元","值得注意的是，在“金融+科技”、“金融+生态”战略规划指引下，上半年平安持续加大科技投入，深化科技能力，将创新技术深度赋能于“金融服务、医疗健康、汽车服务、房产服务、智慧城市”等五大生态圈。同时不断对外输出领先的创新产品和服务，持续扩大科技业务版图，2019年上半年，公司科技业务的总收入同比增长33.6%至384.31亿元。得益于营运利润稳健增长及集团充足的偿付能力，平安持续提升分红水平，公司拟向股东派发中期每股股息现金0.75元，同比增长21.0%，派息总额136.80亿元；同时，平安顺利实施A股回购计划，截至6月30日，公司通过集中竞价交易方式已累计回购34.21亿元A股股份(截至7月31日累计回购约50亿元A股股份)，上半年现金分红加回购合计171.01亿元。面向未来，中国平安董事长、首席执行官马明哲表示：“今年是新中国成立70周年，也是平安新30年的开局之年。面对当前复杂多变的全球经济形势，我们坚信中国经济态势长期向好，将坚持既定的‘金融+科技’‘金融+生态’战略，夯实金融主业，兢兢业业履行保险人的责任；积极回馈社会，扎实做好‘三村工程’，助力美好乡村建设；全方位提升数据化智慧经营水平，布局科技创新版图，开拓智慧城市等创新生态服务；洞察客户需求，优化消费体验，提升综合金融一站式服务水平。我们将持续推动各项业务稳健增长，为广大客户和股东创造价值，向着成为国际领先的科技型个人金融生活服务集团的整体目标稳步迈进。”","情感倾向是积极。"
"2019-08-15 18:48:20","中国平安半年报再派红包 持续分红底气何来？","作为每个财报季都第一个亮相的保险股，中国平安今晚交出的“中考成绩单”没有让投资者失望。持续强劲的盈利能力和稳定增长的分红水平——中国平安的2019年半年报，再次为行业开了个好头。中国平安频抛“大红包”“定心丸”。今年上半年，公司“现金分红+回购”合计金额已达171.01亿元。主流投行更是预计，中国平安未来的分红增速不仅将超市场预期，而且确定性极高。金融主业营运利润的稳健增长，以及未来科技业务营运利润贡献的逐步提升，是中国平安持续拿出“真金白银”回报投资者的底气所在。今年上半年，中国平安归属于母公司股东的营运利润734.64亿元，同比增长23.8%。相较于投资者所熟悉的“会计利润”，中国平安分红基数的确定方法则来自“营运利润”，其也是目前A股唯一一家以营运利润为分红基数的公司。剔除短期投资波动等影响后的营运利润，其实比会计利润更能清晰客观地反映保险公司当期业绩表现及趋势。由于营运利润能直接反映保险公司内含价值的增长，这使得中小股东通过分红直接分享到公司内含价值的增长。而有了这个新指标，可以更好地管理投资者的预期，可以让投资者区分保险公司的经营质量，让市场给予经营更好的保险公司更合理甚至更高的估值。“这能让投行和投资者进一步认知并认可‘平安价值’。”一位大型投行人士称。多元化利润来源为业绩提供较强安全边际行业大环境的改善，自身综合金融的显著成效及金融科技与医疗科技的发力，推动中国平安业绩再上新台阶。今年上半年，中国平安整体业绩及核心业务实现持续、稳健增长态势：归属于母公司股东的营运利润734.64亿元，同比增长23.8%；得益于上半年手续费佣金税务新政带来的104.53亿元一次性影响，净利润增长更为显著，净利润达1057.38亿元，同比增长63.3%；归属于母公司股东的净利润976.76亿元，同比增长68.1%。也就是说，中国平安日赚超过5亿元。核心金融业务表现可圈可点。在寿险及健康险业务上，在行业结构调整的环境下，中国平安向高价值业务转型，持续优化业务结构，寿险及健康险业务的新业务价值率达44.7%，同比提升5.7个百分点，营运利润同比增长36.1%至484.33亿元，剩余边际余额较年初增长10.3%至8673.90亿元；此外，产险营运利润同比增长69.5%，上半年原保费收入同比增长9.7%，96.6%的综合成本率持续优于行业；银行零售业务净利润占比超七成。","该文本情感是积极的。"
"2019-08-15 17:17:46","中国平安上半年归母净利润976.76亿 同比增68.1%","8月15日，中国平安保险(集团)股份有限公司(中国平安，601318.SH；2318.HK)发布的2019年半年报显示，2019年上半年，中国平安实现归属于母公司股东的营运利润734.64亿元，同比增长23.8%，非年化营运ROE为12.3%；归属于母公司股东的净利润976.76亿元，同比增长68.1%。分红方面，中国平安表示，得益于营运利润的快速增长，平安持续提升现金分红水平，向股东派发中期股息每股现金0.75元，同比增长21.0%。国泰君安证券8月13日发布的研报指出，由于以营运利润为分红基础，预计中国平安未来的分红增速将超市场预期且确定性极高，给与目标价113.22 元/股，维持“增持”评级。","该文本情感是积极的。"
"2019-08-15 16:57:24","中国平安：1-7月累计原保险合同保费收入合计4994.48亿元 环比增加11.92%","8月15日，中国平安保险(集团)股份有限公司(以下简称“中国平安”)发布保费收入公告。根据公告，中国平安发布了四家控股子公司于2019年1月1日至2019年7月31日期间的原保险合同保费收入数据。四家控股子公司原保险合同保费收入共计4994.48亿元，环比增加11.92%。其中，中国平安财产保险股份有限公司(以下简称“平安财险”)原保险合同保费收入为1510.07亿元；中国平安人寿保险股份有限公司(以下简称“平安人寿”)原保险合同保费收入为3293.41亿元；平安养老保险股份有限公司(以下简称“养老保险”)原保险合同保费收入为154.66亿元；平安健康保险股份有限公司(以下简称“平安健康保险”)原保险合同保费收入为36.34亿元。《每日经济新闻》记者注意到，中国平安通过平安人寿、平安养老及平安健康保险经营寿险及健康险业务，其寿险及健康险业务原保险合同保费收入共计3484.41亿元。按投保人为个人或团体，中国平安将寿险及健康险业务类型分类为个人业务和团体业务。而个人业务原保险合同保费收入是主要来源。寿险及健康险业务中，个人业务原保险合同保费收入共计3348.83亿元。其中，新业务原保险合同保费收入共944.25亿元，续期业务原保险合同保费收入共2404.58亿元。同时，中国平安的寿险及健康险业务中，团体业务原保险合同保费收入共计135.58亿元。其中，新业务原保险合同保费收入共135.10亿元，续期业务原保险合同保费收入共0.48亿元。此外，平安财险也披露了原保险合同保费收入，共计1510.07亿元。其中车险原保险合同保费收入为1066.54亿元；非机动车辆保险原保险合同保费收入为371.78亿元；意外与健康保险为71.75亿元。","该文本情感是积极的。"
"2019-08-14 18:44:20","中国平安：前7月保费收入4994亿元","中国平安(601318)8月14日晚间公告，公司控股子公司平安财险、平安人寿、平安养老及平安健康原保险合同保费收入合计4994.48亿元。","以上文本情感是中性的。"
"2019-08-13 11:47:36","中国平安回应汇丰高管离职传闻：入股汇丰纯属财务投资","日前，汇丰控股两名高管相继离职，引发坊间热议。而汇丰控股第一大股东中国平安一度被牵连进该事件，被社交媒体传言称其起到了重要推动作用。8月13日，中国平安回应中国证券报记者称，公司对汇丰控股的入股，纯属公司保险资金的财务性投资，不参与任何日常经营和管理。8月5日，汇丰控股发布公告称，范宁(John Flint)辞去集团行政总裁和董事职位。范宁现年51岁，2018年2月就任汇丰集团行政总裁。8月9日，汇丰控股集团总经理及大中华区行政总裁黄碧娟亦决定离任，向外寻求其他发展机会。短短一周内汇丰控股连续出现二次高层人事变动，引发坊间热议。除了正常辞职及业绩不佳引咎辞职等猜测外，也有社交媒体传言称汇丰在华为被调查一事中扮演了相关角色，范宁、黄碧娟两高管先后离职不排除受该事件影响。对于上述传闻，汇丰控股与8月12日下午公开回应称：“我们注意到近日有社交媒体传闻称，近期汇丰两名高管的人事变动相互关联，并且是基于股东就外部事件施压所导致的结果。我们特此声明，这些都是毫无根据的谣言。汇丰始终致力于服务客户，并为内地与香港的经济繁荣作出贡献。”除了上述猜测外，作为汇丰控股的第一大股东，中国平安也被牵连进上述传闻之中。根据港交所披露易信息显示，2018年11月，中国平安超越贝莱德成汇丰控股第一大股东，持有约14.18亿股，占后者股权7.01%。对此，社交媒体上有消息称，在汇丰控股两名高管离职事件中，中国平安或起到了重要推动作用。对此，中国平安8月13日回应中国证券报记者称：“平安对汇丰的入股，纯属公司保险资金的财务性投资，不参与日常经营管理。”中国平安的上述表态可以在现在汇丰控股的管理架构上得到验证，根据汇丰控股8月5日公布的董事会成员名单，汇丰控股现有14名董事会成员，并无成员来自中国平安。事实上，中国平安早在去年成为汇丰控股第一大股东时就曾明确表示，对汇丰控股的投资属于保险资金的财务性投资，中国平安看好汇丰控股的发展前景，且汇丰控股分红率较高，符合保险资金的风险偏好和投资收益要求。汇丰控股当时也公告回应称，欢迎中国平安继续成为汇丰控股的长期投资者。","情感倾向是中性。"
"2019-08-13 10:40:47","中国平安：入股汇丰纯属财务性投资 不参与日常经营和管理","一周之内，汇丰两名高管离职一事近期引发较多传言，也一度登上热搜榜。对此，汇丰在8月12日发声明辟谣。8月13日，汇丰控股(0005.HK)第一大股东中国平安(601318.SH，2318.HK)方面向澎湃新闻表示，平安对汇丰控股的入股，纯属公司保险资金的财务性投资，不参与任何日常经营和管理。此番离职的两名汇丰高管分别为汇丰控股CEO范宁(John Flint)和汇丰集团总经理及大中华区行政总裁黄碧娟。前者在8月5日宣布辞职；后者于8月9日离任。值得一提的是，汇丰相关发言人曾表示：“黄碧娟的离职，与汇丰集团行政总裁范宁的离职及华为事件完全无任何联系。”汇丰在8月12日的声明中指出，有关“近期汇丰两名高管的人事变动相互关联，并且是基于股东就外部事件施压所导致的结果”的传闻都是“毫无根据的谣言”。2017年12月，中国平安旗下的平安资产管理有限公司(下称平安资管)通过港股通渠道累计买入汇丰控股约合10.18亿股，持股比例达到5.01%，超越JPMorgan Chase & Co。成为汇丰控股第二大股东，成为汇丰控股的重要投资者之一。而在17年前，汇丰控股曾是中国平安的股东之一。2018年11月，香港交易所网站披露易显示，平安资管已超越贝莱德集团(BlackRock，Inc。)成为汇丰控股(0005.HK)最大股东，持有约14.19亿股股份，持股比例7.01%。中国平安方面当时便向澎湃新闻回应称，该投资属于保险资金的财务性投资，中国平安看好汇丰的发展前景，且汇丰分红率较高，符合保险资金的风险偏好和投资收益要求。在当月举行的2018中国平安科技开放日上，中国平安联席首席执行官陈心颖也再次强调，平安投资汇丰控股是一个财务性投资，不准备进入汇丰管理层。8月13日开盘，汇丰控股股价延续了前几日的下行态势。截至发稿，报57.900港元/股，跌1.95%。","情感倾向是消极。"
"2019-08-09 13:51:50","小桔车服与平安集团战略合作 加速“洪流联盟”落地","记者8月9日获悉，滴滴旗下小桔车服与平安集团旗下平安银行、平安国际融资租赁、平安财产保险、平安基础产业投资基金签署战略合作协议，平安与小桔车服将在租车、保险、维保、充电等领域展开合作。通过此次合作，平安银行将为小桔车服及其生态链提供综合金融服务，包括车队融资、账户及现金管理服务、用户客群零售金融服务，并探索在租车、加油、充电、养车等场景的合作。平安租赁将通过小桔租车平台提供租车服务，小桔车服将依托其平台流量、维保、能源、网络规划与调度能力，与平安租赁在车辆采购、投放以及运营方面进行合作。小桔车服将与平安产险共建涵盖事前、事中、事后的车险管理线上化模式。根据协议，小桔车服还将与平安基础产业投资基金管理有限公司在汽车新能源领域进一步展开合作，共同开发、建设和运营充电站业务。2018年4月，滴滴与31家汽车产业合作伙伴共同成立“洪流联盟”，共同建设开放、高效、共赢的汽车运营商平台，推进新能源化、智能化、共享化的产业发展。滴滴方面表示，小桔车服此次与平安旗下四家公司展开全面合作，正是“洪流联盟”落地的又一重要举措，将与平安一起助力汽车产业链合作伙伴降本增效，携手共赢。","该文本情感是积极的。"
"2019-08-08 11:07:33","中国平安保险（集团）股份有限公司关于披露平安银行2019年半年度报告摘要的公告","证券代码：601318 证券简称：中国平安公告编号：临 2019-034中国平安保险(集团)股份有限公司关于披露平安银行2019年半年度报告摘要的公告中国平安保险(集团)股份有限公司(以下简称“本公司”)董事会及全体董事保证本公告内容不存在任何虚假记载、误导性陈述或者重大遗漏，并对其内容的真实性、准确性和完整性承担个别及连带责任。本公司控股子公司平安银行股份有限公司(以下简称“平安银行”)在深圳证券交易所网站(www.szse.cn)公布了《平安银行2019年半年度报告》。平安银行2019年上半年度经营情况亦可参阅本公司在上海证券交易所网站(www.sse.com.cn)披露的《平安银行2019年半年度报告摘要》。特此公告。中国平安保险(集团)股份有限公司董事会2019年8月7日","该文本情感是中性的。"
"2019-08-07 17:41:07","北向资金净流出30.5亿元 中国平安遭净卖出8亿元","8月7日，北向资金净流出30.5亿元，其中沪股通净流出24.6亿元。个股方面，中国平安、兴业银行、招商银行净卖出额居前，分别遭净卖出8.02亿元、1.93亿元、1.58亿元；温氏股份、伊利股份均获净买入逾1.9亿元。","情感倾向是消极的。"
"2019-08-05 17:36:03","北向资金净卖出中国平安逾5亿元","8月5日，北向资金合计净流出34.64亿元。个股方面， 中国平安、美的集团、伊利股份净卖出额居前，分别为5.16亿元、3.27亿元和3.08亿元；五粮液、牧原股份、洋河股份净买入额居前，分别为2.85亿元、4619万元、4377万元。","该文本情感是中性的。"
"2019-08-03 18:46:59","史上最强回购年份！金额已超1000亿 逾600家公司已兑现回购计划","中国平安近日公告显示，截至2019年7月31日，公司已累计回购A股股份57,594,607股，支付资金总额合计超过50亿元。而在此前的回购方案中，公司承诺的回购金额为不低于50亿元，且不超过100亿元。中国平安此番回购，只是年内众多A股上市公司正在大力兑现回购计划的一个缩影。01、A股年内回购实施金额超1000亿元创历史新高据数据，按照公告日计(下同)，2019年以来，A股上市公司回购实施总金额已超过1000亿元，创下历史新高，远超此前年份。2018年，A股上市公司回购实施金额为510亿元，2017年则仅为79亿元。数据显示，截至2019年8月1日收盘，年内回购实施金额超过1亿元的公司有230家，这其中，超过10亿元的公司有11家。按公告日计，美的集团年内回购实施金额最高，达72.5亿元。今年1月9日，美的集团完成年内第一次回购，彼时公司共回购了95,105,015股，占截至去年底总股本的1.4274%，支付总金额约40亿元。在上述回购计划完成的次月，美的集团很快启动新一轮回购，计划再回购不超过12,000万股，且不低于6,000万股，回购价格不超过人民币55元/股，预计回购金额不超过66亿元。此后，美的集团开始执行回购方案。截至今年7月底，公司累计回购了60,252,129股，占截至7月底总股本的0.8664%，支付总金额约为31亿元。除了之外，美的集团年内还因股权激励，进行了几次定向回购。伊利股份回购实施金额也较高。数据显示，截至2019年7月24日，伊利股份已累计回购公司股份数量182,920,025股，占总股本的比例为3.00%，已支付的总资金为57.93亿元。伊利股份在制定回购方案时，计划回购股份数量为不低于151,953,191股(占回购公告发布日公司总股本2.50%)且不超过303,906,380股(占回购公告发布日公司总股本5.00%)(均包含本数)，这意味伊利股份实施的回购规模已超过计划方案的下限。除美的集团和伊利股份外，中国平安、招商蛇口、陕西煤业、中联重科、TCL集团、分众传媒、世纪华通、恒力石化年内回购实施金额也居于前列。","积极。"
"2019-08-02 18:07:30","北向资金创两个半月最大净流出额 抛售中国平安8亿元","北向资金今日净流出64.42亿元，创两个半月最大净流出额。中国平安、贵州茅台、中兴通讯净卖出居前，分别遭净卖出8.02亿元、6.69亿元、4.34亿元；洋河股份逆市获净买入1.46亿元。","情感倾向是消极的。"
