"Date","Title","Content","qwen_lora2_情绪提取"
"2019-12-29 22:03:11","2000亿央企子公司“混改”落地：平安集团100亿入股招商局港通发展","12月27日，招商局集团与平安集团举行投资签约仪式。平安集团旗下平安资产管理有限责任公司(简称“平安资产”)向招商局集团全资子公司招商局港通发展(深圳)有限公司(简称“港通发展”)增资100亿元人民币。增资完成后，平安资产持港通发展25.9%股权。招商局集团总经理胡建华表示，招商局集团近年来一直积极探索、推动下属公司混合所有制改革。过去一年多的时间，港通发展先后接触10余家意向投资企业，最终选定与中国第一大保险公司平安集团进行合作。平安集团的资金实力与科技力量结合招商局集团港口业务全球领先战略布局和运营管理能力，对双方合作的效果及企业未来的发展充满信心。21世纪经济报道此前报道，今年10月，招商局在上海联合产权交易所披露增资信息，全资子公司招商局港通发展(深圳)有限公司(简称“港通发展”)拟增资，拟募资80-100亿元，引入不超过2家战略投资方，增资完成后，战略投资者合计持股比例不超过50%。港通发展实际上是招商局的子公司，是上市公司招商港口(001872.SZ)的第二大股东，控股辽宁两家上市港口营口港(600317.SH)、大连港(601880.SH)。成立于2018年1月，注册资本100亿元，法定代表人为招商局集团资本运营部部长邓伟栋。港通发展旗下的资产包括：招商局集团港口资产一级资本运作平台——招商港口20.68%股份；9月30日，辽宁两家上市港口国资——营口港、大连港均将其51%股权划拨给港通发展的一家全资子公司。截至6月末，港通发展的资产规模超过2000亿元。具体是：截至2019年6月末，港通发展资产总额达2094.50亿元，负债总额1000.21亿元。营业收入82.12亿元，净利润7.92亿元。而在2018年，港通发展亏损3.19亿元，资产总额为2235.36亿元。招商局集团与平安集团渊源颇深。1987年，招商局集团原常务副董事长，原蛇口工业区管委会主任袁庚主持创立了招商银行、平安保险等企业。直到2002年，平安保险原第二大股东招商局集团将所持有股份全部转让。","以上文本情感极性属于积极。"
"2019-12-29 16:08:02","中国平安与人社部签署《社会保障卡创新应用服务合作协议》","12月27日，人力资源和社会保障部与中国平安保险(集团)股份有限公司(简称“中国平安”)等11家金融机构及互联网公司在北京签署《社会保障卡创新应用服务战略合作协议》，共同推动电子社保卡线上身份认证、线上个人信息查询、线上业务申办、移动支付等应用。近年来，中国平安积极参与电子社保卡服务工作。2018年，中国平安等相关社会资本方，与人力资源和社会保障部通过PPP方式成立金保信社保卡科技有限公司，共同开发建设全国社会保障卡线上身份认证与支付结算服务平台，推动电子社保卡快速签发和丰富应用服务。目前，电子社保卡签发量快速稳定增长，线上服务场景、产品、功能不断完善。中国平安党委书记、副总经理陈克祥表示，此次签约合作的企业将积极履行企业社会责任，坚持将民生服务发展放在首位，以共融共赢为目标，充分发挥大数据、云计算等核心科技能力和综合金融优势，与人社部开展全方位合作，解决社会保障领域服务痛点，推动创新应用和综合服务水平不断提升。中国平安介绍，在全国社保卡服务平台开发建设过程中，中国平安凭借核心科技能力、丰富的业态场景和先进的管理经验，积极赋能人力资源和社会保障业务。目前，中国平安的人脸识别技术已经应用到电子社保卡相关服务中，为全国电子社保卡持卡人提供精准高效的认证服务。同时，借助平安好医生、城市一账通App、i深圳等App流量优势，积极促进电子社保卡签发，有效提升了全国社保卡平台的服务能力。","情感倾向是积极的。"
"2019-12-28 09:33:47","泰康保险集团换帅 医养老将刘挺军接棒另有深意","人事有代谢，往来成古今。12月23日，中国泰康保险集团(以下简称“泰康保险”)称，公司董事会任命刘挺军为集团总裁兼首席运营官，刘经纶因年龄原因不再担任该职务，拟转任公司监事长。多位业内人士认为，泰康保险此次人事调整大有深意，旨在重点发力大健康，推动公司由保险驱动到大健康驱动转型。在过去20年，刘经纶和泰康保险创始人、董事长陈东升风雨同舟搭档，如果说陈东升是泰康蓝图的描绘者，那么刘经纶则为其蓝图最重要的执行者。不过，习惯从高空看事物的陈东升，早在10年前，已经将视野转向大健康，泰康保险大健康体系背后的轴心，是集团的养老社区战略。陈东升在今年透露，泰康保险有一个很强的战略诉求，即成为一个大健康集团。作为陈东升在医养领域的主要助手，刘挺军或将承担让陈东升大健康梦想进一步照进现实的重要使命。多个核心高管年届退休对于此次高管变动，泰康保险评价称，刘挺军1998年正式加入泰康保险，先后从事战略研究、证券投资与不动产投资工作，长期负责健康产业的投资和运营业务。作为陈东升在医养领域的主要助手，刘挺军身处创新第一线，是泰康保险与医养相结合商业模式探索及医养布局的重要战略推进者……进一步推动泰康保险大健康战略落地。泰康保险对刘经纶评价称，1998年刘经纶加盟泰康保险，和陈东升风雨搭档21年，成就了中国保险业的一段佳话。据了解，刘经纶出身江西，曾担任过中国人民保险公司江西省分公司人身险处处长、上饶地区公司总经理、江西省分公司人身险部总经理。当年，中国人民保险公司还属于央行体系。所以，在那个年代，人保省保险公司人身险部总经理属于“干部”。不过，刘经纶似乎也不是一个甘于现状的人，后来他从中国人民保险公司离开，加盟当时初创不久的平安保险，先后出任平安总公司人身险总经理助理，北京分公司总经理，先后兼任华北地区、东北地区、西北地区、华南地区寿险总督导，平安人寿总公司寿险协理。1998年，刘经纶加盟刚刚成立两年的泰康人寿，出任泰康人寿常务副总裁、总裁兼首席运营官等职务。2015年11月，泰康在线财险正式成立，刘经纶又兼任泰康在线财险的董事长；2016年8月，泰康人寿集团化，刘经纶出任集团公司总裁。在泰康保险工作21年后，刘经纶到年龄退休，转任集团监事长。值得注意的是，此次人事调整或仅是一个开始。","情感倾向是积极。"
"2019-12-27 17:55:45","平安集团铁腕反腐：发布十条禁令！","互联网公司反腐是生死考验，金融机构反腐也是“滴水不漏”。继平安集团董事长马明哲在中国平安(601318)“正风肃纪专项行动”动员大会上发言之后，平安正风肃纪专项行动又有新动作。近日，中国平安在公司内部推出了《员工十大禁令》，意在进一步规范员工日常行为，弘扬正气，全面提升员工队伍整体素质，确保公司长期健康、稳定发展。意味着中国平安从制度层面形成保障，推进正风肃纪专项行动走向深入。马明哲在“正风肃纪专项行动”动员大会上发表讲话指出，正风肃纪专项行动，是落实党中央决策部署和中央纪委正风肃纪要求的重要举措，也是面对当前宏观形势和公司经营需要作出的重要决定和安排，旨在全面加强纪律作风建设，全面扩大参与范围，不仅包括党员领导干部，也包括非党员及外籍高管，做到全员参与，滴水不漏。平安《员工十大禁令》要求全体员工坚决杜绝十种行为，包括一禁侵占、贪污、挪用、盗窃公司或客户的资金、财产；二禁行贿、受贿、索贿，利用工作之便谋取或输送不正当利益；三禁泄露公司机密、贩卖公司及客户信息，损坏公司名誉；四禁参与高利贷、非法集资、洗钱、暴力催债等违法金融活动；五禁设立小金库和账外账，盗用、伪造印章及合同等欺诈行为；六禁利用工程建设、物资采购、资产处置等非法牟利，损公肥私；七禁未经授权允许第三方使用职场、违规销售外部产品；八禁消极怠工、推诿扯皮，有令不行、有禁不止，对抗执行；九禁报喜不报忧，瞒报、迟报、漏报、谎报重大事项和风险；十禁拉帮结派、铺张浪费、形式主义、自由主义等不良作风。","该文本情感是积极的。"
"2019-12-25 07:53:53","2019年中国平安助力消费扶贫超1.3亿元","本报记者冷翠华在12月23日举行的中国平安“三村百宝”中西部扶贫产品洽购会上，中国平安与对口扶贫的15家农产品企业签署了采购意向协议，总签约金额近3600万元。数据显示，2019年，中国平安聚力打造多点开花的扶贫产品产销闭环，通过产销一体化平台，多渠道助力消费扶贫的金额已逾1.3亿元。“平安三村百宝”旨在促进产业扶贫、消费扶贫融合发展，是中国平安利用自身金融和客户渠道优势，针对全国贫困地区特色农产品产业和企业，打造的线上线下公益扶贫产品产销一体化平台。“平安三村百宝”以“三村晖”APP为主阵地，接入平安系金管家、好医生、壹钱包等十余种销售平台，帮助企业推动扶贫农产品销售，帮助当地的百姓脱贫致富，并让城市消费者享用健康、实惠的绿色农产品，最终实现精准扶贫。近年来，中国平安形成“”扶智培训、产业造血、一村一品、产销平台“的特色扶贫闭环。中国平安建立”金融+科技+产销“合作模式，挑选市场潜力大、区域特色明显、附加值高的主导产品或产业，集中创造品牌化、特色化产业链，打造了”平安三村百宝“。在平安产业扶贫的带动下，通过”平安三村百宝发展消费扶贫，截至2019年11月内蒙古阴山优麦实现增收逾3000万元，成功带动1087户建档立卡贫困户年人均增收约4860元。此外，中国平安还在陕西地区持续打造“三村工程”产业扶贫闭环，注入扶贫资金1800万元推动产业发展。自2018年启动“三村工程”以来，中国平安从“村官、村医、村教”三个方向，以“智慧扶贫”为核心，持续推进产业扶贫、健康扶贫、教育扶贫。截至目前，“三村工程”已在全国21个省或自治区落地，累计提供扶贫资金157.45亿元，直接带动建档立卡贫困户53813人，惠及贫困人口超50万；升级乡村卫生所949所，培训村医11175人，开展移动健康检测车巡诊554场，体检义诊覆盖贫困地区人口近9万人次；挂牌智慧小学1054所，培训村小教师11826名。(编辑乔川川)","该文本情感是积极的。"
"2019-12-24 23:19:35","谢永林正式接替任汇川出任中国平安总经理","12月24日，中国平安发布公告称，经公司第十一届董事会第九次会议审议通过，并报中国银行保险监督管理委员会核准任职资格，自 2019 年 12 月 24 日起，谢永林正式接替任汇川出任公司总经理。10月24日，中国平安发布公告称，监事会选举孙建一担任监事会主席，董事会推荐谢永林、陈心颖接替孙建一、蔡方方出任公司执行董事，选举任汇川出任副董事长，聘任谢永林出任公司总经理，聘任蔡方方和黄宝新出任公司副总经理。上述部分董、监事及高管调整仍需要相关公司治理程序审议或监管机构的任职资格核准。谢永林自1994年加入公司，毕业于南京大学，获管理学博士学位，中共党员，现任集团联席CEO、副总经理、党委副书记、平安银行董事长。中国平安评价称，谢永林曾先后在保险、银行、投资等业务线担任重要职务，拥有跨系列专业水平、经营能力和经验；思路清晰、学习能力强，综合能力突出；领导力、推动力、执行力强，锐意进取，富有魄力。他在过往各个岗位上业绩优异，包括在团金会改革、改善银行经营管理、促进银行零售转型和生态战略发展等方面，取得显著成效。","情感倾向是积极。"
"2019-12-24 17:09:06","中国平安总经理今日起变更","中国平安12月24日发布公告称，经公司第十一届董事会第九次会议审议通过，并报中国银保监会核准任职资格，自2019年12月24日起，谢永林正式接替任汇川出任公司总经理。","情感倾向是积极的。"
"2019-12-24 16:49:31","中国平安：谢永林正式接替任汇川出任总经理","中国平安(601318)12月24日盘后公告，经公司第十一届董事会第九次会议审议通过，并报中国银行保险监督管理委员会核准任职资格，自2019年12月24日起，谢永林正式接替任汇川出任公司总经理。","情感倾向是积极的。"
"2019-12-24 15:36:03","中国平安：谢永林正式出任公司总经理","中国平安(601318)12月24日晚间公告，自2019年12月24日起，谢永林正式接替任汇川出任公司总经理。","该文本情感是中性的。"
"2019-12-24 06:31:00","为投资机构与融资企业搭建资金融通的桥梁 平安资管“科技赋能”模式进阶来袭","赢科技者赢未来。当以AI技术为代表的智能化浪潮席卷全球时，深谙市场竞争法则的金融巨头中国平安集团，早已意识到“转型是传统金融企业实现可持续增长的唯一选择”，并再次向外界展示了其“急先锋”的魄力与果敢。在中国平安集团已定调的“金融+科技”“金融+生态”新驱动模式下，其旗下的平安资管也正走在“科技资管”变革路上。近日，平安资管总经理罗水权接受了上海证券报独家专访。撕去固有标签 最先提出科技转型平安资管最广为人知的标签是其庞大的资产管理规模和未雨绸缪的前瞻布局。然而，内外部环境正在发生深刻变化，监管严、创新快和国际化趋势的加速，让资管业面临着前所未有的危机和挑战。正是在这样的大背景下，2018年平安资管在行业内率先提出科技转型，正式确立“科技型资管公司”的全新战略定位，主攻智能化领域，即通过引入人工智能等技术，扩展数据处理范围和深度，强化标签体系与模型算法，形成人工智能(AI)与人类智慧(HI)相结合的投资决策体系。罗水权透露，平安资管不惜斥巨资、增人力、添研发，2019年全年的科技投入预计达3亿元。此外，大数据专家、金融模型专家、AI专家等领域的人力投入，也是平安资管科技转型建设的重点。目前，在平安资管所有员工中，科技人员数量占比接近40%。放眼国内，能有如此规模资金投入和人力配比的资管机构寥寥无几。“人机合一” 深度应用于各场景资金与人力方面的投入，只是平安资管不断加大科技创新力度进程中的一个缩影。在罗水权看来，若不全新架构金融科技，并将之深度应用于各个场景与平台，那么，资管转型只是空谈。罗水权形容，平安资管整个“科技赋能”的过程，可以用三方面来概括，就是建设“人机合一”的智慧投资能力，构建“数据驱动”的量化信评能力，以及探索“AI赋能”的风险预警能力。这三重能力背后，不得不提的是平安资管自主打造的，基于大数据的智能债券一体化平台。这套智能平台下沉、精细化到何种程度？罗水权举例说：“在信用分析方面，我们采集了全球1.2万家企业20年的财务及非财务数据，筛选出800多个财务指标和200多个非财务量化指标，将定性因子进行量化入模，落地至企业精准画像。”开放赋能 搭建资金融通桥梁平安资管的科技战略绝不仅限于此。在罗水权看来，金融科技的应用，一方面是要切实帮助资管机构降本提效，提升投资业绩，强化风险管理能力；另一方面既要服务于资金端，满足其投资需求，也要服务于资产端，满足其融资需求，坚持资金端与资产端并举，促进整个行业的可持续发展。","情感倾向是积极。"
"2019-12-20 22:23:17","中国平安获沪股通连续12日净买入 累计净买入34.47亿元","12月20日中国平安获沪股通净买入1.79亿元，为连续12日净买入，合计净买入34.47亿元，期间股价上涨1.74%。证券时报数据宝统计显示，12月20日北向资金成交净买入37.15亿元。深沪股通成交活跃股中，中国平安全天成交6.85亿元，成交净买入1.79亿元，为连续第12日净买入，期间该股获沪股通累计成交98.01亿元，合计净买入34.47亿元。中国平安最新收盘价为85.53元，今日下跌0.20%，获沪股通连续净买入期间，股价累计上涨1.74%，期间上证指数上涨4.41%，该股所属的非银金融行业上涨6.85%。资金流向方面，今日中国平安获主力资金净流出2.16亿元，获沪股通连续净买入期间，主力资金累计净流出29.90亿元。融资融券数据显示，该股最新(12月19日)两融余额为252.71亿元，其中，融资余额为251.06亿元，近10日融资余额增加2.96亿元，增幅为1.19%。机构评级来看，近一个月该股被4家机构评级买入。预计目标价最高的是国泰君安，11月26日国泰君安发布的研报给予公司目标价位112.26元。(数据宝)近期中国平安上榜沪股通活跃股情况","积极。"
"2019-12-20 02:21:57","外资与融资客11月份以来455亿元加仓银保股 中国平安与招商银行最受青睐","年末，外资持续流入A股，融资客也加大布局力度。多只银行股与保险股被外资和融资客频频买入。据《证券日报》记者统计，11月份以来截至12月19日，共有8只银保个股被外资(依据“沪港通上榜十大成交活跃股”统计)和融资客同时买入，合计买入额达455亿元。其中，中国平安及招商银行两只个股表现较为突出。11月份以来，中国平安被融资买入170亿元、被外资净买入31.5亿元；招商银行被外资净买入9.6亿元、被融资客买入42亿元。在8只银保个股中，中国平安最受外资与融资客青睐，买入额居首。具体来看，11月份以来截至12月19日，中国平安、兴业银行、招商银行、平安银行、工商银行、农业银行、浦发银行、中国人寿等融资买入额分别达170亿元、53亿元、42亿元、40亿元、29亿元、25亿元、18亿元、15亿元。不难看出，中国平安买入额遥遥领先。从外资净买入额来看，根据“沪港通上榜十大成交活跃股”统计，11月份以来截至12月19日，中国平安、招商银行、平安银行、兴业银行、工商银行、农业银行、浦发银行、中国人寿分别被外资净买入31.5亿元、9.6亿元、7.9亿元、5.5亿元、5.0亿元、2.8亿元、1.3亿元、1.1亿元。中国平安和招商银行被外资净买入额较高。就中国平安目前的投资价值，申万宏源证券12月19日发布的研报认为，中国平安综合金融集团布局，各业务线均衡发展，业绩增速显著领先行业。平安作为典型的综合金融集团呈现两大特色，一是战略布局的前瞻性，在原先的金融牌照优势上融合技术优势，轻重资产结合均衡发展；二是业务协同的最大化，各项业务协作形成集团内部充分的交叉销售，深度服务客户。多元化产品累积了丰富的客户基础，叠加后续领先的金融科技加持，每年营收1%投入于科技研发激发持续创新。传统金融业务保持优势领先地位，科技赋能金融、提升客户转换率与客均利润，营运利润增长驱动力充足，维持买入评级。从中国平安刚刚披露的前11个月保费数据来看，其寿险保费受业务节奏影响短期承压，财险增速企稳趋势初显。具体来看，1月份-11月份，其寿险及健康险累计原保费4790亿元，同比增长9.5%，而1月份-10月份累计增速为9.9%，增速环比有所回落。此外，1月份-11月份其财险原保费为2436亿元，同比增长9.3%，1月份-10月份累计增速为8.9%，环比略有提升，回暖趋势初显。招商证券认为，中国平安2020年新的首席保险执行官上任，寿险业务自上而下将呈现更积极的面貌，以实现更高速发展。预测目标价112元。除中国平安与中国人寿外，11月份以来被外资和融资客同时布局的还有6只银行股，分别为招商银行、平安银行、兴业银行、工商银行、农业银行、浦发银行。值得注意的是，截至12月19日收盘，工商银行、农业银行、兴业银行仍呈现破净状态。针对近来银行股出现大面积破净的情况，首创证券研发部总经理王剑辉认为，银行股破净是基本面和技术层面共同发挥作用的结果，未来银行股破净的持续时间可能更长。","该文本情感是积极的。"
"2019-12-19 20:55:00","中国平安获沪股通连续11日净买入 累计净买入32.68亿元","12月19日中国平安获沪股通净买入1.92亿元，为连续11日净买入，合计净买入32.68亿元，期间股价上涨1.94%。证券时报数据宝统计显示，12月19日北向资金成交净买入35.36亿元。深沪股通成交活跃股中，中国平安全天成交6.67亿元，成交净买入1.92亿元，为连续第11日净买入，期间该股获沪股通累计成交91.16亿元，合计净买入32.68亿元。中国平安最新收盘价为85.70元，今日下跌0.33%，获沪股通连续净买入期间，股价累计上涨1.94%，期间上证指数上涨4.83%，该股所属的非银金融行业上涨6.79%。资金流向方面，今日中国平安获主力资金净流出4.02亿元，获沪股通连续净买入期间，主力资金累计净流出27.74亿元。融资融券数据显示，该股最新(12月18日)两融余额为252.28亿元，其中，融资余额为250.55亿元，近10日融资余额增加3.11亿元，增幅为1.26%。机构评级来看，近一个月该股被4家机构评级买入。预计目标价最高的是国泰君安，11月26日国泰君安发布的研报给予公司目标价位112.26元。(数据宝)近期中国平安上榜沪股通活跃股情况","积极"
"2019-12-19 15:46:43","打造国际领先的金融品牌","自1988年成立至今，中国平安的跨越式发展与品牌地位的提升，得益于改革开放的时代机遇，经济飞速发展的大好环境及企业家的创新精神。30余年来，平安每一次战略升级和业务迭代，都源于市场变革和国民需求变化。平安在改革的春风中诞生，在发展的大潮中崛起。当国民财富逐步增长，百姓更加关注生命的价值和意义，平安个人寿险业务应运而生；伴随中国加入WTO步入发展快车道，平安响应多元化金融服务需求，综合金融“一站式”服务惠及广大百姓；针对“看病难、看病贵”等民生痛点，平安加快医疗科技布局，为民众送上健康。平安是深植中国大地的品牌，既服务民生保障，又懂得百姓所思所想，所忧所虑。平安的品牌口号经历多次更迭，在平安初建阶段，“中国平安平安中国”与百姓对平安的祈愿深度链接；当保险深入百姓生活，“买保险就是买平安”寓指平安是可靠的保障；如今的“专业让生活更简单”，体现综合金融化繁为简，可解决国民多样需求。今年国庆，我们在人民日报的祝贺国庆广告中重现经典口号“中国平安平安中国”，这是企业与国家同呼吸、共命运的坚守和美好祝愿。如何才能成为真正的世界级品牌？平安在30多年发展过程中一直在探索和努力。首先，要通过产品、服务、沟通方式全面年轻化，确保品牌生命力。其次，要善用科技，打造世界领先的产品服务。第三，更要心怀天下、肩负责任，践行可持续发展。我们的目标是打造国民首选、国际领先的金融品牌。在品牌背后，应该传递给世界的是文化的精髓，精神的力量，情感的链接。我们希望和更多企业一道助力品牌强国建设，打造更多来自于中国的世界级“金字招牌”。","该文本情感是积极的。"
