"Date","Title","Content","qwen_lora2_情绪提取"
"2019-04-30 17:32:00","董事长马明哲：鼓励长线投资 中国平安将继续为投资人创造价值","一季度归属母公司股东的营运利润同比增长21%4月29日，中国平安保险(集团)股份有限公司(以下简称“中国平安”、股票代码02318 。HK、601318 。SH)公布了一季度业绩报告。据了解，今年第一季度，中国平安实现归属于母公司股东的营运利润341.19亿元，同比增长21.0%；归属于母公司股东的净利润455.17亿元，同比增长77.1%。而在当天中国平安在深圳平安金融管理学院召开的2018年年度股东大会和2019年第一次A股/H股类别股东大会上，中国平安董事长马明哲在回应股价问题时表示，我们相信平安的责任是为忠诚的股东提供长期、可持续的增加价值的服务，也希望平安越来越多长期投资者。当天中国平安的股价报收于86.43元/股，上涨3.99%。核心金融业务稳中趋好在寿险及健康险业务方面， 2019年第一季度，平安人寿与平安健康主动调整产品结构，减少短交储蓄型产品的销售，注重长期保障型和长交保障储蓄混合型产品销售。寿险及健康险业务首年保费同比下降10.8%，但新业务价值仍同比增长6.1%达216.42亿元。寿险及健康险业务归母营运利润达到196.52亿元，占比57.6%，仍是平安集团营运利润的核心来源。寿险及健康险归母净利润310.5亿元，同比增长123.37%。平安产险业务规模持续增长，业务品质保持优良。2019年第一季度，平安产险实现原保险保费收入692.20亿元，同比增长9.5%，综合成本率97.0%，持续优于行业。同时，受资本市场回暖带动投资收益同比上升，以及手续费率下降使得所得税同比下降的影响，平安产险净利润同比增长77.3%达到57.67亿元。平安银行整体经营稳中趋好，零售转型稳健前行。2019年第一季度，平安银行实现营业收入324.76亿元，同比增长15.9%；净利润74.46亿元，同比增长12.9%。在保险资金运用方面，截至3月31日，平安保险资金投资组合规模近2.88万亿元，较年初增长3.2%。2019年第一季度，保险资金投资组合年化净投资收益率3.9%，同比上升0.2个百分点；年化总投资收益率5.1%，同比上升1.4个百分点。科技领域申请专利超过1.5万项在金融科技方面，中国平安的优势也突显。据披露，集团个人客户数1.91亿，较年初增长3.6%，互联网用户量5.61亿，较年初增长4.2%。第一季度，集团新增客户1,100万，其中31.3%来自集团五大生态圈的互联网用户。2019年第一季度，陆金所控股的资产管理规模较年初增长2.0%至3767.07亿元，管理贷款余额较年初稳健增长7.5%至4031.21亿元；目前，陆金所控股已完成C轮融资，投后估值达394亿美元。","情感倾向是积极的。"
"2019-04-30 13:54:47","中国平安一季度归母营运利润增21% 1.5万亿市值列A股第三","4月29日，中国平安披露2019年一季报，公司实现归母营运利润341.19亿元，同比增长21%；归母净利润455.17亿元，同比增长77.1%。当天，中国平安A股股价继续上涨3.99%，收盘价为86.43元/股，总市值达1.58万亿，位列A股第三。一季度业绩稳健增长一季报显示，截至3月31日，平安个人客户数近1.91亿，较年初增长3.6%，互联网用户量5.61亿，较年初增长4.2%。第一季度，集团新增客户1100万，其中31.3%来自集团五大生态圈的互联网用户。传统业务方面，公司主动调整产品结构，注重长期保障型和长交保障储蓄混合型产品销售，寿险及健康险业务首年保费同比下降10.8%，但新业务价值仍同比增长6.1%达216.42亿元；平安产险则实现原保险保费收入692.20亿元，同比增长9.5%，综合成本率97.0%，持续优于行业。受资本市场回暖带动投资收益同比上升，以及手续费率下降使得所得税同比下降的影响，平安产险净利润同比增长77.3%。同时，平安银行整体经营继续稳中趋好，实现营业收入324.76亿元，同比增长15.9%；净利润74.46亿元，同比增长12.9%。此外，中国平安孵化的独角兽也持续稳健增长。2019年第一季度，陆金所控股资产管理规模较年初增长2.0%至3767.07亿元，管理贷款余额较年初稳健增长7.5%至4031.21亿元；目前，陆金所控股已完成C轮融资，投后估值达394亿美元。金融壹账已为590家银行、77家保险公司、2634家其他非银金融机构提供金融科技服务，一季度风控产品使用量3.26亿次。近两年发力布局的平安智慧城市业务已覆盖财政、政务、交通、生活、医疗、贸易等领域，在北京、上海、深圳等超过100个国内城市、多个“一带一路”沿线国家和地区推广。中国平安董事长马明哲表示：“2019年是平安战略转型的关键之年，中国平安将紧跟国家政策，不断提升服务实体经济能力，持续深化”金融 科技“、”金融 生态“战略，积极布局五大生态圈建设。”4个月上涨48.66%在业绩推动下，中国平安今年的股价节节高升。年初至今，其股价累计上涨48.66%，稳稳跑赢大盘。截止4月29日收盘，其总市值达1.58万亿，在A股中名列第三，仅次于工商银行和建设银行。目前，中国平安已是基金头号重仓股。天风证券的数据显示，一季度末有474只基金持有中国平安，位列榜首。一季度，基金持有中国平安的总市值为276.61亿元，占基金股票投资市值的4.88%。除了受国内机构青睐，外资流入也在加大。截止4月27日，沪深港通持有中国平安的股票数量为8.06亿股，比年初增加8700万股。董事长马明哲在内的1267名核心员工带头买入更给市场注入强心剂。据悉，中国平安2019年度核心人员持股计划于3月25日至27日通过二级市场完成购股，购得的中国平安A股股票占公司总股本0.044%，共计给市场注入5.88亿元，成交均价约为人民币72.79元/股。照此计算，目前这批股票已浮盈18.74%。","该文本情感是积极的。"
"2019-04-30 13:10:39","50亿-100亿回购自家股票定了！一季报净利大增77% 一家年净利过千亿的“巨无覇”如何做到？","“一季报千万别爆雷”，这是最近A股投资者对所持股票的期许，最近多家业绩爆雷的公司股价已从高位掉头下坠。然而，也有一些公司业绩大增远超预期，在市场调整中股价逆势上飙，中国平安(601318.SH)便是其中一例。一季报显示，中国平安归属于母公司股东的净利润455.17亿元，同比增长77.1%。业绩公布当天，正值2018年度公司股东大会之时，通过了动用50亿—100亿回购自家公司股票决定。一家中小型公司业绩增长这么快还可以理解，中国平安可是一家总资产超过7万亿，年利润超过千亿级别的“巨无覇”，而且还是上年业绩保持20%增长的情况下，这是怎样做到的呢？股债双牛“投资平安一定有耐心……”4月29日下午，中国平安在深圳观澜的平安金融管理学院召开2018年年度股东大会，董事长马明哲回答股价时说。其还谈起了巴菲特的投资理念，一是看行业、二看管理团队，三才是看股价。马明哲自信的背后，不仅是业绩大涨，股价今年也是一骑绝尘。中国平安从1月2日的每股55.94元，一路上涨到最近的高点每股88.09元，涨幅接近60%！如果投资者今年持有中国平安，四个月时间稳赚60%。中国平安一季报公布当天，A股三大指数全盘皆绿，深证与创业板跌幅分别高达1.62%、2.55%，但是当天中国平安逆势大涨3.99%，毫无疑问，其净利高达77%的增长再次点亮了股价。2018年全年，中国平安归属股东的净利润增长为20.56%，为何今年一季度净利增长狂奔到77.1%，加速度快跑的新增动力在哪里？我们来对比其一组数字：一季度，归属于母公司股东的净利润455.17亿元，同比增长77.1%。一季度，中国平安实现归属于母公司股东的营运利润341.19亿元，同比增长21.0%。看到没有？营运利润的增长同比为21.0%，也就是说保险、银行、证券、基金、信托、新金融等主营业务上，加总的利润增长速度与去年差不多。那么归属股东的净利润却暴增77.1%，比营运利润多出的100多亿的净利来自哪里？来自于投资收益，一季度股债双牛的市场让中国平安赚得盆满钵满。有数据为证：中国平安的保险资金投资组合资产配置持续优化，资产负债匹配不断改善，收益率也大幅上扬。截至今年3月31日，平安保险资金投资组合规模近2.88万亿元，较年初增长3.2%。2019年第一季度，保险资金投资组合年化净投资收益率3.9%，年化总投资收益率5.1%。这个收益率有多高？对比一下2018年一季度就知道了，截至2018年3月末，平安保险资金投资组合规模达2.56万亿元，保险资金投资组合年化净投资收益率3.7%，年化总投资收益率3.7%。","以上文本情感是积极的。"
"2019-04-30 10:49:01","一季度净利同比大增77.1% 中国平安AH股双双高开","中国平安H股高开1.64%，中国平安高开0.1%，财报显示，2019年一季度净利润455.2亿元，同比大增77.1%。4月29日，中国平安一季度“成绩单”出炉。2019年第一季度，中国平安实现归属于母公司股东的营运利润341.19亿元，同比增长21.0%；归属于母公司股东的净利润455.17亿元，同比增长77.1%。以此计算，相当于中国平安每日净赚5亿元以上。同日，中国平安在港交所发布公告称，公司拟使用不低于50亿元且不超过100亿元(均包含本数)的自有资金，以不超过人民币101.24元/股的回购价格回购本公司A股股份。本次回购股份将全部用于公司员工持股计划，包括但不限于公司股东大会已审议通过的长期服务计划。本次回购期限为自本次回购方案经公司年度股东大会及类别股东大会审议通过之日起不超过12个月，即自2019年4月29日至2020年4月28日。","以上文本情感是积极的。"
"2019-04-30 10:12:39","中国平安年首季运营利润稳增两成 金融科技战略持续深化","中国平安保险(集团)股份有限公司(中国平安，2318.HK，601318.SH)今日公布2019年一季报。一季度，中国平安实现归属于母公司股东的营运利润341.19亿元，同比增长21.0%；归属于母公司股东的净利润455.17亿元，同比增长77.1%。截至3月31日，平安个人客户数近1.91亿，较年初增长3.6%，互联网用户量5.61亿，较年初增长4.2%。第一季度，集团新增客户1100万，其中31.3%来自集团五大生态圈的互联网用户。核心金融业务稳中趋好寿险及健康险新业务价值持续优化。公司在坚持规模及价值均衡增长的同时，更加关注各个季度业务的稳定发展，以实现业绩长期可持续增长和代理人队伍健康增长。2019年第一季度，公司坚持“保险姓保”的产品理念，主动调整产品结构，减少短交储蓄型产品的销售，注重长期保障型和长交保障储蓄混合型产品销售，寿险及健康险业务首年保费同比下降10.8%，但新业务价值仍同比增长6.1%达216.42亿元。平安产险业务规模持续增长，业务品质保持优良。2019年第一季度，平安产险实现原保险保费收入692.20亿元，同比增长9.5%，综合成本率97.0%，持续优于行业。同时，受资本市场回暖带动投资收益同比上升，以及手续费率下降使得所得税同比下降的影响，平安产险净利润同比增长77.3%。保险资金投资组合资产配置持续优化，资产负债匹配不断改善。截至3月31日，平安保险资金投资组合规模近2.88万亿元，较年初增长3.2%。2019年第一季度，保险资金投资组合年化净投资收益率3.9%，年化总投资收益率5.1%。平安银行整体经营稳中趋好，零售转型稳健前行。2019年第一季度，平安银行实现营业收入324.76亿元，同比增长15.9%；净利润74.46亿元，同比增长12.9%。同时平安银行运用科技创新持续深化零售转型，截至3月末，管理零售客户资产16632.98亿元，较年初增长17.4%；核心一级资本充足率较年初提升0.21个百分点达8.75%。金融科技与医疗科技战略持续深化2019年一季度，中国平安深化落实“金融 科技”、“金融 生态”战略，持续在人工智能、区块链、云等技术领域加大投入，支撑五大生态圈建设，助力集团内外部业务开展，推动“科技赋能金融、科技赋能生态、生态赋能金融”。截至2019年3月31日，公司科技专利申请数较年初增加3265项，累计达15316项，位居国际金融机构前列，其中PCT及境外专利申请数3761项。2019年第一季度，陆金所控股收入与利润持续稳健增长，资产管理规模较年初增长2.0%至3,767.07亿元，管理贷款余额较年初稳健增长7.5%至4,031.21亿元；目前，陆金所控股已完成C轮融资，投后估值达394亿美元。金融壹账通致力于打造全球领先的金融科技服务云平台，截至3月31日，金融壹账通已为590家银行、77家保险公司、2,634家其他非银金融机构提供金融科技服务，一季度风控产品使用量3.26亿次。平安智慧城市业务，围绕优政、兴业、惠民打造“1 N”平台，协助政府解决城市管理和发展的各种问题。目前，平安智慧城市业务已覆盖财政、政务、交通、生活、医疗、贸易等领域，在北京、上海、深圳等超过100个国内城市、多个“一带一路”沿线国家和地区推广。在精准扶贫方面，平安持续推动面向“村官、村医、村教”的“三村智慧扶贫工程”，利用现代科技实践产业扶贫、健康扶贫和教育扶贫。截至3月末，公司已在全国9个省或自治区落地“三村工程”，累计提供扶贫资金98亿元，援建升级乡村卫生所逾400所，培训村医5,702名，援建升级乡村学校391所，培训乡村教师4,819名。中国平安董事长、首席执行官马明哲表示：“2019年是平安战略转型的关键之年，中国平安将紧跟国家政策，不断提升服务实体经济能力，持续深化”金融 科技“、”金融 生态“战略，积极布局五大生态圈建设，加大科技研发投入，打造优质的产品和极致的服务体验，推动各项业务稳健增长；同时肩负社会责任，持续开展”三村工程“，践行回馈社会、建设国家的企业使命，为客户、股东、社会创造更大的价值，以更好的发展为祖国70周年华诞献礼。”","情感倾向是积极的。"
"2019-04-30 09:59:08","恒生指数开盘跌0.22% 中国平安领涨蓝筹股","恒生指数开盘跌0.22%，报29828.15点。蓝筹股方面，中国平安涨1.64%，领涨蓝筹股，瑞声科技跌近3%，交通银行、腾讯控股等跌逾1%。港股通方面，北京汽车涨近6%，青岛啤酒股份涨近3%，中国燃气跌逾3%。","该文本情感是中性的。"
"2019-04-30 09:43:09","香港恒生指数低开0.22% 中国平安H股高开1.64%","4月30日，香港恒生指数低开0.22%，中国平安H股高开1.64%，财报显示，中国平安2019年一季度净利润455.2亿元，同比大增77.1%。","该文本情感是积极的。"
"2019-04-30 09:37:40","中国平安一季度实现净利润455.2亿元 同比增长77.1%","昨日晚间，中国平安保险(集团)股份有限公司(以下简称“中国平安”)公布截至2019年3月31日止三个月期间业绩。数据显示，2019年第一季度，中国平安实现归属于母公司股东的营运利润341.19亿元，同比增长21.0%；归属于母公司股东的净利润455.17亿元，同比增长77.1%。截至3月31日，平安个人客户数近1.91亿，较年初增长3.6%，互联网用户量5.61亿，较年初增长4.2%。第一季度，集团新增客户1,100万，其中31.3%来自集团五大生态圈的互联网用户。寿险业务方面，2019年第一季度，中国平安坚持“保险姓保”的产品理念，主动调整产品结构，减少短交储蓄型产品的销售，注重长期保障型和长交保障储蓄混合型产品销售，寿险及健康险业务首年保费同比下降10.8%，但新业务价值仍同比增长6.1%达216.42亿元。产险业务方面，2019年第一季度，平安产险实现原保险保费收入692.20亿元，同比增长9.5%，综合成本率97.0%。同时，受资本市场回暖带动投资收益同比上升，以及手续费率下降使得所得税同比下降的影响，平安产险净利润同比增长77.3%。保险资金投资组合资产配置持续优化，资产负债匹配不断改善。截至3月31日，平安保险资金投资组合规模近2.88万亿元，较年初增长3.2%。2019年第一季度，保险资金投资组合年化净投资收益率3.9%，年化总投资收益率5.1%。中国平安董事长/首席执行官马明哲表示，2019年是平安战略转型的关键之年，中国平安将紧跟国家政策，不断提升服务实体经济能力，持续深化“金融 科技”、“金融 生态”战略，积极布局五大生态圈建设，加大科技研发投入，推动各项业务稳健增长。","该文本情感是积极的。"
"2019-04-30 08:31:35","中国平安一季度净利大增77%","中国平安于4月29日晚间发布的一季报显示，2019年第一季度，中国平安实现归属于母公司的净利润455.17亿元，同比增长77.1%。2019年以来资本市场显著回暖，权益市场向好带动保险公司权益投资收益上升，是中国平安归母净利润大增的重要原因。一季报显示，中国平安一季度投资收益为466.13亿元，同比大增533%，是利润表收入项下增长最快的科目。一季度，平安保险资金投资组合年化净投资收益率3.9%，年化总投资收益率5.1%，较2018年同期分别上升0.2个百分点和1.4个百分点。截至3月31日，平安保险资金投资组合规模近2.88万亿元，较年初增长3.2%。寿险及健康险方面，平安一季度首年保费同比下降10.8%，但新业务价值率36.8%，同比上升5.9个百分点。截至3月末，平安寿险代理人数量131.1万，较年初下降7.5%。平安表示，公司主动调整寿险产品结构，减少短交储蓄型产品的销售，注重长期保障型和长交保障储蓄混合型产品销售，新业务价值同比增长6.1%达216.42亿元。2019年公司将更加注重高保障、高价值产品销售，通过持续优化业务结构，有效提升整体新业务价值率。平安产险一季度实现原保险保费收入692.20亿元，同比增长9.5%；但综合成本率为97.0%，较去年同期上升1.1个百分点。截至3月31日，平安集团个人客户数近1.91亿，较年初增长3.6%；互联网用户量5.61亿，较年初增长4.2%。第一季度，集团新增客户1100万，其中31.3%来自集团五大生态圈的互联网用户。","该文本情感是积极的。"
"2019-04-30 06:09:27","中国平安一季度净利润同比增长77% 继续深化落实“金融+生态”战略","4月29日，中国平安交出今年首份季度成绩单。2019年第一季度，该公司归属于母公司股东的净利润455.17亿元，同比增长77.1%。同日召开的2018年年度股东大会上，中国平安董事长马明哲指出，金融业最大的缺陷是缺少流量和入口，构建生态是为了获取刚性的流量和入口，金融业已经从一百年前产品、服务的竞争演变为生态的竞争。一季度营运利润达341亿元数据显示，2019年第一季度，中国平安实现归属于母公司股东的营运利润341.19亿元，同比增长21.0%；归属于母公司股东的净利润455.17亿元，同比增长77.1%。具体来看，第一季度寿险及健康险业务首年保费同比下降10.8%，但新业务价值仍同比增长6.1%达216.42亿元；平安产险原保险保费收入同比增长9.5%，净利润同比增长77.3%；平安银行实现营业收入324.76亿元，同比增长15.9%，净利润74.46亿元，同比增长12.9%。截至今年3月31日，平安保险资金投资组合规模近2.88万亿元，较年初增长3.2%。2019年第一季度，保险资金投资组合年化净投资收益率3.9%。科技板块方面，陆金所控股资产管理规模较年初增长2.0%至3767.07亿元；金融壹账通截至3月31日已为590家银行、77家保险公司、2,634家其他非银金融机构提供金融科技服务，一季度风控产品使用量3.26亿次；平安智慧城市业务在北京、上海、深圳等超过100个国内城市、多个“一带一路”沿线国家和地区推广。截至3月31日，平安个人客户数近1.91亿，较年初增长3.6%，互联网用户量5.61亿，较年初增长4.2%。第一季度集团新增客户1100万，其中31.3%来自集团五大生态圈的互联网用户。截至3月31日，公司科技专利申请数较年初增加3265项，累计达1.53万项，位居国际金融机构前列，其中PCT及境外专利申请数3761项。加码科技投入2018年中国平安科技开放日上，中国平安联席CEO陈心颖曾指出，过去十年平安共投入70亿美元于科研投入，预计未来十年的投入将达150亿美元。一边是平安持续加码科技板块，一边是2018年以来多家互联网巨头不断缩减规模、频频裁员，会否令平安在科技板块布局更加谨慎？在4月29日的2018年年度股东大会上，马明哲指出，过去十年，中国平安用科技快速提升金融业务的竞争力，现在是用科技来赋能生态。金融业最大的缺陷是缺少流量和入口，构建生态是为了获取刚性的流量和入口，为国家和社会提供服务，同时用生态来赋能公司竞争力。现在的金融业已经从一百年前的产品、服务的竞争，演变为数据和流量的竞争，现在更上一层成为生态的竞争。","该文本情感是积极的。"
"2019-04-30 02:55:10","中国平安：拟不低于50亿元回购A股股份 用于员工持股计划","4月29日，中国平安在港交所发布公告称，公司拟使用不低于50亿元且不超过100亿元(均包含本数)的自有资金，以不超过人民币101.24元/股的回购价格回购本公司A股股份。本次回购股份将全部用于公司员工持股计划，包括但不限于公司股东大会已审议通过的长期服务计划。本次回购期限为自本次回购方案经公司年度股东大会及类别股东大会审议通过之日起不超过12个月，即自2019年4月29日至2020年4月28日。中国平安表示，若公司未能在法律法规规定的期限内实施上述用途，则存在启动未转让部分股份注销程序的风险。同日，中国平安披露2019年一季度报告，报告期内，实现归属于母公司股东的营运利润341.19亿元，同比增长21.0%；归属于母公司股东的净利润455.17亿元，同比增长77.1%。以此计算，相当于中国平安每日净赚5亿元以上。","该文本情感是积极的。"
"2019-04-30 02:09:39","中国平安：拟以不低于50亿元不超过101.24元/股回购A股股份","中国平安4月29日晚间公告称，公司拟使用不低于人民币50亿元且不超过人民币100亿元的自有资金，以不超过人民币101.24元/股的回购价格回购公司A股股份。本次回购股份将全部用于公司员工持股计划，包括但不限于公司股东大会已审议通过的长期服务计划。公告显示，本次回购期限为自本次回购方案经公司年度股东大会及类别股东大会审议通过之日起不超过12个月，即自2019年4月29日至2020年4月28日。","该文本情感是中性的。"
"2019-04-29 21:53:04","中国平安一季度归母营运利润同比增21%","中国平安保险(集团)股份有限公司29日公布2019年一季度“成绩单”：实现归属于母公司股东的营运利润341.19亿元人民币，同比增长21%；归属于母公司股东的净利润455.17亿元，同比增长77.1%。截至3月31日，中国平安个人客户数近1.91亿，较年初增长3.6%，互联网用户量5.61亿，较年初增长4.2%。中国平安称，公司一季度主动调整产品结构，减少短交储蓄型产品的销售，注重长期保障型和长交保障储蓄混合型产品销售，寿险及健康险业务首年保费同比下降10.8%，但新业务价值仍同比增长6.1%，达216.42亿元。此外，一季度，平安产险实现原保险保费收入692.20亿元，同比增长9.5%。截至3月31日，平安保险资金投资组合规模近2.88万亿元，较年初增长3.2%。一季度，保险资金投资组合年化净投资收益率3.9%，年化总投资收益率5.1%。同期平安旗下陆金所资产管理规模较年初增长2%，至3767.07亿元，管理贷款余额较年初增长7.5%，至4031.21亿元。(完)","情感倾向是积极。"
