"Date","Title","Content","qwen_lora2_情绪提取"
"2019-10-24 22:06:58","10月25日上市公司重要公告集锦： 中国平安前三季度净利1295.67亿元 同比增63.2%","沪市重要公告：中国平安：截至三季度末保险资金投资组合规模3.03万亿元较年初增8.6%中国平安(601318)公告，截至第三季度末，保险资金投资组合规模3.03万亿元，较年初增8.6%；前三季度年化净投资收益率4.9%，年化总投资收益率6%。交通银行：减持计划到期社保基金会未减持公司股份交通银行(601328)公告，今日收到社保基金会来函通知，截至减持股份计划到期日，即2019年10月24日，社保基金会未减持公司股份。中国中铁：与贵州省政府签署战略合作协议计划五年内投资不少于1500亿元中国中铁(601390)公告，近期，公司与贵州省人民政府签署了战略合作框架协议，公司根据贵州省的发展规划和项目推进情况，计划五年内投资不少于1500亿元，主要用于滚动开展包括公路、铁路、轨道交通、市政道路、水利、环保水务、棚改、地下管廊、海绵城市、机场及城市开发建设等在内的重点工程项目的投资建设及运营合作。新通联：筹划收购华坤道威51%股权交易对方孟宪坤拟受让18.45%公司股份新通联(603022)公告，公司与孟宪坤等交易对方签署收购资产框架协议，拟支付现金收购浙江华坤道威数据科技有限公司51%的股权。此外，为公司引进数据智能服务行业的战略股东，绑定拟收购资产的管理团队，公司实际控制人曹文洁及其控制企业拟向孟宪坤转让18.45%的公司股份。本次权益变动后，孟宪坤持有18.45%公司股份。本次权益变动不会使公司控股股东、实际控制人发生变化。2019年三季报：汇顶科技：前三季度净利17.12亿元同比增437.22%汇顶科技(603160)公告，公司2019年前三季度实现营业收入46.78亿元，同比增长97.77%；净利润17.12亿元，同比增长437.22%。基本每股收益3.82元。中国平安：前三季度净利1295.67亿元同比增63.2%中国平安(601318)公告，公司2019年前三季度实现净利润1295.67亿元，同比增长63.2%。寿险及健康险业务营运利润同比增长30.5%。新业务价值率48.1%，同比上升5.3个百分点；新业务价值同比增长4.5%。客户经营业绩持续增长，集团个人客户数超2亿，较年初增长9.5%；互联网用户量5.94亿，较年初增长10.4%。蓝光发展：前三季度净利25.35亿元同比增107.83%蓝光发展(600466)公告，公司2019年前三季度实现营业收入278.81亿元，同比增长95.27%；净利润25.35亿元，同比增长107.83%。基本每股收益0.77元。","该文本情感是积极的。"
"2019-10-24 22:05:18","中国平安前三季度归母营运利润增21.5%","10月24日，中国平安公布了2019前三季度业绩报。财报显示，2019年前三季度，中国平安实现归属于母公司股东的营运利润1,040.61亿元，同比增长21.5%；归属于母公司股东的净利润1,295.67亿元，同比增长63.2%。今年前三季度，中国平安个人客户数超2亿，较年初增长9.5%，新增客户数达2,972万，其中1,158万来自集团五大生态圈的互联网用户，占比39.0%。此外，公告还披露，中国平安拟合资设立全国性科技型消费金融公司，有关事项尚待履行相关监管审批程序。前三季度，中国平安寿险及健康险业务实现营运利润691.04亿元，同比增长30.5%；新业务价值同比增长4.5%至588.05亿元。与此同时，前三季度，平安产险实现原保险保费收入1,968.75亿元，同比增长8.7%，营运利润142.54亿元，同比增长75.5%；综合成本率96.2%。此外，平安银行前三季度实现营业收入1,029.58 亿元，同比增长18.8%；净利润236.21亿元，同比增长15.5%。截至9月末，平安银行管理零售客户资产18,721.78亿元，较年初增长32.1%。同时，拨备覆盖率较年初上升30.94个百分点至186.18%。2019年前三季度科技业务总收入600.40亿元，同比增长33.1%。截至9月末，平安科技专利申请数较年初增加7,977项、累计达20,248项。陆金所控股客户资产规模较年初下降5.0%至3,508.57亿元，主要由于互联网贷款业务受限影响在售产品的销售。在个人借款领域，陆金所控股管理贷款余额较年初增长17.7%至4,412.13亿元。截至9月末，金融壹账通已经累计为全国618家银行、84家保险公司提供服务。平安好医生目前注册用户已近3亿。平安医保科技已为超200个城市的医保管理机构提供医保精细化管理服务，覆盖参保人数超8亿人。平安智慧城市累计覆盖全国超100个城市。","该文本情感是积极的。"
"2019-10-24 21:50:01","中国平安前三季净利增长63%","中国平安披露三季报，公司2019年前三季度实现营业收入8927.51亿元，同比增长18.6%；归属于上市公司股东的净利润1295.67亿元，同比增长63.2%。每股收益7.29元。前三季度科技业务总收入600.40亿元，同比增长33.1%。","以上文本情感是积极的。"
"2019-10-24 21:29:45","中国平安前三季度净利润同比增63.2% 拟合资设立消费金融公司","10月24日，中国平安发布公告称，公司董事会决议通过，拟合资设立全国性科技型消费金融公司，有关事项尚待履行相关监管审批程序。从前三季度的经营来看，中国平安整体业绩及各项业务保持稳健增长态势，实现归属于母公司股东的营运利润1040.61亿元，同比增长21.5%；归属于母公司股东的净利润1295.67亿元，同比增长63.2%。中国平安客户经营业绩持续增长，截至9月末，该集团个人客户数超2亿，较年初增长9.5%；互联网用户量5.94亿，较年初增长10.4%。前三季度，平安集团新增客户数达2972万，其中1158万来自该集团五大生态圈的互联网用户，占比达39.0%。","情感倾向是积极。"
"2019-10-24 21:10:02","重磅！总经理换人 1.6万亿金融巨头高管大调整来了！","金秋喜获丰收之际，1.6万亿市值的中国平安今日傍晚连续放大消息，除发布已预告多日的三季报之外，中国平安也发布了董事、监事及高管层的调整公告。除了马明哲依然任董事长之外，副董事长、总经理等高管及董事、监事都换了新人。人事变动前亮今年前三季度成绩单对于今年前三季度的成绩单，中国平安表示“整体业绩及各项业务保持稳健增长态势”。截至9月底，实现归属于母公司股东的营运利润1040.61亿元，同比增长21.5%；归属于母公司股东的净利润1295.67亿元，同比增长63.2%。客户经营业绩持续增长，截至9月末，集团个人客户数超2亿，较年初增长9.5%；互联网用户量5.94亿，较年初增长10.4%。前三季度，集团新增客户数达2,972万，其中1158万来自集团五大生态圈的互联网用户，占比39.0%。营收方面，中国平安前九个月营业收入为9704.8亿元人民币，去年同期为7504.56亿元人民币，同比增长29.3%。其中，公司第三季度营业收入为2802.36亿元人民币，去年同期为2421.7亿元人民币，同比增长15.7%。公司第三季度归属于母公司股东的净利润为318.91亿元人民币，去年同期为213.02亿元人民币，同比增长49.7%。中国平安今天也表示，董事会决议通过，将拟合资设立全国性科技型消费金融公司，不过有关事项尚待履行相关监管审批程序。人事大调整年轻高管接连上任","积极"
"2019-10-24 21:03:58","公告精选：中国平安前三季度净利同比增63%；社保基金会尚未减持交通银行股份","10月24日晚间公告精选：中国平安前三季度净利1296亿元，同比增63%；万科前三季度净利182.4亿元，同比增长30.43%；科大讯飞前三季度净利润3.74亿元，同比增长70.51%；恒瑞医药前三季度净利37.35亿元，同比增28%；万华化学前三季度净利79亿元，同比降42%；截至减持计划到期日，社保基金会未减持交通银行股份；新开源：嘉兴嘉闻拟受让股权和受托表决权比例为20%至29.99%。","情感倾向是积极的。"
"2019-10-24 20:54:55","中国平安董监高调整：任汇川出任副董事长 谢永林出任总经理","10月24日，中国平安第十一届董事会第九次会议和第九届监事会第七次会议在上海召开。根据相关公告，中国平安监事会选举孙建一担任监事会主席，董事会推荐谢永林、陈心颖接替孙建一、蔡方方出任公司执行董事，选举任汇川出任副董事长，聘任谢永林出任公司总经理，聘任蔡方方和黄宝新出任公司副总经理。上述部分董、监事及高管调整仍需要相关公司治理程序审议或监管机构的任职资格核准。中国平安表示，公司正逐步进入“金融+科技”、“金融+生态”战略改革、模式转型的深水区、无人区，将继续在马明哲董事长的带领下，持续完善谢永林、李源祥、陈心颖三位联席CEO负责的公司、个人、科技三大业务事业群结构，不断巩固、强化“联席CEO+职能执行官”集体决策机制，坚定不移地深化既定战略，坚持改革创新，迎接新时代的重大机遇和挑战，实现高质量、可持续的发展。","情感倾向是积极。"
"2019-10-24 20:09:48","中国平安：前三季度归母营运利润增长21.5%","10月24日晚间，中国平安(601318,2318.HK)发布2019年前三季度报告，今年1月至9月份，公司营业收入为9704.82亿元人，同比增长29.32%；公司实现归属于母公司股东的营运利润1040.61亿元，同比增长21.5%；归属于母公司股东的净利润1295.67亿元，同比增长63.2%。中国平安表示，公司客户经营业绩持续增长，截至9月末，公司个人客户数超2亿，较年初增长9.5%；互联网用户量5.94亿，较年初增长10.4%。前三季度，公司新增客户数达2,972万。其中1158万来自公司五大生态圈的互联网用户，占比39.0%。报告显示，2019年前三季度，中国平安寿险及健康险业务实现营运利润691.04亿元，同比增长30.5%；新业务价值588.05亿元，同比增长4.5%，主要原因是新业务价值率提升的贡献，新业务价值率同比上升5.3个百分点至48.1%。截至9月末，平安寿险代理人数量124.5万人，较年初下降12.1%，较6月末下降3.2%；前三季度代理人人均个险新保单件数为1.39件/月，同比增长9.4%。报告显示，平安产险业务规模持续增长。前三季度产险实现原保险保费收入1,968.75亿元，同比增长8.7%；营运利润142.54亿元，同比增长75.5%；综合成本率96.2%，优于行业。平安产险将AI图像定损技术植入“平安好车主”APP，支持用户进行免费的外观损伤自助检测，检测成功率达95%。前三季度，中国平安保险资金投资组合年化净投资收益率4.9%；受资本市场回暖带动投资收益同比增加的影响，年化总投资收益率6.0%。此外，在核心技术研发和自主知识产权掌控方面，截至9月末，中国平安科技专利申请数较年初增加7977项，累计达20248项，其中PCT及境外专利申请数达4396项。科技战略持续深化，各项业务保持快速发展，2019年前三季度科技业务总收入600.4亿元，同比增长33.1%。","该文本情感是积极的。"
"2019-10-24 19:20:06","中国平安三季报：科技业务收入增三成 陆金所客户资产规模下降","中国平安今日发布第三季度报告，其科技板块的业绩表现迥异。南都记者获悉，中国平安的科技战略持续深化，各项业务快速发展，前三季度科技业务总收入600亿元，同比增长33.1%。前三季度，陆金所控股收入与利润持续稳健增长。其中，在线上财富管理领域，由于互联网贷款业务受限影响在售产品的销售，陆金所控股客户资产规模较年初下降5%至3508.57亿元。值得关注的是，在个人借款领域，陆金所控股管理贷款余额较年初稳健增长17.7%至4,412.13亿元。在政府金融领域，陆金所控股继续加大金融科技在财政管理方面的应用和推广，智慧财政项目已在全国多个省市实施。根据三季报，金融壹账通是中国拥有金融机构客户数量最多的科技服务平台。截至9月末，累计服务618家银行，84家保险公司，包括中国所有大型银行、99%的城商行和46%的保险公司，并通过这些机构触达数以亿计的终端客户。与此同时，平安好医生作为平安集团医疗生态圈重要组成，以人工智能辅助的自有医疗团队为核心，为用户提供全面的家庭医生服务，同时平安好医生整合线下医疗健康服务网络，为用户提供线上线下一体化的医疗健康服务。平安医保科技致力于成为全方位赋能医疗生态圈的智慧科技公司，截至9月末，平安医保科技已为超200个城市的医保管理机构提供医保精细化管理服务，覆盖参保人数超8亿人。汽车之家持续为汽车消费者提供丰富的产品及服务，不断推进客户和用户端智能化转型升级，巩固并发展内容、数据和团队三大核心竞争力，更好地服务客户和广大用户。平安智慧城市业务围绕“优政、兴业、惠民”三大主题，以科技赋能城市发展，构建了一体化平台体系，覆盖医疗、政务、交通、环保、法律、教育、农业等21个领域，已在超过100个国内城市和多个“一带一路”沿线国家及地区落地推广，积极践行“服务国家、服务社会、服务大众”的理念。值得关注的是，董事会决议通过，中国平安拟合资设立全国性科技型消费金融公司，有关事项尚待履行相关监管审批程序。","该文本情感是积极的。"
"2019-10-24 18:58:51","中国平安领导班子再调整 董事长马明哲职务和职责是否有变？","继设立联席首席执行官制度后，中国平安的高层人事再一次进行了调整。而在本次调整后，中国平安管理层的年龄主要集中在50岁左右，干部队伍进一步年轻化、专业化。10月24日，中国平安保险(集团)股份有限公司(中国平安，601318.SH；2318.HK)发布公告称，监事会选举孙建一担任监事会主席，董事会推荐谢永林、陈心颖接替孙建一、蔡方方出任公司执行董事，选举任汇川出任副董事长，聘任谢永林出任公司总经理，聘任蔡方方和黄宝新出任公司副总经理。上述高管相互之间如何看待此次调整？在此次调整后，中国平安董事长马明哲的职务和职责是否有变化？在平安内部，孙建一、任汇川、谢永林等发表了一些自己的看法。副董事长任汇川：马明哲董事长将继续发挥核心领导作用对于中国平安董事长马明哲的职务和职责，任汇川表示，马明哲董事长在平安的战略迭代升级、商业模式创新、金融及医疗科技创新、人才梯队培养、文化建设等方面，发挥了不可替代的核心作用。任汇川指出，马明哲董事长未来将继续在公司的重大战略转型、商业模式创新、科技创新、人才梯队培养和文化建设等方面，发挥核心领导作用。同时，三位联席CEO分别负责三大业务事业群的结构、“联席CEO+职能执行官”集体决策机制，将在马明哲董事长领导下不断完善。现年50岁的任汇川于1992年加入中国平安，自2011年3月起出任公司总经理，2012年7月起出任中国平安执行董事，亦为平安寿险、平安产险、平安资产管理等本公司多家控股子公司的董事。谈及此次调整，任汇川表示，本次董事会对部分高管岗位做出的调整，是对“联席CEO+职能执行官”集体决策机制的延续和巩固。其中，谢永林将出任集团总经理，兼任联席CEO，对公司而言，可有效解决总经理岗位与联席CEO机制之间存在的职责交叉和重叠问题，能够进一步提高决策和执行效率，使分工更清晰、责任更明确、协同更有力，符合“联席CEO+职能执行官”集体决策机制运作需要。监事长孙建一：谢永林身兼数职是合适的，任汇川各项工作均取得优良成果在此次调整后，任汇川将出任中国平安副董事长，而谢永林则同时担任集团总经理兼联席CEO、平安银行董事长，还是集团党委副书记。这样的安排是如何考虑的？中国平安创始人之一、刚刚卸任中国平安副董事长转任监事长的孙建一指出，任汇川和谢永林目前都是50岁左右，年富力强、经验丰富、精力充沛。他们都是大学毕业就加入平安，从基层、前线一步一个脚印历练、成长起来的干部，拥有丰富的基层实战经验、优秀的经营管理能力和业务水平。20多年来，两人先后在不同业务单位、不同岗位上轮岗工作，积累了丰富的经营管理经验。","情感倾向是积极的。"
"2019-10-24 18:52:43","中国平安寿险代理人今年削减了17.2万人：寿险销售模式要变天？","24日，中国平安(601318.SH，02318.HK)公告，截至2019年9月30日，9个月期间，中国平安实现归属于母公司股东的营运利润1040.61亿元，同比增长21.5%；归属于母公司股东的净利润1295.67亿元，同比增长63.2%。在保险业务方面，2019年前三季度，中国平安主动调整产品结构，推动高价值高保障产品销售，寿险及健康险业务实现营运利润691.04亿元，同比增长30.5%；新业务价值588.05亿元，同比增长4.5%，主要原因是新业务价值率提升的贡献，新业务价值率同比上升5.3个百分点至48.1%。但值得注意的是，截至9月末，平安寿险代理人数量124.5万人，较年初下降12.1%，较6月末下降3.2%，也就是说，从年初到现在，平安的寿险代理人队伍已经削减了超过17万人。在中国保险行业过去近30年的发展历程中，保险代理人制度至关重要。早在1992年，美国友邦保险公司最先将个人保险代理人制度引入到中国，一举打破了此前的保险销售体制。1994年，中国平安从中国台湾地区引入“个人保险营销制度”，在全国范围内开展个人寿险业务，由此，保险代理人制度在中国开始了长达20余年的人身险销售的“统治地位”。国内最大的两家寿险公司，平安人寿个人业务的保费收入中，代理人渠道占比88%；中国人寿的保费收入中，个险渠道占比76%。但代理人制度走到今天已显现疲态，从2017年开始，保险代理人产能徘徊不前，即便是将保险代理人制度发挥到极致的中国平安，也出现了同样的问题。此前，中国平安副董事长孙建一在接受第一财经记者采访时认为，该制度引入之初是伴随弊端的，“但适合当时那个阶段的发展需求，所以寿险行业依靠代理人制度实现了快速发展。”他说。“今年，平安代理人队伍几乎没有增加，因为我们正在对代理人队伍进行调整。”孙建一说，一方面，科技手段的进步必然会取代一部分代理人，但至于会取代到什么程度还有待观察；而另一方面，代理人队伍本身如何优化至关重要，其中，一个重要的工作就是如何提高素质，提高产能，发挥综合金融的优势，提高代理人的收入。从中国平安的业绩报告也可看出，虽然寿险代理人队伍在减少，但前三季度代理人人均个险新保单件数为1.39件/月，同比增长了9.4%。对此，中国平安表示，平安寿险的代理人渠道通过升级业务人员基本管理办法，聚焦选才增优、绩优培养、团队发展，同时严格执行考核清退政策，夯实代理人队伍质量。未来，平安寿险将继续坚持“有质量的人力发展”策略，通过科技赋能，持续推动代理人渠道转型升级。另外，前三季度，保险资金投资组合年化净投资收益率4.9%；受资本市场回暖带动投资收益同比增加的影响，年化总投资收益率6.0%。同时，董事会决议通过，中国平安拟合资设立全国性科技型消费金融公司，但有关事项尚待履行相关监管审批程序。","情感倾向是积极。"
"2019-10-24 18:47:33","中国平安人事大调整！任汇川接任副董事长 谢永林兼任总经理！平安在下一盘什么棋？解密四大变动看点","中国平安公布了近年来最大规模的一次高管调整方案。10月24日，中国平安审议并通过了有关部分董事、监事及高级管理人员调整的议案。相关公告显示，孙建一出任平安集团监事会主席，谢永林、陈心颖接替孙建一、蔡方方出任公司执行董事，任汇川接任副董事长，谢永林兼任总经理。此次调整，意味着平安进一步完善了“联席CEO+职能执行官”集体决策机制，人才队伍趋向于年轻化、专业化。步入第四个十年，平安正在深化“金融+科技”、“金融+生态”的改革战略。有分析认为，日趋完善的顶层设计，将带领平安穿越改革深水区，夯实 “金融科技领先者”的地位。完善“联席CEO+职能执行官”机制平安此次组织架构调整，呈现出四大看点。第一，陈心颖、谢永林进入平安集团执行董事序列，联席CEO在董事会决策中的分量进一步增加。第二，谢永林兼任联席CEO与集团总经理，有效解决了平安总经理岗位与联席CEO机制之间存在的职责交叉和重叠问题，进一步提高决策和执行效率。第三，任汇川担任平安集团副董事长。此前，该职位由平安元老孙建一担任。券商中国记者了解到，由于孙建一今年已66岁，卸任公司董事和高管职务，转而担任监事会主席，一方面，有利于平安高管团队稳定交接；另一方面，孙建一作为创始元老，经验丰富，有利于为平安的长远发展保驾护航。而在少壮派高管中，任汇川最早加入平安，历任平安执行董事、总经理、副总经理、首席保险业务执行官等重要管理职务，对公司治理、资本市场和公司各项业务非常熟悉。担任副董事长，有利于推动平安“金融+科技”、“金融+生态”等重大战略发展。第四，三位联席CEO负责的业务板块并没有改变。谢永林、李源祥、陈心颖分别统筹公司、个人、科技业务，保证了集团业务与高管队伍的整体稳定。在过去十年中。平安立足于“一个客户、一个账户、多种产品、一站式服务”的综合金融经营模式，逐步形成了“个人业务+公司业务+科技业务”三大事业群及架构。2019年中报显示，平安三大业务增长速度不断加快。其中，个人业务营运利润达665.76亿元，同比增长32.1%，占集团归母营运利润的90.6%；科技业务总收入384.31亿元，同比增长33.6%。要保持三大业务线增长，需要打造更完善的管理矩阵。因此，平安于2018年设立“联席CEO+职能执行官”集体决策机制。该机制实施近一年来，有力推动了平安的经营管理和业绩水平，三大事业群的结构日趋完善。实践证明，“联席CEO+职能执行官”集体决策机制适宜在平安行之有效。券商中国记者获悉，本轮高管岗位调整，是对“联席CEO+职能执行官”集体决策机制的巩固和完善。业界分析认为，这将进一步提升核心管理层的决策和执行效率，为平安战略转型及三大业务线发展提供强有力的组织保障。","情感倾向是积极。"
