"Date","Title","Content","qwen_lora2_情绪提取"
"2019-08-29 15:35:20","中国电力建设股份有限公司第三届董事会第十七次会议决议公告","证券代码：601669 股票简称：中国电建公告编号：临2019-054本公司董事会及全体董事保证本公告内容不存在任何虚假记载、误导性陈述或者重大遗漏，并对其内容的真实性、准确性和完整性承担个别及连带责任。中国电力建设股份有限公司(以下简称“公司”)第三届董事会第十七次会议于2019年8月27日以现场会议方式在北京市海淀区车公庄西路22号海赋国际大厦召开。会议通知已于2019年8月17日以电子邮件和书面方式送达各位董事。本次会议应到董事9人，实到董事8人，独立董事徐冬根因工作原因不能出席会议，委托独立董事栾军出席并代为表决。公司董事会秘书，部分监事、高级管理人员列席了本次会议。本次会议的召开符合《中华人民共和国公司法》等法律法规及规范性文件以及《中国电力建设股份有限公司章程》的规定。本次会议由董事长晏志勇主持，经与会董事充分审议并经过有效表决，审议通过了以下议案：一、审议通过了《关于中国电力建设股份有限公司2019年半年度报告及其摘要的议案》。表决情况：9票同意，0票弃权，0票反对。公司2019年半年度报告及其摘要的详细内容请详见与本公告同时刊登的《中国电力建设股份有限公司2019年半年度报告》、《中国电力建设股份有限公司2019年半年度报告摘要》。二、审议通过了《关于中国电力建设股份有限公司2019年半年度募集资金存放与使用情况的专项报告的议案》。表决情况：9票同意，0票弃权，0票反对。相关内容请详见与本公告同时刊登的《中国电力建设股份有限公司2019年半年度募集资金存放与实际使用情况的专项报告》。三、审议通过了《关于中国电力建设股份有限公司执行新金融工具准则相关会计政策变更的专项报告的议案》表决情况：9票同意，0票弃权，0票反对。2017年，财政部先后修订发布了《企业会计准则第22号——金融工具确认和计量》《企业会计准则第23号——金融资产转移》《企业会计准则第24号——套期会计》(以下简称“新金融工具准则”)。按照财政部通知要求，公司作为境内上市企业应于2019年1月1日起执行上述3项新金融工具准则。董事会认为公司本次执行新金融工具准则是根据财政部颁布的相关会计准则规定对会计政策进行的合理变更和调整，符合财政部的相关规定；本次公司执行新金融工具准则，对公司财务状况、经营成果和现金流无重大影响。董事会同意公司按照财政部通知要求，于2019年1月1日起执行上述3项新金融工具准则。公司独立董事认为执行新金融工具准则符合财政部的相关要求，能够更加客观、公允地反映公司的财务状况和经营成果，不存在损害公司利益及中小股东合法权益的情况，公司董事会审议本次会计政策变更的程序符合有关法律、法规的规定，同意公司本次相关会计政策的变更。特此公告。中国电力建设股份有限公司董事会二一九年八月二十九日","该文本情感是积极的。"
"2019-08-29 14:42:38","中国电力建设股份有限公司第三届监事会第九次会议决议公告","证券代码：601669 股票简称：中国电建公告编号：临2019-055本公司监事会及全体监事保证本公告内容不存在任何虚假记载、误导性陈述或者重大遗漏，并对其内容的真实性、准确性和完整性承担个别及连带责任。中国电力建设股份有限公司(以下简称“公司”)第三届监事会第九次会议于2019年8月27日以现场会议方式在北京市海淀区车公庄西路22号海赋国际大厦召开。会议通知已于2019年8月16日以书面形式送达各位监事。会议应到监事5人，实到监事5人。本次会议的召开符合《中华人民共和国公司法》等法律法规及规范性文件以及《中国电力建设股份有限公司章程》的规定。本次会议由监事会主席雷建容主持，经与会监事充分审议并有效表决，审议通过如下议案：一、审议通过了《关于中国电力建设股份有限公司2019年半年度报告及其摘要的议案》。表决情况：5票同意，0票弃权，0票反对。监事会认为：报告的编制和审核程序符合中国证券监督管理委员会和上海证券交易所的有关规定以及《中国电力建设股份有限公司章程》及内部管理制度的规定；报告内容真实、客观、准确地反映了公司的财务状况和经营成果。二、审议通过了《关于中国电力建设股份有限公司2019年半年度募集资金存放与使用情况的专项报告的议案》。表决情况：5票同意，0票弃权，0票反对。三、审议通过了《关于中国电力建设股份有限公司执行新金融工具准则相关会计政策变更的专项报告的议案》。表决情况：5票同意，0票弃权，0票反对。特此公告。中国电力建设股份有限公司监事会二一九年八月二十九日","该文本情感是中性的。"
"2019-08-29 13:09:41","中国电力建设股份有限公司 2019年半年度募集资金存放与实际使用情况的专项报告","证券代码：601669 股票简称：中国电建公告编号：临2019-056本公司董事会及全体董事保证本公告内容不存在任何虚假记载、误导性陈述或者重大遗漏，并对其内容的真实性、准确性和完整性承担个别及连带责任。一、募集资金基本情况经中国电力建设股份有限公司(以下简称“公司”)于2016年5月9日召开的第二届董事会第五十八次会议、2016年7月29日召开的2016年第二次临时股东大会审议通过，并经国务院国有资产监督管理委员会2016年7月12日出具的《关于中国电力建设股份有限公司非公开发行A股股票有关问题的批复》(国资产权[2016] 694号)以及中国证券监督管理委员会2017年4月6日核发的《关于核准中国电力建设股份有限公司非公开发行股票的批复》(证监许可[2017] 85号)的核准，截至2017年4月18日，公司实际非公开发行人民币普通股(A股)1,544,401,540股，每股面值人民币1元，每股发行价格为人民币7.77元，募集资金总额为人民币11,999,999,965.80元，扣除发行费用人民币99,574,439.88元，本次非公开发行(A股)实际募集资金净额为人民币11,900,425,525.92元。上述募集资金到位情况已经中天运会计师事务所(特殊普通合伙)验证，并出具中天运[2017]验字第90031号验资报告。截至报告期末，公司本年度共使用募集资金总额人民币31,706.90万元，累计使用募集资金总额人民币1,133,714.45万元；尚未使用募集资金余额人民币62,235.48万元(包含募集资金银行存款利息收入扣除银行手续费支出后的净额人民币5,907.38万元)；募集资金银行专户余额人民币62,263.48万元，与尚未使用募集资金余额差异人民币28.00万元，系尚未支付的部分发行费用。二、募集资金管理情况(一)《募集资金管理制度》的制定和执行情况为规范募集资金的管理和使用，公司依据《首次公开发行股票并上市管理办法》、《关于进一步规范公司募集资金使用的通知》、《上海证券交易所股票上市规则》等法律法规和规范性文件制定了《中国水利水电建设股份有限公司募集资金管理制度》(以下简称“《募集资金管理制度》”)，对公司募集资金的存放、使用及监督等方面做出了具体明确的规定。《募集资金管理制度》经公司2010年度第二次临时股东大会审议通过。2012年5月和2013年5月，公司分别对《募集资金管理制度》进行了两次修订，修订的《募集资金管理制度》已经公司股东大会审议通过。2014年7月，公司对《募集资金管理制度》予以改版，变更名称为《中国电力建设股份有限公司募集资金管理制度》。公司一直严格按照《募集资金管理制度》的规定存放、使用、管理募集资金，募集资金的存放、使用、管理均不存在违反《募集资金管理制度》和《上海证券交易所上市公司募集资金管理规定》的情形。(二)募集资金在各银行账户的存储和第三方监管情况","该文本情感是中性的。"
"2019-08-29 01:54:29","中国电建大力开拓国际市场 上半年营业收入稳步增长","8月28日晚间，中国电建(601669，SH)发布了2019年半年度报告，报告显示，2019年上半年中国电建的营业收入为1472.84亿元，较上年同期增长了16.34%。实现利润总额68.17亿元，同比增长8.19%。此外，2019年半年报显示，报告期内中国电建共计完成新签合同3027.03亿元，同比增长15.80%，完成年度计划的61.40%。对于2019年半年报所显示的经营情况，中国电建表示，报告期内，公司大力开拓市场、加快结构调整、加速转型升级、着力提质增效，继续保持了平稳较快的增长势头。主营业务营业收入稳定增长中国电建2019年半年度报告显示，其主营业务收入：工程承包与勘测设计、电力投资与运营等业务同比上期都实现了增长。其中，在工程承包与勘测板块方面，2019年上半年的营业收入为1168.54万元，较上期增长了13.25%，占主营业务收入79.78%；毛利率11.63%，较上年同期的11.42%增加0.21个百分点。对此，中国电建在报告中表示，该板块营业收入持续增长主要原因是水资源与环境、基础设施工程等非传统业务规模稳步攀升。实际上，2019年上半年内，中国电建新签了基础设施业务合同1211.31亿元，中标广州(新塘)至汕尾铁路工程站前工程施工总价承包GSSG5标段(25.21亿元)、深圳机场卫星厅配套站坪工程施工(21.50亿元)以及尼日利亚新月岛填海造地和高架桥梁工程项目(18.93亿美元)等，令基础设施业务持续扩大。而在电力投资与运营板块方面，中国电建继续保持了行业领军地位，2019年半年报显示，电力投资与运营板块实现了营业收入82.25亿元，同比增长23.80%。报告期内，中国电建新增了控股运营装机容量40.94万千瓦，累计投运控股装机容量是1389.44万千瓦，其中水电545.59万千瓦、火电293.00万千瓦、风电452.05万千瓦、光伏发电98.80万千瓦，清洁能源占比达到78.91%。截至报告期末，累计投运和在建的装机容量达1599.44万千瓦。此外，在水环境治理业务方面，中国电建披露取得了新进展，2019年上半年，中国电建水环境治理业务中标签约东莞市石马河流域综合治理项目、龙岗区龙岗河流域、观澜河流域消除黑臭及河流水质保障工程等重大项目，水环境业务中标金额合计549.35亿元。毛利率提升境外业务稳步扩张中国电建在其2019年第一季度报告中就披露了国外订单量同比增长。而在刚刚披露的2019年半年报中，大力开拓国际市场的中国电建披露的境外业务情况，再次显示出了增长。2019年上半年，中国电建实现了境外业务收入341.68亿元，同比增长17.45%，占主营业务收入的23.33%。此外，境外业务的毛利率也较上期增加了1.49个百分点，增至14.63%。对于这一增长，中国电建表示境外业务收入增长的主要原因是境外工程承包业务、电力投资与运营业务增长。","积极。"
"2019-08-28 20:18:08","中国电建：上半年净利39.59亿元 同比降2.42%","中国电建(601669)8月28日晚间披露半年报，公司2019年上半年实现营业收入1472.84亿元，同比增长16.34%；净利润39.59亿元，同比下降2.42%；每股收益0.26元。公司作为全球水电、风电建设的引领者，稳固保持全国80%以上的大中型水电项目前期规划、勘测和设计工作、全国65%以上水电建设、全球50%以上大中型水利水电建设市场份额。","情感倾向是积极。"
"2019-08-26 10:12:30","中国电建签约波兰公路项目","近日，中国电建市政公司签约波兰S14罗兹西部绕城快速路设计与施工项目。该项目是中国企业10年来首次在波兰获签的公路建设项目，这对中波两国基础建设合作意义重大。S14罗兹西部绕城快速路位于波兰第三大城市——罗兹省省会罗兹市，工期35个月。","情感倾向是中性。"
"2019-08-14 10:35:03","中国电建旗下公司未按标准监理施工质量被广州住建点名","广州市住房和城乡建设局发布的信息显示，中国水利水电建设工程咨询中南有限公司的监理项目存在不良行为，涉及的项目是广州市轨道交通十一号线及同步实施工程总承包项目一分部土建工程，存在的问题是未依照法律、法规以及有关技术标准、设计文件和建设工程承包合同对施工质量实施监理。天眼查显示，中国水利水电建设工程咨询中南有限公司是国电建集团中南勘测设计研究院有限公司的全资子公司，而后者隶属于A股上市公司中国电建。","该文本情感是中性的。"
"2019-08-01 21:44:10","中国电建子公司签署65亿元坦桑尼亚水电站项目分包合同","8月1日，中国电力建设股份有限公司(下称“中国电建”，601669)公告披露，近日，公司下属间接持股100%的全资子公司——中国水电建设集团国际工程有限公司(下称“中国水电国际”)与两家埃及公司组成的联营体签订了坦桑尼亚鲁富吉水电站项目的分包合同，合同金额为9.69亿美元，折合人民币约65.14亿元。公告显示，中国水电国际与坦桑尼亚鲁富吉水电站项目EPC总承包商阿拉伯承包商公司及爱思瓦迪电气公司两家埃及公司组成的联营体签订了坦桑尼亚鲁富吉水电站项目的分包合同。该项目位于坦桑尼亚鲁菲吉河流下游，距离印度洋入海口东约230km，距坦赞铁路FUGA站约35km。主要工程内容包括设计和主坝、引水系统、溢洪道、导流洞、金结、临时道路、50%承包商营地等施工工作。项目工期为42个月。这是今年中国水电国际签署的第三个重大工程合同。据中国电建3月1日公告披露，中国水电国际与塞内加尔河流域开发组织(OMVS)签署了几内亚库库坦巴水电站项目的EPC总承包合同，合同金额为8.13亿美元，折合人民币约54.42亿元。据中国电建7月16日公告披露，中国水电国际与印尼卡扬水电能源公司签署了印尼卡扬水电站项目商务合同，合同金额为13.64亿美元，折合人民币约91.80亿元。中国电建是全球能源电力、水资源与环境、基础设施及房地产领域提供全产业链集成、整体解决方案服务的综合性特大型建筑集团。经国务院批准，于2011年9月29日在中国水利水电建设集团公司、中国水电工程顾问集团公司和国家电网公司、中国南方电网有限责任公司所属的14个省(市、区)电力勘测设计、工程、装备制造企业基础上组建的国有独资公司。中国电建的主营业务跨越能源电力及大土木、大建筑多行业，纵向覆盖投资开发、规划设计、工程承包、装备制造等工程建设全过程。此外，受国家有关部委委托，承担了国家水电、风电、太阳能等清洁能源和新能源的规划、审查等职能。","该文本情感是中性的。"
"2019-08-01 18:30:30","中国电建：子公司联合体签订65亿元水电站合同","中国电建(601669)8月1日晚公告，近日，公司下属间接持股100%的全资子公司中国水电建设集团国际工程有限公司，与坦桑尼亚鲁富吉水电站项目EPC总承包商阿拉伯承包商公司及爱思瓦迪电气公司等两家埃及公司组成的联营体签订了坦桑尼亚鲁富吉水电站项目的分包合同，合同金额为9.69亿美元，折合人民币约65.14亿元。项目工期为42个月。","情感倾向是中性。"
"2019-07-23 09:12:19","中国电力建设股份有限公司第三届董事会第十六次会议决议公告","证券代码：601669 股票简称：中国电建公告编号：临2019-050中国电力建设股份有限公司第三届董事会第十六次会议决议公告本公司董事会及全体董事保证本公告内容不存在任何虚假记载、误导性陈述或者重大遗漏，并对其内容的真实性、准确性和完整性承担个别及连带责任。中国电力建设股份有限公司(以下简称“公司”)第三届董事会第十六次会议于2019年7月19日以通讯方式召开。会议通知和会议议案等资料已以电子邮件和书面方式送达全体董事。本次会议应参与表决董事9人，实际参与表决董事9人。本次会议的召开符合《中华人民共和国公司法》等法律法规及规范性文件以及《中国电力建设股份有限公司章程》的规定。经有效表决，会议审议通过了《关于中国电建集团航空港建设有限公司股权变更事项的议案》。董事会同意公司下属间接持股100%的全资子公司中国电建集团航空港建设有限公司的股权结构由公司及公司全资子公司中国水利水电第十六工程局有限公司、中国电建集团华东勘测设计研究院有限公司分别持股30%、50%、20%变更为上述股东分别持股51%、29%、20%。表决情况：9票同意，0票弃权，0票反对。特此公告。中国电力建设股份有限公司董事会二〇一九年七月二十三日","该文本情感是积极的。"
"2019-07-18 13:30:38","中国电力建设股份有限公司2018年年度权益分派实施公告","证券代码：601669 证券简称：中国电建公告编号：2019-049中国电力建设股份有限公司2018年年度权益分派实施公告本公司董事会及全体董事保证本公告内容不存在任何虚假记载、误导性陈述或者重大遗漏，并对其内容的真实性、准确性和完整性承担个别及连带责任。重要内容提示：每股分配比例A股每股现金红利0.09782元(含税)相关日期差异化分红送转： 是一、 通过分配方案的股东大会届次和日期本次利润分配方案经中国电力建设股份有限(以下简称“公司”)2019年5月28日的2018年年度股东大会审议通过。二、 分配方案(一) 发放年度：2018年年度(二) 分派对象：截至股权登记日下午上海证券交易所收市后，在中国证券登记结算有限责任公司上海分公司(以下简称“中国结算上海分公司”)登记在册的公司全体股东。根据《公司法》、《证券法》、《上海证券交易所上市公司回购股份实施细则》等法律、法规、规范性文件及《公司章程》的有关规定，公司存放于回购专用证券账户的股份不参与利润分配。(三) 差异化分红送转方案：","该文本情感是积极的。"
"2019-07-17 13:59:51","中国电力建设股份有限公司关于股份回购实施完成的公告","证券代码：601669 股票简称：中国电建公告编号：临2019-046中国电力建设股份有限公司关于股份回购实施完成的公告本公司董事会及全体董事保证本公告内容不存在任何虚假记载、误导性陈述或者重大遗漏，并对其内容的真实性、准确性和完整性承担个别及连带责任。中国电力建设股份有限公司(以下简称“公司”)于2018年12月27日召开第三届董事会第九次会议、2019年1月17日召开2019年第一次临时股东大会、2019年3月13日召开第三届董事会第十次会议，会议审议通过了《关于中国电力建设股份有限公司以集中竞价交易方式回购股份的议案》、《关于修订中国电力建设股份有限公司回购股份预案的议案》等相关议案，公司于2019年3月15日披露了《中国电力建设股份有限公司关于以集中竞价交易方式回购股份的回购报告书》，于2019年3月16日披露了《中国电力建设股份有限公司关于以集中竞价交易方式首次回购公司股份的公告》，具体内容详见公司于2018年12月28日、2019年1月18日、2019年3月15日、2019年3月16日刊登的相关公告。根据公司股份回购方案，截至2019年7月16日，公司股份回购已实施完毕，现将有关事项公告如下：一、回购方案基本情况本次回购股份比例不低于当前公司普通股总股本的1%(15,299.04万股)，且不超过当前公司普通股总股本的2%(30,598.07万股)；回购价格不超过人民币5.90元/股，回购资金总额不超过人民币18.05亿元；回购实施期限为自公司股东大会审议通过回购股份议案之日起不超过6个月；本次回购股份拟用于转换公司发行的可转换为股票的公司债券、员工持股计划及股权激励。二、回购实施情况(一)2019年3月15日，公司以集中竞价交易方式实施了首次回购股份，首次回购股份数量为974,502股，占公司目前总股本的比例为0.01%，购买的最高价为5.84元/股，购买的最低价为5.77元/股，已支付的资金总额为5,649,037.58元(不含印花税、佣金等交易费用)。(二)截至2019年7月16日，公司回购股份方案已实施完毕。公司通过集中竞价交易方式累计回购股份数量为152,999,901股，占公司目前总股本的比例为1%，购买的最高价为5.84元/股，购买的最低价为4.86元/股，已累计支付的资金总额为788,277,794.16元(不含印花税、佣金等交易费用)。(三)公司本次回购方案的实际执行情况与股东大会审议通过的回购股份方案不存在差异，公司已按披露的方案完成回购。(四)本次股份回购方案的实施对公司的影响本次回购不会对公司经营活动、盈利能力、财务状况、研发和未来发展产生重大影响，不会损害公司的债务履行能力和持续经营能力，不会影响公司的上市地位。三、回购期间相关主体买卖股票情况2018年12月28日，公司首次披露了回购股份预案，详见公司临2018-067号公告。经公司内部核查，在公司首次披露回购股份预案之日至本公告披露前，公司控股股东、董事、监事、高级管理人员在此期间不存在买卖公司股票的情况。四、已回购股份的处理安排根据公司股份回购方案，公司本次回购股份拟用于转换公司发行的可转换为股票的公司债券、员工持股计划及股权激励。其中已回购股份数量的50%用于转换公司发行的可转换为股票的公司债券，25%用于员工持股计划，25%用于股权激励，已回购股份将优先用于转换公司发行的可转换为股票的公司债券。公司未来可根据实际情况对本次回购股份的用途进行调整。","该文本情感是积极的。"
"2019-07-17 12:26:51","中国电力建设股份有限公司关于参加北京辖区上市公司投资者集体接待日的公告","证券代码：601669 股票简称：中国电建公告编号：临2019-048中国电力建设股份有限公司关于参加北京辖区上市公司投资者集体接待日的公告本公司董事会及全体董事保证本公告内容不存在任何虚假记载、误导性陈述或者重大遗漏，并对其内容的真实性、准确性和完整性承担个别及连带责任。为进一步加强与广大投资者的沟通交流，中国电力建设股份有限公司(以下简称“公司”)将参加由北京上市公司协会、上证所信息网络有限公司共同举办的“2019年北京辖区上市公司投资者集体接待日”活动，现将有关事项公告如下：本次集体接待日活动将在上证所信息网络有限公司提供的网上平台，采取网络远程的方式举行，投资者可以登录“上证路演中心”网站(http://roadshow.sseinfo.com)或关注微信公众号：上证路演中心，参与本次投资者集体接待日活动，活动时间为2019年7月18日(星期四)15:00至17:00。届时公司的总会计师孙璀先生、董事会秘书丁永泉先生将通过网络在线交流形式与投资者就公司治理、发展战略、经营状况、融资计划、股权激励和可持续发展等投资者关注的问题进行沟通。欢迎广大投资者积极参与。中国电力建设股份有限公司董事会二〇一九年七月十七日","该文本情感是中性的。"
"2019-07-16 17:15:34","中国电建：子公司签署91.8亿元印尼水电站项目合同","7月16日，中国电建发布公告称，全资子公司中国水电建设集团国际工程有限公司与印尼卡扬水电能源公司签署了印尼卡扬水电站项目商务合同，合同金额91.8亿元。截至收盘，中国电建报5.10元，涨0.20%。","该文本情感是积极的。"
