"Date","Title","Content","qwen_lora2_情绪提取"
"2019-12-28 18:34:05","中国电建与中国大唐签署战略合作协议","12月27日，中国电建党委书记、董事长晏志勇与中国大唐集团有限公司党组书记、董事长陈飞虎就发挥各自资源优势、推动合作共赢展开会谈。会谈结束后，双方签署了战略合作协议。","该文本情感是中性的。"
"2019-12-23 19:24:08","中国电建：下属企业拟参设广德中电建舜昭投资合伙企业","中国电建(601669)12月23日晚间公告，为进一步优化资本结构，公司下属合营企业中电建(北京)基金管理有限公司(简称“电建基金”)、公司下属控股子公司中国水利水电第十四工程局有限公司(简称“水电十四局”)共同发起设立广德中电建舜昭投资合伙企业(有限合伙)。基金出资认缴总规模为12.001亿元人民币，其中，电建基金认缴出资10万元人民币，为普通合伙人；水电十四局认缴出资12亿元人民币，为有限合伙人。该基金通过股权投资的方式专项投资于宜宾至昭通高速公路彝良(川滇界)至昭通段PPP项目。公司表示，基金的设立有利于提升水电十四局投融资能力，促进宜宾至昭通高速公路彝良(川滇界)至昭通段PPP项目更好地实施。","情感倾向是中性。"
"2019-12-20 15:48:54","中国电建与烟台市人民政府、中国建设科技集团签署战略合作协议","记者从中国电建获悉，12月18日，中国电建与烟台市政府、中国建设科技集团战略合作协议签约仪式在烟台举行。三方将建立全方位、宽领域、深层次的战略合作机制。中国电建与中国建设科技集团将发挥勘察设计、投资建设、技术资质和人才等多方面的优势，投入到烟台高质量建设发展中。","该文本情感是中性的。"
"2019-12-17 18:33:52","中国电建前11个月新签合同额同比增近6%","中国电建公告，2019年1月至11月，公司新签合同总额约为4501.33亿元，同比增长5.95%。前述新签合同总额中，国内新签合同额约为3337.64亿元，同比增长12.51%；国外新签合同额折合人民币约为1163.69亿元，同比减少9.24%。国内外水利电力业务新签合同额合计约为1330.17亿元。","情感倾向是中性。"
"2019-12-17 17:32:11","中国电建：1-11月新签合同总额4501.33亿元 同比增长5.95%","中国电建(601669)12月17日晚公告，2019年1月至11月，公司新签合同总额约为4501.33亿元，同比增长5.95%。其中，国内新签合同额约为3337.64亿元，同比增长12.51%；国外新签合同额折合人民币约为1163.69亿元，同比减少9.24%。国内外水利电力业务新签合同额合计约为1330.17亿元。","以上文本情感是中性的。"
"2019-12-17 16:46:25","中国电建：前11个月新签合同额同比增长5.95%","中国电建(601669)12月17日晚公告，2019年1月至11月，公司新签合同总额约为4501.33亿元，同比增长5.95%。前述新签合同总额中，国内新签合同额约为3337.64亿元，同比增长12.51%；国外新签合同额折合人民币约为1163.69亿元，同比减少9.24%。国内外水利电力业务新签合同额合计约为1330亿元。","该文本情感是积极的。"
"2019-12-10 15:17:57","中企在澳大利亚用“绿色力量”打造清洁能源","广袤的澳大利亚塔斯马尼亚中央高地，除了成群的牛羊，一座座风机格外引人注目。这是中国电建投资兴建的风电项目。“我们整个家族都在这里以放牧黑牛为生，所以叫它‘牧牛山’，这里有着丰富的风力资源。20多年前，我们家族就想在这里建设一座风电场，实现绿色可再生能源的自给自足。”60岁的农场主皮特唐尼说。牧牛山风电项目的投资建设，正在完成唐尼家族的夙愿。对于中国电建来说，这也是他们进入发达国家开展新能源投资业务的首个项目。首批风机12月6日并网发电，项目全部投产后年均上网发电量约4.4亿度，运营期20年。可为塔州提供5%的电力，为63500户家庭提供优质的清洁能源。作为中国电建专业从事海外投资业务的法人主体，电建海投公司成立7年来，已拥有8个投产项目，4个在建项目，10多个前期项目。牧牛山风电项目是中国电建进入发达国家开展可再生能源业务的首个“先行先试”项目，总投资约3.3亿澳元。中国电建海投公司董事长盛玉明告诉中新社记者，首机并网发电具有里程碑意义。澳大利亚对项目监管、资质审查、环境保护等都有严格的标准，项目开展实为不易。两国建设者秉承“共商、共建、共享”精神，精诚合作、携手共进，实现了项目的建成。塔斯马尼亚是澳大利亚唯一的岛州，约40%的面积被列为国家公园、自然保护区或世界自然遗产。楔尾鹰是塔州的濒危物种。记者了解到，为了保护楔尾鹰，公司从美国引进世界上最先进的鹰类监控保护系统，可通过360度全景摄像头及中央分析单元在几秒钟内完成项目附近楔尾鹰图像的捕捉、识别、预警等一系列动作，紧急情况下可通过通信系统自动停止风机运行来避免鸟类碰撞。对于中国企业在牧牛山投资兴建风电项目，当地政府、民众给予支持和好评。在首机并网发电仪式现场，塔州能源部长盖伊巴尼特代表塔州政府为中国电建海投公司颁发“嘉许状”，表彰其为塔州新能源发展作出的贡献。他说，项目实现了澳大利亚与中国在能源领域的合作共赢，推动2022年前塔州全岛可再生能源发电占比达到100%的目标实现，为澳大利亚清洁能源项目开发与建设树立了标杆。","情感倾向是积极。"
"2019-12-03 17:57:28","中国电建：5.37亿元认购上海临港定增股份","中国电建(601669)12月3日晚公告，上海临港(600848)非公开发行的发行对象最终确定为9名投资者，其中，公司认购2239.84万股、认购金额为5.37亿元、认购价格为23.98元/股，认购股份的限售期为自发行结束之日起12个月。","情感倾向是中性。"
"2019-11-25 19:17:37","中国电建与临港集团签订深化合作框架协议","11月25日，中国电建党委书记、董事长晏志勇在京会见到访的上海临港经济发展(集团)有限公司党委书记、董事长刘家平一行，双方就进一步加强合作展开友好会谈，并签署有关深化合作框架协议。","该文本情感是积极的。"
"2019-11-21 13:41:57","中国电建设计的全球最大超重力实验室开工建设","11月21日，新京报记者自中国电建华东院获悉，由华东院承担设计的国家重大科技基础设施——超重力离心模拟与实验室装置(CHIEF)项目正式开工建设。华东院表示，将与科学家团队、指挥部和各参建方通力合作、攻坚克难，以百倍努力与各方共同圆满完成工程建设的各项任务。CHIEF是“十三五”确定的十个国家重大科技基础设施之一，是推动国家科学和技术发展的“国之重器”，也是在浙江省建设的首个国家重大科技基础设施。项目总用地面积89亩，总建筑面积34560平方米，大约相当于六个标准足球场。建设周期5年，建成后将填补我国超大容量超重力机的空白，成为全球容量最大、应用范围最广的超重力多学科开放共享实验平台。华东院承担设计的超重力离心模拟与实验装置的核心是深达27米的地下空间，其呈一字形布局：中央舱体内离心机顺序排列，构成南北纵轴，大功率配电房与空调机房各据左右，构成东西横轴，双动力系统由两侧宽阔管廊接入离心设备。未来，这个科技感+未来感爆棚的实验室里将迎来世界最大量级的超重力离心机。其中，6个超重力实验舱，将承担极端气候与环境模拟装置、超重力单向振动台、高压高温实验装置、高通量制备熔铸炉等18台机载装置，可以模拟各种极端气候、深海与深地环境。中国电建集团华东勘测设计研究院有限公司(以下简称“华东院”)1954年建院，名列中国勘察设计综合实力百强单位(排名第8位)、中国工程设计企业60强(排名第10位)，是中国最早成立的勘测设计院之一，为国家大型综合性甲级勘测设计研究单位，业务范围包括水电与新能源、城乡建设、生态与环境等领域。","该文本情感是积极的。"
"2019-11-14 16:14:15","中国电建：1-10月新签合同额同比增长4.55%","中国电建(601669)11月14日晚间公告，1月至10月，公司新签合同总额约为4144.18亿元，同比增长4.55%。","情感倾向是中性。"
"2019-11-11 16:50:00","中国电建：公司18个项目获“国家优质工程奖”","记者从中国电建获悉，近日，中国施工企业管理协会公布了2018-2019年度第二批“国家优质工程奖”入选名单，公司18项工程榜上有名。截至目前，公司已获得“国家优质工程金质奖”51项、“国家优质工程奖”183项。","该文本情感是积极的。"
"2019-10-31 09:04:52","中国电建承建硬梁包水电站开工 总投资上百亿","10月31日，新京报记者自中国电建获悉，中国电建水电七局承建的四川华能大渡河硬梁包水电站开工建设。今年10月24日，四川省大渡河干流硬梁包水电站首部枢纽土建施工签字仪式在成都举行。华能四川公司党委书记、董事长刘兴国在签字仪式上讲话说，中国电建水电七局属于国有大型企业，行业水平处于国内领先地位，在地方具有较大的影响力。双方承诺确保项目顺利推进，在甘孜水电建设史上留下良好口碑。中国电建是国务院国有资产监督管理委员会直接管理的中央企业，旗下的中国水利水电第七工程局有限公司总资产超过三百亿元，现已发展成为集施工、设计、科研、投资、电力生产与销售、水电机组安装与维修、机械设备制造与加工等多产业于一体的大型中央在川骨干企业。四川省政府官网显示，早在2016年1月28日，四川省政府常务会议审议通过大渡河硬梁包水电站核准。硬梁包水电站位于甘孜州泸定县境内，为大渡河干流梯级调整规划28级开发方案中的第14级，该电站以发电为主，并促进地方经济社会发展。电站总装机容量111.6万千瓦，与上游两河口水库电站联合运行时年均发电量51.42亿千瓦时，具有日调节能力。工程静态投资129.40亿元，动态总投资160.98亿元。据悉，硬梁包水电站建设符合我国能源发展和节能减排战略要求，符合国家电力发展规划，对增加清洁能源供应，调整能源结构，增加地方税收和就业，对推动民族地区经济社会发展，拉动区域经济增长，促进社会稳定，特别是对当前促投资稳增长，具有重要意义。","情感倾向是积极。"
"2019-10-29 16:30:41","中国电建：前三季净利同比降3.85%","中国电建(601669)10月29日晚间发布三季报，公司2019年前三季度营业收入为2309.98亿元，同比增长18.18%；净利为58.18亿元，同比下降3.85%；每股收益0.36元。","以上文本情感是中性的。"
"2019-10-17 16:14:13","中国电建：前9月新签合同额3859亿元 同比增3%","中国电建(601669)10月17日晚间公告，2019年1月至9月，公司新签合同总额约为3859.36亿元，同比增长3.23%。","情感倾向是中性。"
"2019-09-17 16:39:09","中国电建租赁首期ABS成功发行","中国电建(601669)国君-电建租赁第1期资产支持专项计划(ABS)于2019年9月17日在上交所成功发行，本专项计划由电建租赁公司作为原始权益人，中国电建基金公司作为牵头协调人。通过该产品的成功发行，电建租赁实现了存量资产盘活，提高了资产周转率，拓宽了融资渠道，更好的服务和协同中国电建主业发展。该产品发行规模为10亿元，期限10年。截至发行日，优先级全场认购倍数高达3.09倍，优先级资产支持证券票面利率创2018年以来租赁行业同期限同类型产品发行利率新低，充分体现了各金融机构对电建租赁公司及产品的信心和认可。本产品为中国电建首单以融资租赁债权及其附属担保权益为基础资产，并由中国电建提供增信的资产证券化产品。近年来，电建租赁紧密围绕中国电建的战略发展定位，加快推动专业平台建设与业务转型升级，积极发挥战略协同作用，依托股东在国内外市场的品牌优势、专业优势和资金优势，不断探索专业化、规范化发展的经营模式。2018年，中共中央办公厅、国务院办公厅印发《关于加强国有企业资产负债约束的指导意见》等文件，明确鼓励国有企业开展资产证券化，在此政策背景下，中国电建自2018年12月成功发行首期约30亿元出表型资产证券化产品。截至目前，中国电建累计发行资产证券化产品规模约90亿元，历次发行的产品均获得市场各投资人的高度认可，并刷新同期同类产品票面利率新低。记者获悉，中国电建及电建基金公司正在加紧研究多单创新类资产证券化产品，将加快推动后续产品落地，以资产证券化为抓手，助推中国电建盘活存量资产，拓宽融资渠道，优化资本结构，助推中国电建提质增效转型升级，实现高质量发展。","情感倾向是积极。"
"2019-09-16 19:49:33","中国电建：前8月新签合同额3472亿元 同比微增","中国电建(601669)9月16日晚间公告，2019年1至8月，公司新签合同总额约3472.14亿元，同比增长0.09%。其中，国内新签合同额约2525.82亿元，同比增0.57%；国外新签合同额折合人民币约946.32亿元，同比减少1.16%。","该文本情感是中性的。"
"2019-09-12 14:33:58","中国电建：江西电建中标华能萝北200兆瓦风电场EPC总承包工程","中国电建消息，9月11日，江西电建公司成功中标华能黑龙江发电有限公司的萝北200兆瓦风电场EPC总承包工程项目，这是该公司承接的首个单体容量最大的风电EPC总承包项目。","所属情感是积极。"
"2019-09-11 10:14:33","中国电建：公司2019年应收账款资产证券化产品在上交所发行","中国电建消息，9月10日，“国君-中国电建2019年工程应收账款资产支持专项计划” 在上海证券交易所成功发行，期限3年，总规模36.25亿元，其中优先级34.43亿元，次级1.82亿元，是2019年至今同类单期发行规模最大的ABS产品。","情感倾向是积极的。"
"2019-09-10 16:40:48","中国电建2019年应收账款资产支持专项计划（ABS）圆满落地","中国电建2019年应收账款资产支持专项计划(ABS)圆满落地中国证券报记者从中国电建(601669)获悉，由电建集团作为原始权益人的国君-中国电建2019年工程应收账款资产支持专项计划(ABS)于9月10日在上海证券交易所成功发行，期限3年，总规模36.25亿元。截至发行日，产品规模创2019年内同类产品单期发行规模新高。本专项计划由电建旗下的电建基金作为牵头协调人，国泰君安资管作为计划管理人，国泰君安证券作为牵头销售机构，以及中信证券、招商证券作为联席销售机构，联手嘉源律所、天职国际会计师事务所以及中诚信评级等中介机构共同推动，实现产品落地。应收账款资产证券化是中国电建 “降杠杆”、“压两金”的重要举措和可持续路径选择。据悉，除应收账款资产证券化外，中国电建也在积极探索其他类型资产的证券化业务，进程不断加快，落地指日可待。电建集团总资产8500亿元，各类型资产丰富，证券化空间巨大。开展资产证券化，能够有效盘活中国电建的存量资产、减少无效占用、加快资金周转，本质上能够助力中国电建整体提质增效，实现高质量发展。经了解，当前中国电建资产证券化业务均由电建旗下的电建基金作为牵头协调人统筹执行。电建基金成立于2016年底，是中国电建“产融结合”和“金融创新”战略的重要实践者。电建基金立足电建集团主业，立志推动电建集团高质量发展。据悉，电建基金正在牵头加紧研究多单创新类资产证券化产品，拟充分利用资产证券化这一金融创新工具更好地服务电建，助力电建集团整体转型升级。","情感倾向是积极。"
"2019-09-09 14:38:47","助力电力发展 中国电建建设缅甸最大内燃机发电项目","“电压220伏、电流16安培、功率3000瓦，这是电力局颁发的用电许可，酒店几十台空调同时启动都没有问题，绝对不会断电。”在缅甸北部城市曼德勒以南约40公里的皎喜镇，永恒酒店经理召召汶指着墙上的证书，信心满满地对记者拍着胸脯，“酒店去年开业，入住率基本在80%，能正常营业真得感谢皎喜电厂！”“将为曼德勒地区提供可靠的电源支撑和保障，解决270万民众的用电问题”让召召汶十分感谢的皎喜电厂，由缅甸NIHC与MCM公司联合投资、中国电建所属山东电力建设第三工程有限公司EPC总承包，于2018年7月开工，2019年4月完成移交。作为缅甸最大的内燃机发电项目，皎喜145MW燃气电站每年产出12.74亿千瓦时清洁电力，电站位于曼德勒南部37公里的皎喜镇，将为曼德勒地区提供可靠的电源支撑和保障，解决270万民众的用电问题。“这座发电厂不仅将大大增加曼德勒地区的电力供给，还通过国家电网供给其它地区，我对皎喜电站克服困难如期投产表示欣慰与赞赏。”5月17日专程出席电站竣工暨投产典礼的缅甸国务资政昂山素季说。昂山素季指出，缅甸目前电力缺口在50%以上，电力发展迫在眉睫，皎喜电厂投入运行后，将会连接国家电网，惠及更多缅甸民众。皎喜镇附近还有缅甸第一家摩托车组装厂KAMAX公司，该厂2017年从仰光搬迁到皎喜。进入厂区，记者看到组装完毕的摩托车整齐地停在厂房内，等待运输到缅甸各地。车间内的生产线上，几十名缅甸工人紧张有序在组装摩托车。“每天能够生产200台摩托车。以前断电时，流水线停止，只能白白浪费时间，而柴油发电机成本会增加好几倍。十分感谢中国公司建设的电厂，提供稳定的电力。”莫吞边说边伸出了大拇指。缅甸电力与能源部部长吴温凯表示，根据统计，2019年5月5日当日，缅甸最高发电量为3078兆瓦。仰光省用电量占全国用电量的41%，曼德勒省占16%，内比都区占5%，其他邦和省的用电量占39%。在用电高峰之际，皎喜电站作为主力电源已开始向曼德勒地区提供持续可靠的电力供应，有效解决了曼德勒人民用电紧缺的燃眉之急。但一座发电厂，仍不能完全解决曼德勒地区的电力缺乏之苦。在曼德勒火车站对面的太平洋酒店，附近有最大的商场和玉石市场，来来往往的客人十分多，但断电一直影响酒店的经营。在曼德勒采访，无论是酒店、餐厅、企业、学校，记者每天都会碰到停电。很多商铺都准备了发电机，但发电机的噪音和昂贵的油费既让顾客烦躁，也让商家痛心。不少市民对记者说：“期待多建几座像皎喜电厂一样的天然气电厂，那样即使在旱季，也不会停电了。”“皎喜电站的如期建成与投用，再次印证了中国电力建设企业的雄厚实力和专业能力”缅甸是一个电力短缺严重的国家，目前缅甸居民电气化率仅有38%，属于全球低水平国家之一。全国1000多万户家庭中多半家庭都在等着用电。提高电力供应，发展电力行业是缅甸政府的优先任务，也是经济发展和人民生活最迫切的需要。昂山素季表示，现在政府正致力于全国通电照明，照明不单单是指电力，是指通电后带来的未来前途光明，不仅照亮每个家庭的生活，还给他们指引了一条道路，因此要优先实施。","情感倾向是积极的。"
"2019-09-07 07:08:48","中国电力建设股份有限公司第一期优先股2019年股息派发实施公告","证券代码：601669 股票简称： 中国电建公告编号：临2019-058债券代码：122193 债券简称：12中水01债券代码：122194 债券简称：12中水02本公司董事会及全体董事保证本公告内容不存在任何虚假记载、误导性陈述或者重大遗漏，并对其内容的真实性、准确性和完整性承担个别及连带责任。重要内容提示：优先股代码：360016优先股简称：电建优1每股优先股派发现金股息人民币5.00元(含税)最后交易日：2019年9月12日股权登记日：2019年9月16日除息日：2019年9月16日股息发放日：2019年9月17日中国电力建设股份有限公司(以下简称“公司”)第一期优先股(简称：电建优1，代码：360016)2019年股息派发方案已于2019年5月28日经公司2018年年度股东大会审议通过，具体实施事项公告如下：一、第一期优先股股息派发方案1、计息期间：2018年9月17日至2019年9月16日2、股权登记日：2019年9月16日3、除息日：2019年9月16日4、股息发放日：2019年9月17日5、发放对象：截至2019年9月16日上海证券交易所收市后，在中国证券登记结算有限责任公司上海分公司登记在册的公司第一期优先股股东。6、发放金额：以公司第一期优先股发行量2,000万股为基数，按照5.00%的票面股息率，向全体优先股股东每股优先股派发现金股息人民币5.00元(含税)，共计人民币100,000,000元(含税)。7、扣税情况：对于居民企业股东(含机构投资者)，由其自行申报缴纳股息所得税，公司向其每股优先股实际派发现金股息人民币5.00元，其他股东股息所得税的缴纳，根据相关规定执行。二、第一期优先股派息方式公司第一期优先股股东的现金股息由公司直接发放。三、咨询方式联系部门：中国电力建设股份有限公司董事会办公室联系电话：010-58381999特此公告。中国电力建设股份有限公司董事会二〇一九年九月七日","该文本情感是积极的。"
"2019-09-03 12:35:01","中电建建筑施工项目存两项违规被重庆住建委通报","重庆市住建委近日对2019年上半年建设工程质量提升行动专项督查的情况进行通报。在通报中，重庆市住建委列举了12则施工单位违法违规的典型案例，中电建建筑集团有限公司施工的高新区洺悦苑项目NF1-2-1/06地块5#楼项目榜上有名。通报显示，洺悦苑项目主要有两项违法违规行为，一是标准养护试件管理混乱，局部混凝土浇筑未留置标准养护试件；二是部分批次的直径14mm钢筋无质量证明文件及出厂检验报告，且未进行复验。资料显示，中电建建筑集团有限公司成立于1958年，拥有房屋建筑工程施工总承包特级资质，是中国电建(601669.SH)的全资子公司，也是其下唯一的房屋建筑平台公司。今年5月，中电建建筑集团有限公司曾因施工现场一名工人戴的安全帽不符合《安全帽》(GB2811-2007)要求，被北京市延庆区住房和城乡建设委员会罚款1千元。","情感倾向是中性。"
