"Date","Title","Content","qwen_lora2_情绪提取"
"2019-12-30 17:58:55","中石油：推动互联网、大数据等技术同主营业务融合","12月26日至27日，中石油集团党组书记、董事长王宜林主持召开2019年学习研讨会，梳理总结2019年主要工作成果，分析当前面临形势，研讨谋划2020年重点任务。对于2020年的工作部署，王宜林要求，持续深化科技创新和管理创新。持续加大科技投入，加大“卡脖子”技术攻关力度。推动互联网、大数据等技术同主营业务的深度融合，努力建成“共享中国石油”。","情感倾向是中性。"
"2019-12-29 09:36:15","中国石油：2019年新增探明油气地质储量当量达到18.4亿吨 创历史新高","记者从中国石油天然气集团有限公司获悉：2019年中国石油持续推进勘探开发，油气增储上产势头良好，全年新增探明油气地质储量当量达到18.4亿吨，创历史新高。这一储量可以保证一个千万吨级油田稳产10年以上。","情感倾向是积极的。"
"2019-12-29 06:31:43","中国石油抱得多个“金娃娃”","记者从中国石油天然气集团有限公司获悉：2019年中国石油持续推进勘探开发，油气增储上产势头良好，全年新增探明油气地质储量当量达到18.4亿吨，创历史新高。这一储量可以保证一个千万吨级油田稳产10年以上。集团董事长王宜林说，中国石油始终将资源战略列为发展的首要任务，突出高效勘探、战略发现、技术引领、规模效益，全年油气勘探捷报频传：先后在鄂尔多斯盆地发现10亿吨级庆城大油田、四川盆地川南页岩气勘探形成万亿立方米大气区、塔里木盆地发现形成博孜—大北两个万亿立方米大气区、准噶尔盆地高探1井在南缘深层勘探取得历史性突破。这些重大勘探成果中的不少项目，都是“金娃娃”级别的大发现，是近年来油气勘探领域少有的丰收年。中国石油以超常规的力度加大勘探开发的投入。2019年风险勘探投资大幅增加，达到50亿元。风险勘探成效也非常显著，取得3项重大突破、4项重要发现等。中国石油注重创新的价值，向技术要突破，向技术要效益，在一些重大项目上取得突破。比如，塔里木盆地博孜9井突破勘探开发的深度极限，发现一个优质、高产、整装千亿立方米超深层凝析气藏。此次勘探攻克超深超高温超高压钻完井技术瓶颈，拓展了对超深储层地质的认识，并实现我国近8000米超深层天然气勘探的重大突破。","情感倾向是积极。"
"2019-12-27 16:10:22","中国石油：国有股份无偿划转完成过户登记","中国石油(601857)12月27日晚间公告，控股股东中国石油集团将其持有的公司5.6亿股A股股份(占公司总股本的0.31%)无偿划转给中冶集团。近日上述国有股份无偿划转的股份过户登记手续已办理完毕。本次无偿划转后，中冶集团持有0.31%公司股份。","该文本情感是中性的。"
"2019-12-27 10:55:45","中国石油：塔里木油田油气产量当量突破2800万吨","中国石油消息，12月25日，塔里木油田油气产量当量继去年迈上2600万吨台阶后，一举突破2800万吨。","所属情感是积极。"
"2019-12-26 14:18:22","中国石油：全力做好天然气冬季高峰期保供工作","12月23日至25日，中国石油2019年度油气田开发年会在京召开。股份公司副总裁李鹭光出席会议，就进一步做好油气田开发工作强调，要进一步强化新区规模有效集中建产，进一步深化改革强化创新，进一步推进绿色安全和谐发展，高质量完成“十四五”规划编制工作。就做好岁末年初收尾起步工作，李鹭光要求，要高质量收好今年的官和开好明年的局；全力做好天然气冬季高峰期保供工作；切实做好冬季生产安全环保工作。","该文本情感是中性的。"
"2019-12-18 17:34:46","中国石油：国有股份无偿划转事项获国资委批准","中国石油(601857)12月18日晚披露国有股份无偿划转进展称，中国石油集团拟将其持有的公司0.31%股权无偿划转给中冶集团。近日，公司接到控股股东中国石油集团的通知，上述国有股份无偿划转事项已于12月18日取得国务院国资委的批准。","情感倾向是中性。"
"2019-12-18 17:30:37","中国石油：国有股份无偿划转事项取得国资委批准","中国石油(601857)12月18日晚间披露国有股份无偿划转进展公告，中国石油集团拟将其持有的公司0.31%股权无偿划转给中冶集团事项取得国务院国资委的批准。","该文本情感是中性的。"
"2019-12-18 17:06:03","中国石油：划转股份事项已获国资委批准","中国石油12月18日公告称，中国石油集团划转公司0.31%的股份给中冶集团的事项已获国资委批准。","以上文本情感极性属于中性。"
"2019-12-10 19:06:45","中石油、中石化接连发公告 资产注入尚未与国家管网达成协议","12月10日晚间，中石油、中石化两大上市公司接连发布公告称，尚未就可能注入的资产与国家管网集团达成协议。中石油(601857.SH)称截至12月10日，公司已与国家管网集团就可能的资产注入事项进行磋商，该等磋商仍处于初步阶段，与国家管网公司尚未就可能的资产注入事项达成协议。中国石化(600028.SH)亦在公告中表示，国家管网集团已于近日成立，公司正在与国家管网集团商讨有关重组事宜，可能涉及到相关的原油、天然气、成品油管网资产。目前，公司尚未就标的资产重组事宜与国家管网集团达成协议。12月9日，国家油气管网公司在北京正式挂牌成立。工商资料资料显示，国家油气管网公司为国有独资企业，注册资本为200亿人民币，成立日期为2019年12月6日，注册地址为北京市朝阳区东土城路5号A座6层08—10室。法定代表人及公司董事长为张伟。据了解，国家油气管网公司主要职责是负责全国油气干线管道、部分储气调峰设施的投资建设，负责干线管道互联互通及与社会管道联通，形成“全国一张网”，负责原油、成品油、天然气的管道输送，并统一负责全国油气干线管网运行调度，定期向社会公开剩余管输和储存能力，实现基础设施向所有符合条件的用户公平开放等。由于涉及到的管网资产非常多，资产评估工作非常复杂，目前有关三桶油的资产划转等工作的进展仍未明晰。但国家管网公司的人事安排一如此前预期。国家管网公司董事长由张伟出任，总经理是侯启军。二者此前分别担任中国石油总经理以及副总经理的职务。12月9日晚间，中石油公告显示，张伟因工作岗位调整，已提交辞呈，辞去本公司副董事长、董事职务。侯启军先生因工作岗位调整，已向本公司提交辞呈， 辞去本公司执行董事、总裁职务。同日晚间，中石化发布公告称于2019年12月9日收到刘中云、王德华的辞职报告。刘中云因工作调整辞去中国石化执行董事、董事会战略委员会委员以及高级副总裁职务，王德华因工作调整辞去中国石化财务总监职务。据了解，刘中云和王德华都曾为国家管网公司筹备组的成员。张伟为筹备组组长，筹备组成员除侯启军、刘中云和王德华外，还包括中石油管道公司总经理、党委书记姜昌亮，中海油副总经理李辉以及中海炼化董事长何仲文。据悉国家管网公司领导班子成员共有8位，除已有上述筹备组成员之外，还包括一名纪委书记。","情感倾向是中性。"
"2019-12-10 18:36:11","两桶油旗下上市公司：尚未与国家管网公司达成资产注入协议","国家石油天然气管网集团有限公司成立后，“两桶油”旗下上市公司纷纷就油气管网资产划拨作出澄清。中国石油天然气股份有限公司(中国石油，601857)12月10日傍晚公告，截至公告日，已与国家管网集团就可能的资产注入事项进行磋商，该等磋商仍处于初步阶段，公司与国家管网公司尚未就可能的资产注入事项达成协议。 中国石油称，公司将在有关法律法规、规范性文件及相关监管要求下进行可能的资产注入事项，且将继续坚持公平公正、市场化的原则，以保障本公司股东的整体利益。与此同时，中国石油化工股份有限公司(中国石化，600028)公告，正在与国家管网集团商讨有关重组事宜，可能涉及到公司相关的原油、天然气、成品油管网资产。截至公告日，公司尚未就标的资产重组事宜与国家管网集团达成协议。中国石化还称，将根据境内外证券监管规定及时履行信息披露义务，并将坚持公平公正、 市场化的原则，以保护公司及股东的合法权益。该等事项仍处于筹划阶段， 具有不确定性。副部级央企国家管网公司于12月9日正式成立。工商信息显示，国家管网公司注册成立时间为12月6日，国务院为唯一股东，注册资本200亿元人民币。但这仅仅是这一外界估值超过3000亿元的巨无霸迈出的第一步，后续仍须经历与三大石油公司之间复杂漫长的资产注入、人员划转过程，由此最终确定股权结构。国家管网公司的主要职责是负责全国油气干线管道、部分储气调峰设施的投资建设，负责干线管道互联互通及与社会管道联通，形成“全国一张网”，负责原油、成品油、天然气的管道输送，并统一负责全国油气干线管网运行调度，定期向社会公开剩余管输和储存能力，实现基础设施向所有符合条件的用户公平开放等。根据市场预测，“三桶油”将纳入国家管网公司的资产包括：国有大型油气企业全资或控股的4兆帕及以上天然气管道及其附属设施，将全部纳入国家管网；国有大型油气企业全资或控股的6.4兆帕及以上原油、成品油管道及其附属设施，全部纳入国家管网；对保供意义重大的储气库和液化天然气(LNG)接收站部分纳入国家管网公司。","情感倾向是中性。"
"2019-12-10 17:44:46","中国石油：已与国家管网集团就资产注入事项进行磋商","中国石油(601857)12月10日晚间公告，公司注意到有媒体报道称公司可能将一定数量的管道资产注入国家管网公司。目前，公司已与国家管网集团就可能的资产注入事项进行磋商，该等磋商仍处于初步阶段，公司与国家管网公司尚未就可能的资产注入事项达成协议。","以上文本情感是中性的。"
"2019-12-09 20:05:32","中国石油：张伟、侯启军已向公司提交辞呈","中国石油(601857)12月9日晚间公告，公司董事会谨此宣布，张伟因工作岗位调整，已向公司提交辞呈，辞去公司副董事长、董事职务。侯启军因工作岗位调整，已向公司提交辞呈，辞去公司执行董事、总裁职务。前述辞任即日生效。张伟将同时卸任董事会投资与发展委员会主任委员职务。侯启军将同时卸任董事会考核与薪酬委员会及健康、安全与环保委员会委员职务。","该文本情感是中性的。"
"2019-12-09 16:54:41","中国石油：副董事长张伟、总裁侯启军辞任","中国石油(601857)12月9日晚间公告，张伟因工作岗位调整，已向公司提交辞呈，辞去公司副董事长、董事职务。侯启军因工作岗位调整，已向公司提交辞呈，辞去公司执行董事、总裁职务。","该文本情感是中性的。"
"2019-12-09 15:48:46","中国石油李树峰：建设“一带一路”要大力加强国际化人才队伍建设","12月9日，中国石油国际勘探开发有限公司副总经济师李树峰在全国上市公司共建“一带一路”国际合作论坛暨跨国投资大会上表示，随着“一带一路”建设走深走实，中国石油企业“走出去”仍然处于难得的重要战略发展机遇期。对于中国企业国际化经营有三点必须高度关注。一是高度重视风险防控。国际业务与本土业务最大的区别就是风险的常态化，境外风险无处不在且随时发生，这些风险包括地缘政治风险、资源国投资环境不确定性风险以及社会安全风险、环保风险、跨文化冲突风险、合规风险等等。因此企业要大力优化资产布局，加强所在国地缘政治、政策法律、经济等风险识别和防控措施研究，积极防范政治风险、经济风险以及社会风险，健全和规范风险管理的制度、流程和标准，依法夯实合规管理基础。二是大力加强国际化人才队伍的建设。高素质的国际化人才队伍始终是企业国际化经营的核心竞争力，必须通过市场化的手段推行职业经理人制度，在全球范围内吸引优秀的国际化人才，加大年轻干部以及短缺人才的培养力度，形成合理的干部和技术力量的梯队。三是切实提高创新发展的能力。当前传统行业正在面临着绿色低碳发展、经济转型升级的巨大冲击，通过数字化、智能化推动科技创新，是传统行业摆脱困境、实现可持续发展的唯一途径。此外，经营理念、商业模式、管理体制的创新，也是切实提升企业价值创造能力和国际化能力的必然选择。","该文本情感是积极的。"
"2019-12-06 10:37:43","中石油集团董事长王宜林：确保归母净利润等指标持续改善","中国石油集团12月5日召开第二届董事会第三十五次会议。会议审议2020年业务发展与投资计划、发行股权融资工具一般性授权、发行债务融资工具一般性授权等议案。中国石油集团董事长王宜林强调，要继续深入实施开源节流降本增效工程，扎实推进净利润提升、亏损治理、“两金”压控、法人压减四个三年行动计划，做好降杠杆减负债专项工作，确保主要成本指标硬下降，归属母公司净利润、净资产收益率、经济增加值等指标持续改善。","情感倾向是中性。"
"2019-11-26 16:41:57","中国石油全面加强人才与创新双轮驱动","11月20日，中国石油集团公司“弘扬爱国奋斗精神、建功立业新时代”总结表彰会在长庆油田召开。中国石油集团党组副书记、副总经理徐文荣参加会议并讲话，为获奖人员颁奖。徐文荣指出，要坚持把党的领导贯穿人才工作始终，深刻理解党中央在广大知识分子中开展“弘扬爱国奋斗精神、建功立业新时代”的重大意义，着力凝聚起广大知识分子、专家人才的报国之情、奋进之志，推动科技创新不断取得新突破。准确把握人才工作实践方向，以高度的政治责任感和历史使命感，牢牢掌握人才工作主动权。大力实施创新驱动战略和人才强企战略，在人才培养开发、评价发现、使用激励、引进用好等方面抓出成效。对照先进取长补短，宣传好广大知识分子弘扬爱国奋斗精神的典型，结合实际，创造性地开展工作，不断开创各类人才奋进新时代的生动局面。会前，徐文荣看望了“人民楷模”“改革先锋”“新时期铁人”王启民，转达了中共中央组织部关于“人民楷模”有关待遇的文件精神，通报了集团公司党组和大庆油田党委在医疗、工作和生活等方面研究形成的完整方案。王启民表示，又一次感受到党中央的关怀和中国石油的温暖，所获得的国家荣誉是60年来石油人接续奋斗的结晶。会上，大庆油田、长庆油田、吉林石化、东方物探、勘探院、管研院6家单位进行经验交流介绍，大庆油田伍晓琳、新疆油田郭旭光、东方物探陶知非、石化院钟海军4名受表彰的典型人物代表做大会发言。一个个感人肺腑的事迹生动诠释着石油人“我为祖国献石油”的责任和担当。中国石油集团公司总经理助理、人事部总经理刘志华做主题报告。王启民做弘扬爱国奋斗精神报告。","该文本情感是积极的。"
"2019-11-25 20:03:37","央企股权无偿划转再现：中国石油向中冶划转5.6亿A股股份","中国石油天然气股份有限公司(下称中国石油，601857)11月25日公告，当天接到控股股东中国石油天然气集团有限公司(下称中国石油集团)转来的《中国石油天然气集团有限公司关于无偿划转中国石油天然气股份有限公司国有股份的通知》，中国石油集团拟通过无偿划转方式将其持有的中国石油5.6亿股A股股份划转给中国冶金科工集团有限公司(下称中冶集团)。 上述无偿划转是“为加强中国石油集团与中冶集团战略合作，拓宽合作领域，优化本公司股权结构。”本次无偿划转完成后，中国石油集团所持有中国石油A股股份占该公司总股本的80.25%；中冶集团将持有中国石油5.6亿股A股股份，占该公司总股本的0.31%。按照当日收盘价5.71元/股计算，上述拟划转股权对应的市值约32亿元。近年来，中国石油集团已屡次向其它央企无偿划转上市公司股份，发生在其他央企之间的国有股权划转亦不罕见。2016年以来，包括中国石油集团、鞍钢集团、武钢集团、诚通集团、宝钢集团、中船集团、中国远洋集团在内的央企均进行过交叉持股。分析人士认为，与混合所有制改革相比，国有企业之间交叉持股不会给国有资本带来流失风险，或能降低改革成本，是国企改革的一条新路径。中国石油、宝钢两大集团之间曾互换旗下上市公司股份。2016年6月，中国石油发布公告称，为加强中国石油集团与宝钢集团的战略合作，优化公司股权结构，中国石油集团拟通过无偿划转方式将持有的中国石油6.24亿股(占公司总股本的0.34%)划转给宝钢集团。同年8月，宝钢股份表示，为加强宝钢集团与中国石油集团战略合作，优化公司资本结构，宝钢集团拟通过无偿划转方式将持有的宝钢股份8亿股A股股份(占总股本的4.86%)划转给中国石油集团。2017年，中国石油与鞍钢集团之间也上演了类似的“礼尚往来”。中国石油在11月25日的公告中称，本次无偿划转不会导致控股股东及实际控制人发生变更，且尚需取得国务院国有资产监督管理委员会的批准。","该文本情感是积极的。"
"2019-11-25 18:02:54","中国石油：控股股东拟无偿划转5.6亿股A股股份给中冶集团","中国石油(601857)11月25日晚公告，为加强中国石油集团与中冶集团战略合作，拓宽合作领域，优化公司股权结构，公司控股股东中国石油集团拟通过无偿划转方式将持有的公司5.6亿股A股股份(占公司总股本的0.31%)划转给中冶集团。","该文本情感是中性的。"
"2019-11-22 17:49:08","中国石油冬供底气足 已落实资源量901亿立方米","11月中旬以来，北京寒风乍起，最低气温达到零下7摄氏度，北方多地也持续降温。据悉，为保障百姓温暖过冬，11月初，中国石油就全面进入冬供模式，从国内增产、增大进口、加快互联互通工程和储气库建设等方面入手，集聚多方力量，调动国内外资源，确保民生用气一方不少，合同用气一方不欠。10月中旬，负责苏里格中部气田开发的长庆油田采气四厂，不但冬季保供的所有工作已全部准备就绪，而且新井增产天然气已达2.4亿立方米。10月30日，河北省雄安新区雄县徐庄村举行了使用天然气的点火仪式，这是雄县第一个“以气代煤”的村庄。冬供前，雄安新区15万户居民家中将全面通气，中国石油全力保障雄安新区天然气稳定供应。据介绍，年初以来，在国家发改委、能源局等有关部委大力支持下，中国石油深入贯彻落实党中央、国务院关于加快推进天然气产供储销体系建设有关指示要求，创下数个历年之最。“中国石油将集聚多方力量，调动国内外资源，确保民生用气一方不少，合同用气一方不欠。”公司生产经营管理部副总经济师钟伟荣说。国内主力气区齐发力天然气产量增量高于往年今年年初以来，中国石油不断加强天然气资源评价，优化产能建设部署，加强老气田精细管理，有序推进非常规气开发，气田增储上产成效显著。一批重点气区、重点层系以及页岩气示范区通过加大产能投入，确保今冬明春日产能力达到3.5亿立方米以上。近年来，中国石油天然气产量一直呈箭头向上态势，继2017年首次突破1000亿立方米之后， 2018年生产天然气1093.7亿立方米，同比增加61亿立方米，增量占全国一半。2019年预计生产天然气1160亿立方米，增加近70亿立方米，是近年来增产量最大的一年，有力支持我国冬季天然气供应。10月3日，塔里木博孜9井喷出高产气流，一个超千亿立方米高产凝析气藏诞生。一年前，天山南部的中秋1井喷出高产气流，塔里木油田形成两个万亿立方米大气区，为西气东输和我国南疆用气开辟了新气源。年初以来，塔里木油田抓住夏季天然气消费淡季时机，加大天然气勘探开发力度。克拉、迪那2、克深、大北等主力气田上产劲头十足，天然气产销齐头并进，有力支持冬季保供。长庆油田承担着京津冀近百座大中城市的保供任务，惠及民众4亿多人。今年年初以来，长庆油田围绕冬供精准制定新井投用数、产量贡献率等考核指标，组织开展“突破400亿，增产保供气”全员全过程劳动竞赛。据了解，截至12月底，长庆油田预计有超过1.8万口气井投入冬供。截至10月7日，长庆油田今年已生产天然气316.82亿立方米。为保障我国川渝滇黔桂五省区市冬季供应，西南油气田常规气和页岩气生产不断提速。10月22日，西南油气田天然气日产量8215万立方米，这是公司天然气日产量首次突破8000万立方米大关，创历史新高。今年年初以来，西南油气田有序推进高石梯—磨溪区块勘探开发，加快非常规天然气开发，持续做好老区稳产工作，天然气日产量持续增长，与去年同期相比增幅超过80%。","情感倾向是积极。"
"2019-11-21 13:38:15","中国石油等国际公司入股阿布扎比原油期货交易所","据中国石油消息，阿布扎比国家石油公司(ADNOC)与洲际交易所(ICE)合作，11月11日宣布成立阿布扎比原油期货交易所(ICEFuturesAbuDhabi)，将推出世界上首批穆尔班原油期货合约。中国石油作为唯一的中资企业参与入股该交易所。专家预测，这可能会改变未来中东原油的定价和交易方式，影响全球1/5原油的价格基准。","情感倾向是积极。"
