"Date","Title","Content","qwen_lora2_情绪提取"
"2019-03-22 03:33:22","中石油中海油去年日赚均超1.4亿元 国家管网公司成立有望重塑油气行业","3月21日，中石油和中海油双双发布2018年年度业绩。继2017年“逆袭”成为中国第二大赚钱的石油公司以来，中海油以527亿元的净利润再次超过净利润525亿元的中石油，两大公司日赚均超1.4亿元。得益于去年前三季度国际油价上行以及成本管控，中海油延续了去年的业绩佳绩。2018年，中海油实现总收入2269亿元，同比增长21.76%；实现净利润527 亿元，同比上升 113.5%。根据财报，2018年，中海油平均实现油价为67.22美元/桶，同比上升27.7%；平均实现天然气价为6.41美元/千立方英尺，同比上升 9.8%。油气销售收入同比上升22.4%至1859亿元。同时，中海油称，公司坚持技术创新和管理创新，助力提质增效，2018年桶油主要成本同比下降6.6%至30.39美元/桶油当量，创造了连续五年成本下降的佳绩，继续保持了成本竞争优势。根据中石油发布的年报，2018年，中石油实现营业额2.35万亿元，经营利润1209.97亿元，分别同比增长16.8%和78.7%；实现归属于母公司股东净利润525.91亿元，同比大幅增长130.7%。其中，勘探与生产板块实现经营利润735.19亿元，同比增加580.44亿元；炼油与化工板块实现经营利润427.56亿元，同比增加27.95亿元；销售板块经营亏损64.50亿元，同比减利147.29亿元；天然气与管道板块实现经营利润255.15亿元，同比增加98.27亿元。2018年，公司平均投资资本回报率呈显著回升态势，资产负债率和资本负债率控制合理水平，分别下降0.6个百分点和2.8个百分点。根据年报，2018年中石油实现原油产量8.9亿桶，同比增长0.4%；可销售天然气产量3.6万亿立方英尺，同比增长5.4%；油气当量产量14.9亿桶，同比增长2.3%；公司实现油气单位操作成本12.31美元/桶，同比增长6.8%，剔除汇率变动影响，同比增长4.6%。中石油董事长王宜林在年报中表示，2018年公司抓住国际油价前三季度震荡上行和天然气需求旺盛等有利时机，优化油气两条业务链运行，持续深化改革创新，深入实施开源节流降本增效，实现了生产经营平稳受控运行，经营业绩持续向好。","该文本情感是积极的。"
"2019-03-22 02:53:10","中国石油去年净利翻倍至526亿元 直面油气管网改革提升国际化程度","3月21日，中国石油(601857)发布2018年年报，去年净利润实现约526亿元，同比增长约1.31倍，其中勘探与生产重回盈利主体，平均资产回报率提升。同日，中国石油在香港举行业绩发布会，公司高管介绍将继续采取有效措施努力控制相关业务亏损，并回应了最新油气管网改革的影响。业绩显示，中国石油2018年实现营业收入2.35万亿元，同比增长16.8%，归属母公司股东净利润525.91亿元，同比增长约1.31倍，基本每股收益0.29元；拟向股东派发0.09元(含税)现金红利。报告期内，公司单位油气操作成本为12.31美元/桶，剔除汇率变动影响，操作成本比上年同期增长4.6%，主要是由于本期动力、材料及人工成本等较上年同期有所增加。分业务来看，勘探与生产板块盈利强劲，实现经营利润约735亿元，比2017年增加了约580亿元，重回集团盈利主体地位；炼油与化工板块实现经营利润也同比增长约7%。相比，销售板块受市场竞争激烈及第四季度油价下跌库存减利等因素影响，去年销售板块经营亏损64.5亿元，同比去年亏损减少。另外，去年天然气与管道板块实现经营利润255.15亿元，同比增长了约六成，但在进口天然气及液化天然气数量大幅增加的情况下，销售进口气净亏损249.07亿元，比上年同期增亏近10亿元。发布会现场，中国石油高管对于亏损业务进一步介绍，销售板块去年亏损主要是因为市场竞争、成品油五连降等因素，预计2019年销售会逐渐好转；另外，如果算上气化、装车、终端零售等成本，天然气销售增销并没有新增亏损。下一步，中国石油将采取控亏措施，包括与中亚相关方谈判，降低采购成本；优化资源结构，根据用气结构进行差异化销售，实现顺价销售；充分利用天然气交易平台，发现天然气市场价值；优化夏冬季供给量比例，灵活安排现货，购买的现货实现灵活限售；扩大天然气终端盈利，对冲部分亏损。财务状况来看，去年中国石油的平均资本回报率呈现显著回升态势，资产负债率和资本负债率均同比下降；现金流状况良好，自由现金流持续为正。根据产能规划，2019年，中国石油计划油气当量合计为1541.2百万桶；原油加工量为1170.4百万桶。日前，中央深改委会议通过油气管网改革方案，包括推动石油天然气管网运营机制改革，要坚持深化市场化改革、扩大高水平开放，组建国有资本控股、投资主体多元化的石油天然气管网公司。这引发了市场对油气行业市场机制的管网改革方向关注，各方预期“国家油气管网公司”的组建将提速。据统计，中国石油在国内运营的油气管道里程占全国的六成以上。至于市场担忧改革会对中国石油带来“大拆分”，中国石油副总裁凌霄回应，改革如果按照市场化运作，相信中国石油不会吃亏；改革之后将会更加有利于油气行业发展。目前下一步改革时间表、改革公司范围还没有明确，公司也尚不得知。但中国石油会积极参与国内油气行业的改革发展。凌霄表示，未来中国石油将会集中力量，加大油气资源开发力度，夯实上游资源基础，加快国产油气生产步伐，同时积极推动进口资源多元化，努力降低进口资源成本，大力开拓市场，提高终端市场，创造效益。去年3月中国石油与阿布扎比国家石油公司签署协议。公司高管表示，中国石油海外业务已经实现跨越式发展，项目遍布几十个国家和项目，这些大部分在“一带一路”倡议沿线国家，以中亚、中东地区为主体，还有一部分在非洲，未来中国石油会加大力度实践该倡议，推动参与海外优质资产的并购，扩大海外油气产量在公司占比，提升国际化程度。","情感倾向是积极。"
"2019-03-21 22:08:27","中国石油2018年净利润大增130.7%","中国石油天然气股份有限公司(中国石油)21日在香港召开2018年业绩发布会。按照国际财务报告准则，2018年，该公司实现归属于母公司股东净利润525.91亿元(人民币，下同)，同比大幅增长130.7%；实现每股基本盈利0.29元，同比增加0.17元。年报显示，按照国际财务报告准则，2018年，中国石油实现营业额2.35万亿元，经营利润1209.97亿元，分别同比增长16.8%和78.7%。同时，该公司平均投资资本回报率呈显著回升态势，资产负债率和资本负债率控制在合理水平，分别下降0.6个百分点和2.8个百分点；现金流状况良好。中国石油执行董事兼总裁侯启军表示，2018年公司经营成果好于预期。海外业务方面，顺利完成阿布扎比2018项目交割，哈萨克斯坦部分项目延期取得重要进展。此外，值得一提的是，中国石油2018年天然气产量再创历史新高。数据显示，该公司实现原油产量8.9亿桶，同比增长0.4%；可销售天然气产量3.6万亿立方英尺，同比增长5.4%；油气当量产量14.9亿桶，同比增长2.3%，其中海外油气当量产量2亿桶，同比增长7.8%，占公司总产量的13.7%。“展望2019年，公司将提升国内勘探开发力度，实现原油产量稳中有升、天然气产量快速增长。推进海外油气业务优质发展，扩大国际化经营成果。”中国石油董事长王宜林如是说。","该文本情感是积极的。"
"2019-03-21 21:42:57","中石油、中海油赚钱的好日子又来了 去年净利翻番均超500亿元","3月21日晚间，中国石油天然气股份有限公司(601857.SH，下称中石油)和中国海洋石油有限公司(00883.HK，下称中海油)接连发布2018年年度业绩报告。2018年国际市场原油市场回暖，前三季价格度震荡上行，国内天然气需求保持强劲，借助上述有利时机，两家公司均交出亮眼成绩单。根据年报，中石油2018年营业额为23535.88亿元，同比增长16.8%，归属于母公司股东的净利润为525.91亿元，比上年同期增加297.93亿元，增幅为130.7%，派发股息每股0.06271元，增加特别派息每股0.02729元。中海油全年净利润增加至人民币527亿元，同比上升113.5%。2018年，中海油每股基本盈利为1.18元人民币，董事会建议派发每股0.40港元的末期股息(含税)。对于业绩变动的原因，中石油在年报中指出，即是抓住了国际油价前三季度震荡上行和天然气需求旺盛的有利时机，优化油气两条业务链运行，实施开源降本增效，实现了生产经营平稳受控运行，经营业绩持续向好。中海油也将盈利的增加归因于国际市场原油价格回暖以及成本严控。油气价量齐升油气勘探方面，两家公司去年在国内及海外均有重大发现。“新疆准格尔盆地继玛湖地区之后又获重大勘探发现，塔里木盆地、四川盆地相继取得油气勘探新突破，鄂尔多斯、柴达木、渤海湾和松辽盆地精细勘探发现和落实了一批估摸储量。”中石油在年报中指出。中海油2018年则在国内成功评价了包括渤中19-6和渤中29-6在内的多个大中型优质整装油气田；在海外，圭亚那Stabroek区块获得5个世界级新发现。其中，渤中19-6气田测试获得优质高产油气流，确定天然气探明地质储量超过一千亿立方米。“渤中19-6气田规模可观，契合华北地区对天然气的巨大需求，还将继续加快开发，今年年底力争实现试验区的开发，未来储量还有很好的增长潜力。”中海油管理层表示。储量、产量的增长叠加油气价格的上扬共同构成了业绩改善的主因。2018年的国际原油价格走势既有前期的震荡上行也有而后的深度下挫，但总体来看较上年同期呈上涨的态势：北海布伦特原油现货年平均价格为71.31美元/桶，同比增逾三成；美国西得克萨斯中质原油现货年平均价格为65.18美元/桶，较上年同期增长28.3%。在此背景下，2018年，中石油原油产量890.3百万桶，比上年同期增长0.4%；可销售天然气产量3607.6十亿立方英尺，比上年同期增长5.4%，油气当量产量1491.7百万桶，比上年同期增长2.3%。勘探与生产板块实现营业额6587亿元，同比增长30%，平均实现原油价格为68.28美元/桶，比2017年的50.64美元/桶增长34.8%。中海油方面全年油气净产量达475百万桶油当量，平均实现油价为67.22美元/桶，同比上升27.7%；平均实现天然气价为6.41美元/千立方英尺，同比上升9.8%。油气销售收入同比上升22.4%至人民币1859亿元。控成本面对“万变”的油价，成本管控是油公司不变的法宝。“油价的问题无法左右，但能通过成本控制来发挥优势。”中海油管理层在2018年全年业绩新闻发布会上表示：“而成本是不可能无限下降，标准化、岸电、智能化、无人化平台，这些都是努力的方向，目前正在进行可行性研究，但创新是主要的方向。”","该文本情感是积极的。"
"2019-03-21 19:57:56","油价大涨业绩飙升 中国石油和中海油去年日均净赚超1.4亿元","3月21日，中国石油和中国海洋石油同时发布了去年年报，受益于国际油价上升，两家公司净利润均超过520亿元，平均每天净赚超过1.4亿元。去年，中国石油实现营业额2.35万亿元，经营利润1209.97亿元，分别同比增长16.8%和78.7%，实现归属于母公司股东净利润525.91亿元，同比大幅增长130.7%。分业务来看，公司勘探与生产板块实现经营利润735.19亿元，同比增加580.44亿元；炼油与化工板块实现经营利润427.56亿元，同比增加27.95亿元；销售板块经营亏损64.50亿元，同比减利147.29亿元；天然气与管道板块实现经营利润255.15亿元，同比增加98.27亿元。中国海洋石油披露称，得益于国际油价上升和良好的成本管控，公司实现营收1859亿元，净利润527亿元，同比上升113.5%。去年，公司平均实现油价为67.22美元/桶，同比上升27.7%；平均实现天然气价为6.41美元/千立方英尺，同比上升9.8%。油气销售收入同比上升22.4%至1859亿元。去年桶油主要成本同比下降6.6%至30.39美元/桶油当量，连续五年成本下降，继续保持了成本竞争优势。","该文本情感是积极的。"
"2019-03-21 19:08:46","中国石油2018年净利润大幅增长130% 位于盈利预期上限","以产量计为中国最大石油公司的中国石油21日宣布，2018年，公司经营业绩持续向好，净利润大幅增长。按照国际财务报告准则，2018年，公司实现营业额2.35万亿元(人民币，下同)，经营利润1,209.97亿元，分别同比增长16.8%和78.7%；实现归属于母公司股东净利润525.91亿元，同比大幅增长130.7%；实现每股基本盈利0.29元，同比增加0.17元。此前的1月22日，中国石油发布公告预计，2018年度实现归属于公司股东的净利润同比增加280亿元到300亿元，同比增长123%到132%。最新业绩报告显示，该公司去年盈利位于预期的上限。其中，勘探与生产板块实现经营利润735.19亿元，同比增加580.44亿元；炼油与化工板块实现经营利润427.56亿元，同比增加27.95亿元；销售板块经营亏损64.50亿元，同比减利147.29亿元；天然气与管道板块实现经营利润255.15亿元，同比增加98.27亿元。2018年，公司平均投资资本回报率呈显著回升态势，资产负债率和资本负债率控制合理水平，分别下降0.6个百分点和2.8个百分点；现金流状况良好。据介绍，中国石油去年大力推动核心业务提质增效，各业务板块生产指标稳中有增。国内勘探与生产突出经济可采储量和效益产量，风险勘探取得一系列的重要突破，原油保持稳产，天然气产量再创历史新高。海外油气业务抓住“一带一路”等机遇，积极推进油气合作，加大高效项目开发力度，油气生产平稳运行。公司实现原油产量8.9亿桶，同比增长0.4%；可销售天然气产量3.6万亿立方英尺，同比增长5.4%；油气当量产量14.9亿桶，同比增长2.3%，其中海外油气当量产量2亿桶，同比增长7.8%，占公司总产量的13.7%；公司实现油气单位操作成本12.31美元/桶，同比增长6.8%，剔除汇率变动影响，同比增长4.6%。炼油化工转型升级加快，重点项目顺利推进，国VI油品质量升级全面完成，航煤等高效产品产量大幅增长。公司加工原油11.2亿桶，同比增长10.4%，生产成品油1.05亿吨，同比增长13.6%；生产乙烯556.9万吨，比上年同期下降3.4%；炼油单位现金加工成本169.38元/吨，与去年同期基本持平。成品油营销能力持续增强，销量稳中有增、销售结构持续优化，终端网络进一步完善。销售汽油、煤油、柴油共1.77亿吨，同比增长4.7%；天然气与管道业务实现量效齐增，国内天然气销量保持两位数增长、高端市场占比不断提高，24项管道互联互通工程等重点项目建成投运。销售天然气2,167.54亿立方米，同比增长8.9%，其中国内销售天然气1,595.53亿立方米，同比增长19.6%。同时，该公司持续深化改革，强化风险管控，筑牢高质量发展基础。2018年，公司重点领域改革稳准推进，开展矿权内部流转，调整完善天然气销售、储气库等业务管理体制，完善内部市场化机制和炼销贸一体化考核机制，有效调动了各层级积极性。展望2019年，公司将继续坚持稳健发展方针，更加注重突出发展核心业务，更加注重扩大开放合作，更加注重推进改革创新，更加注重夯实发展基础，不断开创世界一流国际能源公司建设新局面，为股东带来更好回报。","该文本情感是积极的。"
"2019-03-21 18:42:10","中国石油：2018年净利525.91亿元 同比增130.7%","3月21日，中国石油在港交所发布年报称，2018年净利润525.91亿元，同比增130.7%；2018年全年营收2.35万亿元，同比增长16.8%。实现每股基本收益0.29元，比上年同期增加0.17元。年报称， 中石油2018年财务状况保持稳健，有息债务、资产负债率、资本负债率均有下降；现金流状况良好，自由现金流持续为正。据年报，勘探与生产业务方面，2018年，中石油原油产量8.9亿桶，比上年同期增长0.4%；可销售天然气产量3.61万亿立方英尺，比上年同期增长5.4%，油气当量产量14.92亿桶，比上年同期增长2.3%。截至本报告期末，本集团拥有石油和天然气(含煤层气)探矿权、采矿权总面积2.96亿英亩，其中探矿权面积2.65亿英亩，采矿权面积3070万英亩；正在钻探的净井数为499口。本报告期内完成的多层完井数为9792口。炼油与化工业务方面，2018年，中石油加工原油11.23亿桶，比上年同期增长10.4%，其中加工本集团勘探与生产业务生产的原油6.7亿桶，占比59.7%，产生了良好的协同效应；生产成品油1.05亿吨，比上年同期增长13.6%；生产乙烯556.9万吨，比上年同期下降3.4%。炼化转型升级项目建设有序推进，辽阳石化、华北石化改造项目建成投产，广东石化炼化一体化项目启动建设。此外，年报显示，受市场竞争激烈及第四季度油价下跌库存减利等因素影响，2018年中石油销售板块经营亏损64.50亿元，比2017年的经营利润82.79亿元减少147.29亿元。","该文本情感是积极的。"
"2019-03-21 18:20:19","中国石油：聘任侯启军为公司总裁","中国石油(601857)3月21日晚间公告，董事会同意聘任侯启军为公司总裁。注：侯启军在中国石油天然气行业拥有30余年的工作经验，2017年6月起被聘任为公司董事、副总裁。","情感倾向是积极的。"
"2019-03-18 22:58:23","圆满完成2018冬季保供任务 中石油交出亮眼成绩单","截至3月15日，随着华北地区主要城市供暖季结束，持续5个月的全国冬季供气逐渐步入收尾阶段。相较去年处于风口浪尖，今年冬供在公众舆论视线里低调很多，整个冬季“静悄悄”。这背后是一张亮丽的成绩单。据悉，通过努力筹措资源，去冬今春，中国石油天然气产量预计502亿立方米，同比增加7.9%，增幅再创新高；销售天然气预计880亿立方米以上，同比增长10%。为保障2018年冬供，中国石油成立专项协调组，加快推进天然气产供储销体系建设。“2018年冬季整个上游生产非常给力，在资源供应方面充分体现‘压舱石’作用。”中国石油生产经营部天然气处处长赵堂玉表示。值得关注的亮点是，几个主要数据再创新高。高峰期间日均产量达到3.4亿立方米，刷新历史记录“这是一场不分地区、不分城市、不分你我的保卫战”。这个冬天，天然气产业链全体员工绷紧了弦。2018年以来，中国石油加大国内天然气勘探开发，重点加大长庆、川渝，以及页岩气示范产能建设投入，高月日均产量达3.4亿立方米以上。预计去冬今春天然气产量同比增加37亿方，超冬季保供计划23.5亿方。作为北京、西安、银川等40多座大中城市的供气主力，长庆油田各采气单位以“不累倒一口高产井，不放弃一口低产井，让每一口井都百分之百发挥能效生产”为目标，冬供期间1.2万口气井保持满负荷生产。塔里木油田单日最高输气量7913万立方米，为下游供应天然气99.03亿立方米。入冬以来，西南油气田捷报频传。公司成立产能建设推进领导小组，高效组织生产建设，高石梯-磨溪特大型气田年产能力达130亿立方米，川南页岩气日产量突破2000万立方米，成为国内最大的页岩气生产基地。去冬今春，青海油田生产“气势”强劲，涩北、南八仙、东坪三大气田担负着甘肃、青海、西藏地区的天然气供给任务。除四大主力气区外，吉林油田、大庆油田和华北油田等天然气产量再创新高，有力保障北方天然气供应。LNG单日最大气化量突破1亿立方，接船数量再创新高除国内自产气，进口天然气是国内稳定供应的另一重要保障。据介绍，在外交部、发改委和能源局和支持下，中国石油加大中亚土乌哈三国协调谈判力度，追加中石油阿姆河气田项目产能建设投入，确保中亚气稳定供应。去冬今春预计共进口中亚管道天然气194.4亿立方米，增幅10%。中亚气源中起到“压舱石”作用的土库曼斯坦康采恩气田稳定供应6300万立方米/日左右，同时组织阿姆河气田加快项目投产，实现超计划供气，在国内用气高峰由3700万立方米/日提高到4100万立方米/日。乌兹别克斯坦入冬前设备投产，哈萨克斯坦哈南线顺利投产，两国去冬今春供气量大幅增加。中缅天然气每日平均供气1500万立方米左右。“去冬今春LNG资源非常充足，单日最大气化量突破1亿立方米，这是以前从未有过的。”中国石油生产经营管理部天然气处相关负责人说。中国提早开展LNG进口量谈判，长贸和现货LNG同比增长14.2%和16.3%。入冬以来，江苏、大连和唐山接收站始终保持高罐位满负荷运行。唐山LN接收站高峰期平均每3天接卸2船，大连LNG接收站接卸量同比增加34.97%，江苏LNG接收站外输量同比增长12.4%。储气库单日采气量突破1亿立方米，日采气能力再上新台阶","积极"
"2019-03-18 21:48:54","中石油冬季保供成绩单：天然气产量、储气库单日采气量创新高","随着华北地区主要城市供暖季结束，持续5个月的全国冬季供气步入收尾阶段。澎湃新闻从中国石油天然气集团有限公司(下称中国石油)获悉，去冬今春，中国石油的天然气产量、LNG单日气化量、储气库单日采气量均破历史记录。其中，天然气产量预计502亿立方米，同比增加7.9%，增幅再创新高。销售天然气预计880亿立方米以上，同比增长10%。整个采暖季中，国内三大油气公司单日总销售量持续8天超过10亿立方米，史无前例。为了确保冬季供气平稳过渡，中国油气行业自去年以来全力增储上产，同时在全球范围内多方筹措天然气资源，推动管道互联互通以增强资源的串换互剂能力。国产天然气是冬供主力气源。据中国石油相关负责人介绍，2018年以来，该集团加大国内天然气勘探开发，重点加大长庆、川渝，以及页岩气示范产能建设投入，高峰期间日均产量达到3.4亿立方米，刷新历史记录。预计去冬今春天然气产量同比增加37亿方，超冬季保供计划23.5亿方。除长庆油田、塔里木油田、西南油气田和青海油田四大主力气区外，吉林油田、大庆油田和华北油田等天然气产量再创新高，为北方天然气供应增添保障。除国内自产气外，进口天然气是国内稳定供应的另一重要保障。中国进口天然气通道主要包括中亚管道、中缅管道和海上进口液化天然气(LNG)。在外交部、国家发改委和能源局的支持下，中国石油加大中亚土乌哈三国协调谈判力度，追加中石油阿姆河气田项目产能建设投入，确保中亚气稳定供应。去冬今春预计共进口中亚管道天然气194.4亿立方米，增幅10%。其中，中亚气源中起到“压舱石”作用的土库曼斯坦康采恩气田稳定供应6300万立方米/日左右，同时组织阿姆河气田加快项目投产，实现超计划供气，在国内用气高峰由3700万立方米/日提高到4100万立方米/日。乌兹别克斯坦入冬前设备投产，哈萨克斯坦哈南线顺利投产，两国去冬今春供气量大幅增加。中缅天然气每日平均供气1500万立方米左右。LNG是历年冬天供应调峰的最灵活资源。特别是在冬季保供中，LNG彰显优势，是应急调峰的重要气源保障。“去冬今春LNG资源非常充足，单日最大气化量突破1亿立方米，这是以前从未有过的。”中国石油生产经营管理部天然气处相关负责人说。中国提早开展LNG进口量谈判，长贸和现货LNG同比增长14.2%和16.3%。去年入冬以来，中国石油江苏、大连和唐山LNG接收站始终保持高罐位满负荷运行。唐山LNG接收站高峰期平均每3天接卸2船，大连LNG接收站接卸量同比增加34.97%，江苏LNG接收站外输量同比增长12.4%。","积极。"
